date,link,text,resolved_text,ccode,country,leadid,pre_in_post_term,coreference_resolved_ind,main_cluster_identified,number_spans_replaced,abbott
2014-01-04,https://www-proquest-com.proxy.uchicago.edu/abicomplete/docview/1474880487/fulltext/E5346FE98384BA0PQ/17?accountid=14657,"Not long after voting in Tony Abbott's team, Australians are having second thoughts 
AS POLITICAL honeymoons go Tony Abbott's has proved elusive, even invisible. Mr Abbott (pictured above) became Australia's prime minister almost four months ago, when he led the conservative Liberal-National coalition to a comfortable victory over an unpopular Labor government. By the end of the year, however, the unpopularity had shifted to the new government. No prime minister in memory has fallen so quickly from voters' grace. 
Surveys conducted in November and December by Australia's two main pollsters, Nielsen and Newspoll, both showed Labor ahead of the coalition by 52 points to 48. The coalition won 53.5% of the vote at the election last September against Labor's 46.5%, after distribution of second preference votes. John Stirton, of Nielsen, says that in 40 years of polling, his firm has never seen a swing of such magnitude against a new administration. Governments have usually basked in polling honeymoons of up to two years. This time, the post-election swing is against it. 
Besides bad polls, problems now loom over the government's handling of the economy. On December 17th a Treasury update on the fiscal year from July 2013 painted a chilling picture. The budget deficit had more than doubled from its original projection last May to A$47 billion ($42 billion). Growth had slowed, and unemployment was forecast to rise slightly, to 6%. Falling revenue and the legacy of stimulus spending under Labor played some part in what the Treasury called the ""deterioration"". The Treasury also cited the new government's promised grant of almost A$9 billion to the central bank to help it manage future crises, and some of its policies such as the projected repeal of a carbon tax. Mr Abbott has retreated from his promise a year ago of a surplus in each of his government's first three years. 
Even before this sober reality, the government was looking clumsy. Mr Abbott's apparent insouciance over revelations in November that Australia had spied on Indonesia's leaders made that furore worse. The government in Jakarta then withdrew co-operation over dealing with people-smugglers who were sending asylum-seekers in boats to Australia. This imperils another of Mr Abbott's election promises, to ""stop the boats"". 
Damage from arrogant performances by two of Mr Abbott's senior ministers has also been self-inflicted. Once, the immigration department revealed numbers and nationalities of asylum-seekers arriving by boat. Scott Morrison, the new government's immigration minister, banned such disclosures. Instead, flanked by an army commander to highlight the government's military-led operation against boat people, Mr Morrison holds weekly briefings, where he reveals only what he chooses. In a statement on December 27th to mark the ""first 100 days of Operation Sovereign Borders"", Mr Morrison declared: ""The boats have not yet stopped, but they are stopping."" The press lampooned him. 
In November Christopher Pyne, the education minister, reneged on the coalition's promise to implement the former Labor government's education-finance reforms. They stemmed from a report two years ago by David Gonski, a leading business figure, who called on Canberra and the states to spend an extra A$5 billion a year, especially to raise public-school standards, where Australia has slipped lower in world league tables. The Abbott government underestimated the public backlash to its ditching of this popular measure; it was forced to reinstate it. Mr Abbott even tried to explain his original promise as one ""that some people thought that we made"". 
Collectively, the government's performance has fed voters' long-standing doubts about Mr Abbott. The doubts have surfaced in the conservative Liberal Party, which Mr Abbott leads. John Fahey, a finance minister in the former coalition government, under John Howard, says Mr Abbott was not ""known for his judgment"" then, and has not taken his ""best team into government"" now. 
As opposition leader, Mr Abbott played tough against a divided Labor government, but offered few sturdy policies. Mr Stirton reckons Australians changed government in September mainly to be rid of Labor. Mr Abbott, he says, is ""the least popular opposition leader ever to be elected to the prime ministership"". 
Mr Abbott has plenty of time to hone his judgments; the next election is due in 2016. In a report to Australians on his government's first 100 days, he said it was ""purposefully, carefully and methodically"" building its ""policy foundations"". So far, at least, voters seem uncertain about both the policies and their foundations.","Not long after voting in Tony Abbott's team , Australians are having second thoughts 
 AS POLITICAL honeymoons go Tony Abbott's has proved elusive , even invisible . Tony Abbott became Australia 's prime minister almost four months ago , when Tony Abbott led the conservative Liberal - National coalition to a comfortable victory over an unpopular Labor government . By the end of the year , however , the unpopularity had shifted to the new government . No prime minister in memory has fallen so quickly from voters ' grace . 
 Surveys conducted in November and December by Australia 's two main pollsters , Nielsen and Newspoll , both showed Labor ahead of the coalition by 52 points to 48 . The coalition won 53.5 % of the vote at the election last September against Labor 's 46.5 % , after distribution of second preference votes . John Stirton , of Nielsen , says that in 40 years of polling , his firm has never seen a swing of such magnitude against a new administration . Governments have usually basked in polling honeymoons of up to two years . This time , the post - election swing is against it . 
 Besides bad polls , problems now loom over the government 's handling of the economy . On December 17th a Treasury update on the fiscal year from July 2013 painted a chilling picture . The budget deficit had more than doubled from its original projection last May to A$ 47 billion ( $ 42 billion ) . Growth had slowed , and unemployment was forecast to rise slightly , to 6 % . Falling revenue and the legacy of stimulus spending under Labor played some part in what the Treasury called the "" deterioration "" . The Treasury also cited the new government 's promised grant of almost A$ 9 billion to the central bank to help it manage future crises , and some of its policies such as the projected repeal of a carbon tax . Tony Abbott has retreated from Tony Abbott's promise a year ago of a surplus in each of Tony Abbott's government 's first three years . 
 Even before this sober reality , the government was looking clumsy . Tony Abbott's apparent insouciance over revelations in November that Australia had spied on Indonesia 's leaders made that furore worse . The government in Jakarta then withdrew co - operation over dealing with people - smugglers who were sending asylum - seekers in boats to Australia . This imperils another of Tony Abbott's election promises , to "" stop the boats "" . 
 Damage from arrogant performances by two of Tony Abbott's senior ministers has also been self - inflicted . Once , the immigration department revealed numbers and nationalities of asylum - seekers arriving by boat . Scott Morrison , the new government 's immigration minister , banned such disclosures . Instead , flanked by an army commander to highlight the government 's military - led operation against boat people , Mr Morrison holds weekly briefings , where he reveals only what he chooses . In a statement on December 27th to mark the "" first 100 days of Operation Sovereign Borders "" , Mr Morrison declared : "" The boats have not yet stopped , but they are stopping . "" The press lampooned him . 
 In November Christopher Pyne , the education minister , reneged on the coalition 's promise to implement the former Labor government 's education - finance reforms . They stemmed from a report two years ago by David Gonski , a leading business figure , who called on Canberra and the states to spend an extra A$ 5 billion a year , especially to raise public - school standards , where Australia has slipped lower in world league tables . The Tony Abbott government underestimated the public backlash to its ditching of this popular measure ; it was forced to reinstate it . Tony Abbott even tried to explain Tony Abbott's original promise as one "" that some people thought that we made "" . 
 Collectively , the government 's performance has fed voters ' long - standing doubts about Tony Abbott . The doubts have surfaced in the conservative Liberal Party , which Tony Abbott leads . John Fahey , a finance minister in the former coalition government , under John Howard , says Tony Abbott was not "" known for Tony Abbott's judgment "" then , and has not taken Tony Abbott's "" best team into government "" now . 
 As opposition leader , Tony Abbott played tough against a divided Labor government , but offered few sturdy policies . Mr Stirton reckons Australians changed government in September mainly to be rid of Labor . Tony Abbott , he says , is "" the least popular opposition leader ever to be elected to the prime ministership "" . 
 Tony Abbott has plenty of time to hone Tony Abbott's judgments ; the next election is due in 2016 . In a report to Australians on Tony Abbott's government 's first 100 days , Tony Abbott said it was "" purposefully , carefully and methodically "" building its "" policy foundations "" . So far , at least , voters seem uncertain about both the policies and their foundations .",900,Australia,cb-900-2,IN TERM,True,Tony Abbott 's,24,True
2014-02-01,https://www-proquest-com.proxy.uchicago.edu/abicomplete/docview/1493830835/fulltext/BFBF8B15DD024C1EPQ/32?accountid=14657,"Tony Abbott's draconian approach has its costs 
THE Australian prime minister, Tony Abbott, likens his government's campaign to stop asylum-seekers landing in the country by boat to a military campaign. Four months after he led the conservative Liberal-National coalition to power promising to ""stop the boats"", Mr Abbott is claiming victory in ""Operation Sovereign Borders"". On January 24th his immigration minister, Scott Morrison, claimed that no boat people had arrived in Australian waters for more than a month, the longest boat-free period for nearly five years. Yet Australia's relations with Indonesia, its northern neighbour and the main embarkation point for boat people, have suffered. Marty Natalegawa, Indonesia's foreign minister, calls the Australian approach a ""slippery slope"" which could ""get out of hand"". 
In promising to turn back the boats, Mr Abbott has taken the populist path on boat people that John Howard, his mentor and a former coalition prime minister, promoted over a dozen years ago. Tapping voters' fears about boats swarming from Asia, Mr Howard banished their passengers to camps in Papua New Guinea and Nauru. Ensuing Labor governments were critical of the hardline policy. But in July the then Labor government, under Kevin Rudd, turned more draconian itself. It decreed that those in the camps who won refugee claims would be resettled in Papua New Guinea but never in Australia. After 16,000 asylum-seekers on 220 boats arrived in the first seven months of last year, boat numbers dropped sharply. The slowdown, for which Mr Abbott claims credit, began before he won power in September. 
In ordering the navy to stop vessels carrying asylum-seekers from entering Australian waters--by pushing them back towards Indonesia instead--Mr Abbott has acted in the face of Indonesian objections. In contrast to previous governments, he has also shrouded the operation in secrecy. War against people-smugglers, Mr Abbott says, should not involve giving out ""information...of use to the enemy"". 
Press reports in Australia and Indonesia suggest the navy has pushed up to six boats back. Asylum-seekers on one boat in early January told the Australian Broadcasting Corporation (ABC) that they were badly burned when Australian sailors forced them to touch parts of their boat's engine. Mr Abbott endorsed the navy's denials of having done anything wrong and accused ABC of lacking patriotism. 
It has since emerged that in at least one operation, navy vessels entered Indonesian waters without authority. Indonesia is livid. It has deployed its own warships and military radar to monitor Australia's movements. Mr Natalegawa says Indonesia is ""keen to ensure our sovereign border is properly protected"". Australia has since apologised to Indonesia. But Mr Abbott's explanation of how a modern navy could inadvertently have entered Indonesian waters raises more questions. On January 28th he suggested the ships' commanders could have been distracted by winds, tides and ""all sorts of things"" at sea. His tone echoed the evasive response to revelations in November about Australia's phone-tapping of Indonesian leaders. 
Mr Abbott had promised that Indonesia would be at the heart of his foreign policy. Yet the boats controversy is as damaging as the phone-tapping scandal. Legal experts also say that Australia might have breached its obligations under the United Nations refugee convention by pushing asylum-seekers to another country. (Australia holds more than 4,000 boat people in camps on Christmas Island, an Australian territory, and in Papua New Guinea and Nauru.) 
Criticisms are mounting at home. John Ingram, a retired navy captain, calls the boats policy ""morally corrupt and indefensible"". He worries that sailors are being used ""for political purposes"". John Menadue, a former immigration head, calls the operation ""provocative, insensitive, crass"", a blot on a hitherto good Australian record on refugees. ""With cruelty over boats behind us,"" Mr Menadue says, the government should make amends by sharply lifting Australia's refugee intake through conventional UN channels, from 20,000 last year. The prospect that the Abbott government will take his advice is slight.","Tony Abbott's has Tony Abbott's costs 
 THE Australian prime minister , Tony Abbott , likens his government 's campaign to stop asylum - seekers landing in the country by boat to a military campaign . Four months after he led the conservative Liberal - National coalition to power promising to "" stop the boats "" , Mr Abbott is claiming victory in "" Operation Sovereign Borders "" . On January 24th his immigration minister , Scott Morrison , claimed that no boat people had arrived in Australian waters for more than a month , the longest boat - free period for nearly five years . Yet Australia 's relations with Indonesia , its northern neighbour and the main embarkation point for boat people , have suffered . Marty Natalegawa , Indonesia 's foreign minister , calls Tony Abbott a "" slippery slope "" which could "" get out of hand "" . 
 In promising to turn back the boats , Mr Abbott has taken the populist path on boat people that John Howard , his mentor and a former coalition prime minister , promoted over a dozen years ago . Tapping voters ' fears about boats swarming from Asia , Mr Howard banished their passengers to camps in Papua New Guinea and Nauru . Ensuing Labor governments were critical of the hardline policy . But in July the then Labor government , under Kevin Rudd , turned more draconian itself . It decreed that those in the camps who won refugee claims would be resettled in Papua New Guinea but never in Australia . After 16,000 asylum - seekers on 220 boats arrived in the first seven months of last year , boat numbers dropped sharply . The slowdown , for which Mr Abbott claims credit , began before he won power in September . 
 In ordering the navy to stop vessels carrying asylum - seekers from entering Australian waters -- by pushing them back towards Indonesia instead -- Mr Abbott has acted in the face of Indonesian objections . In contrast to previous governments , he has also shrouded the operation in secrecy . War against people - smugglers , Mr Abbott says , should not involve giving out "" information ... of use to the enemy "" . 
 Press reports in Australia and Indonesia suggest the navy has pushed up to six boats back . Asylum - seekers on one boat in early January told the Australian Broadcasting Corporation ( ABC ) that they were badly burned when Australian sailors forced them to touch parts of their boat 's engine . Mr Abbott endorsed the navy 's denials of having done anything wrong and accused ABC of lacking patriotism . 
 It has since emerged that in at least one operation , navy vessels entered Indonesian waters without authority . Indonesia is livid . It has deployed its own warships and military radar to monitor Australia 's movements . Mr Natalegawa says Indonesia is "" keen to ensure our sovereign border is properly protected "" . Australia has since apologised to Indonesia . But Mr Abbott 's explanation of how a modern navy could inadvertently have entered Indonesian waters raises more questions . On January 28th he suggested the ships ' commanders could have been distracted by winds , tides and "" all sorts of things "" at sea . His tone echoed the evasive response to revelations in November about Australia 's phone - tapping of Indonesian leaders . 
 Mr Abbott had promised that Indonesia would be at the heart of his foreign policy . Yet the boats controversy is as damaging as the phone - tapping scandal . Legal experts also say that Australia might have breached its obligations under the United Nations refugee convention by pushing asylum - seekers to another country . ( Australia holds more than 4,000 boat people in camps on Christmas Island , an Australian territory , and in Papua New Guinea and Nauru . ) 
 Criticisms are mounting at home . John Ingram , a retired navy captain , calls the boats policy "" morally corrupt and indefensible "" . He worries that sailors are being used "" for political purposes "" . John Menadue , a former immigration head , calls the operation "" provocative , insensitive , crass "" , a blot on a hitherto good Australian record on refugees . "" With cruelty over boats behind us , "" Mr Menadue says , the government should make amends by sharply lifting Australia 's refugee intake through conventional UN channels , from 20,000 last year . The prospect that the Abbott government will take his advice is slight .",900,Australia,cb-900-2,IN TERM,True,Tony Abbott 's draconian approach,3,True
