date,link,text,resolved_text,ccode,country,leadid,pre_in_post_term,coreference_resolved_ind,main_cluster_identified,number_spans_replaced,abbott
2015-05-23,https://www-proquest-com.proxy.uchicago.edu/abicomplete/docview/1683393681/fulltext/29E503657FA94FE4PQ/15?accountid=14657,"India is reaching out to the world 
""FOREIGN POLICY IS fun, to an extent it is theatre,"" says Shivshankar Menon, who was India's national security adviser until last year. He recalls a prime minister who so enjoyed talking about foreign policy that he let meetings on the subject run for three times their scheduled length. 
Narendra Modi obviously loves it too. As Gujarat's chief minister he showed unusual interest in other countries, visiting Japan, China and Britain, and hosting investor jamborees. As prime minister he has put more energy into foreign policy than anything else. 
By giving so much attention to foreign affairs, Mr Modi has sidelined his foreign minister, Sushma Swaraj. By now he has spent 52 days of his first year abroad, visiting America, Japan, Brazil and Germany, among other countries. Many trips were overdue. It had been 28 years since an Indian prime minister had last paid a bilateral call on Sri Lanka or Australia; for Canada, the gap was 42 years. 
India's top diplomat, Subrahmanyam Jaishankar, says this is about more than appearances. India, he explains, now aspires to be a ""leading power, not just a balancing power"". That means it has become less self-effacing, abandoning talk of a ""no-frills"" foreign policy of non-alignment. India is also hoping to boost its share of world trade from 2% to 3.5% by 2020. Mr Modi is playing his part. He has established warm relations with Japan's Shinzo Abe and Australia's Tony Abbott. In his first year, he says, he has met 50 national leaders for direct talks. 
An immediate goal, of being seen to play an important international role, has been achieved. ""India is back in the news,"" says Tanvi Madan, of the Brookings Institution, a think-tank. Mr Menon claims his successors are mostly continuing with the country's previous policy, ""but they present it more forcefully."" Making a greater impact requires more manpower, including a bigger diplomatic corps. India has long been famous for having a mere 800 diplomats. The foreign ministry claims it actually has 2,500, but that figure results from a new way of counting them, not extra recruitment. 
A more determined approach is showing up in two areas. One is the immediate neighbourhood. Mr Jaishankar says that ""you cannot be a leading power if your neighbourhood is not with you, you need it to root for you."" So India is promoting cross-border trade and a regional electricity grid (some of its neighbours have massive hydropower potential), creating infrastructure on its borders, relaxing visas and doling out aid. After last month's devastating earthquake in Nepal, India was quick to take a leading role in the relief effort. It wants to end the perception that it meddles and bullies, though rumours still swirled that it helped sway Sri Lanka's election in January. 
Old enemies, new friends 
The obvious problem is Pakistan. India has a ""SAARC-minus-one"" strategy of integrating South Asia's economies over the next decade, working with the South Asian Association for Regional Co-operation but isolating Pakistan. So far Mr Modi's handling of the old rival has not been coherent: he welcomed Nawaz Sharif, its prime minister, to his inauguration in May last year, then used a pretext to cancel talks between the two countries' foreign secretaries. Relations deteriorated as the bloodiest border clashes in 11 years broke out in October, but this relationship looks unlikely to shift much for better or worse. 
The second new emphasis in foreign policy concerns ties with America and the West generally. In Mr Menon's day India was already drifting westwards as memories of the cold war faded, economic ties strengthened and Pakistan's relations with the West became more strained. But India hedged, keen to avoid confrontation with China. 
Under Mr Modi the westward tilt has become more explicit. That was partly China's doing. During a visit to India by Xi Jinping, the Chinese leader, Chinese soldiers crossed a disputed border and camped in Himalayan territory that India considers its own, humiliating a man who had boasted he would secure the frontier. Later, China twice sent a military submarine to Colombo, Sri Lanka's capital. Mr Modi took offence. 
In January Barack Obama was the chief guest at India's Republic Day celebrations. The countries issued a joint security statement on stability in Asia, calling for freedom of navigation in and over the South China Sea, where China is needling its neighbours. The same visit delivered what Mr Obama called a ""breakthrough in understanding"" over the liability of suppliers to any civil-nuclear power plants. Details remain fuzzy, but heavy American investment in energy would deepen ties. 
Defence is another area ripe for co-operation. India is opening its defence industry to foreign, most likely Western, investors. In July 2014 a cap on foreign investment in domestic defence projects was increased to 49%, though investors may not be tempted to put money in until the government starts buying more defence kit. Bizarrely, on a trip to France in April Mr Modi announced an order for 36 Rafale fighter jets to be made in France, undercutting his own procurement strategy. 
Even so, India's co-operation with the West will become closer as it buys less military hardware from Russia (and as Russia becomes friendlier with Pakistan). That co-operation extends even into space: last September India got a spacecraft to orbit around Mars, with some navigational help from NASA. India's public seems to approve. Surveys by the Pew Research Centre show that it generally favours the West. In a poll in 2014, 55% of Indians said they liked America. One reason is that many millions of them have relatives who live, study and work there.
Caption: Fifty leaders and counting","India is reaching out to the world 
""FOREIGN POLICY IS fun, to an extent it is theatre,"" says Shivshankar Menon, who was India's national security adviser until last year. He recalls a prime minister who so enjoyed talking about foreign policy that he let meetings on the subject run for three times their scheduled length. 
Narendra Modi obviously loves it too. As Gujarat's chief minister he showed unusual interest in other countries, visiting Japan, China and Britain, and hosting investor jamborees. As prime minister he has put more energy into foreign policy than anything else. 
By giving so much attention to foreign affairs, Mr Modi has sidelined his foreign minister, Sushma Swaraj. By now he has spent 52 days of his first year abroad, visiting America, Japan, Brazil and Germany, among other countries. Many trips were overdue. It had been 28 years since an Indian prime minister had last paid a bilateral call on Sri Lanka or Australia; for Canada, the gap was 42 years. 
India's top diplomat, Subrahmanyam Jaishankar, says this is about more than appearances. India, he explains, now aspires to be a ""leading power, not just a balancing power"". That means it has become less self-effacing, abandoning talk of a ""no-frills"" foreign policy of non-alignment. India is also hoping to boost its share of world trade from 2% to 3.5% by 2020. Mr Modi is playing his part. He has established warm relations with Japan's Shinzo Abe and Australia's Tony Abbott. In his first year, he says, he has met 50 national leaders for direct talks. 
An immediate goal, of being seen to play an important international role, has been achieved. ""India is back in the news,"" says Tanvi Madan, of the Brookings Institution, a think-tank. Mr Menon claims his successors are mostly continuing with the country's previous policy, ""but they present it more forcefully."" Making a greater impact requires more manpower, including a bigger diplomatic corps. India has long been famous for having a mere 800 diplomats. The foreign ministry claims it actually has 2,500, but that figure results from a new way of counting them, not extra recruitment. 
A more determined approach is showing up in two areas. One is the immediate neighbourhood. Mr Jaishankar says that ""you cannot be a leading power if your neighbourhood is not with you, you need it to root for you."" So India is promoting cross-border trade and a regional electricity grid (some of its neighbours have massive hydropower potential), creating infrastructure on its borders, relaxing visas and doling out aid. After last month's devastating earthquake in Nepal, India was quick to take a leading role in the relief effort. It wants to end the perception that it meddles and bullies, though rumours still swirled that it helped sway Sri Lanka's election in January. 
Old enemies, new friends 
The obvious problem is Pakistan. India has a ""SAARC-minus-one"" strategy of integrating South Asia's economies over the next decade, working with the South Asian Association for Regional Co-operation but isolating Pakistan. So far Mr Modi's handling of the old rival has not been coherent: he welcomed Nawaz Sharif, its prime minister, to his inauguration in May last year, then used a pretext to cancel talks between the two countries' foreign secretaries. Relations deteriorated as the bloodiest border clashes in 11 years broke out in October, but this relationship looks unlikely to shift much for better or worse. 
The second new emphasis in foreign policy concerns ties with America and the West generally. In Mr Menon's day India was already drifting westwards as memories of the cold war faded, economic ties strengthened and Pakistan's relations with the West became more strained. But India hedged, keen to avoid confrontation with China. 
Under Mr Modi the westward tilt has become more explicit. That was partly China's doing. During a visit to India by Xi Jinping, the Chinese leader, Chinese soldiers crossed a disputed border and camped in Himalayan territory that India considers its own, humiliating a man who had boasted he would secure the frontier. Later, China twice sent a military submarine to Colombo, Sri Lanka's capital. Mr Modi took offence. 
In January Barack Obama was the chief guest at India's Republic Day celebrations. The countries issued a joint security statement on stability in Asia, calling for freedom of navigation in and over the South China Sea, where China is needling its neighbours. The same visit delivered what Mr Obama called a ""breakthrough in understanding"" over the liability of suppliers to any civil-nuclear power plants. Details remain fuzzy, but heavy American investment in energy would deepen ties. 
Defence is another area ripe for co-operation. India is opening its defence industry to foreign, most likely Western, investors. In July 2014 a cap on foreign investment in domestic defence projects was increased to 49%, though investors may not be tempted to put money in until the government starts buying more defence kit. Bizarrely, on a trip to France in April Mr Modi announced an order for 36 Rafale fighter jets to be made in France, undercutting his own procurement strategy. 
Even so, India's co-operation with the West will become closer as it buys less military hardware from Russia (and as Russia becomes friendlier with Pakistan). That co-operation extends even into space: last September India got a spacecraft to orbit around Mars, with some navigational help from NASA. India's public seems to approve. Surveys by the Pew Research Centre show that it generally favours the West. In a poll in 2014, 55% of Indians said they liked America. One reason is that many millions of them have relatives who live, study and work there.
Caption: Fifty leaders and counting",900,Australia,cb-900-2,,False,,0,True
2015-05-23,https://www-proquest-com.proxy.uchicago.edu/abicomplete/docview/1683394049/fulltext/29E503657FA94FE4PQ/40?accountid=14657,"South-East Asia's boat people shame the whole region 
FOR nearly three months a small green fishing boat has chugged around South-East Asia's vast blue waters, packed with people no one wants. At first the 300 or so refugees on board--most of them Rohingyas, a Muslim ethnic-minority persecuted in Myanmar--were guided by people-smugglers. But after their traffickers fled, fearing arrest, they sailed on alone and with no clear destination, prevented from reaching the shores of Thailand and Malaysia by naval patrols. When a small vessel carrying journalists from the BBC and New York Times pulled alongside, hurling bottled water onto the decks, one passenger claimed that ten of their number had died. Their voyage finally ended on May 20th when Indonesian fishermen rescued them. 
The ship was one of many which have drifted in the Strait of Malacca and the Andaman Sea in recent weeks, bearing thousands of people. Some of them are escaping poverty and oppression in their home countries, mainly Myanmar and Bangladesh; a few are victims of kidnappings, their captors intending to demand ransoms for their release. Since the start of May, when a police crackdown in Thailand started to block the land routes over which criminals have long smuggled Rohingyas and other migrants, more than 3,000 of them have scrambled onto beaches in Malaysia and Indonesia. Yet all three countries have turned boats away in sight of shore, at times giving them directions to their neighbour's waters. On May 20th Malaysia and Indonesia at last agreed to stop pushing away boats, but only after much international pressure. It has been a callous and haphazard response from a region that boasts of its deepening integration, and which wants to bolster its standing in the world. 
South-East Asian countries rightly insist that the problem's source, and its only lasting solution, lies in Myanmar. For years it has persecuted its Rohingya minority. The country's government--and, as far as can be gauged, almost all its people--regards Rohingyas as illegal Bengali immigrants; violence against them by other ethnic groups has given officials an excuse to herd some 140,000 of them into rancid refugee camps. In recent years the trafficking networks that sprang up to sneak Rohingyas away from such horrors have also successfully targeted better-off people living on the shores of neighbouring Bangladesh. 
Yet Myanmar's neighbours share considerable blame for the emergency. Only Cambodia, the Philippines and Timor-Leste have signed the UN Convention on Refugees, under which ""pushbacks"" are outlawed. Regional politicians agree they are morally obliged to resupply the boats, and to rescue those whose vessels have capsized. But until this week they said that allowing seaworthy boats to land only encouraged more to attempt the crossing. That reasoning was largely accepted by their electorates, even though it was flawed. Increasing migrant deaths in the Mediterranean have not reduced the numbers of those attempting to get from Africa to Europe. Some of the Asian boat people had taken to flinging themselves into the water at first sight of land, believing (correctly) that coastguards would usually take them to shore when seeing lives at immediate and grave risk. 
Several South-East Asian countries have tolerated--and benefited from--the people-smuggling they decry. For years Thai officials are thought to have quietly allowed refugees discovered within its borders to proceed to Malaysia. That gave the smuggling networks space to flourish, and helped enrich a few corrupt locals (many Thai fishing and seafood businesses have used migrants forced into what amounts to slavery). Malaysians, for their part, have sometimes turned a blind eye to the influx--Rohingyas help make up a shortage of cheap, unskilled labour. 
The crisis has highlighted the woeful inadequacy of regional governance and of its main implementer, the Association of South-East Asian Nations (ASEAN)--a talking-shop with minuscule resources and a shared belief in the dubious principle of ""non-interference"". The region's leaders promise not to meddle in each other's internal affairs, thus helping Myanmar (which chaired ASEAN last year) escape broad censure for its treatment of Rohingyas. It has also allowed ASEAN leaders to sign flowery declarations--such as a convention in 2012 in support of human rights--without having to fear that their neighbours will actually hold them to account. ASEAN leaders mutter that quiet diplomacy is more likely to lead to reform than public hectoring would. They are sometimes right, but often wrong. 
Since the start of the year ASEAN bigwigs have been talking up how much more closely bound the region is becoming with the formation of the ASEAN Economic Community, a collection of regional trade agreements which are supposed to take effect by the end of 2015. But attempts to co-operate on tricky social and security issues are lagging far behind. ASEAN was sluggish in its response to the devastation wreaked by Typhoon Haiyan, which struck the Philippines in 2013. So far it has bungled again. 
Here be dragons 
Richer countries would be in a better position to criticise if they could set high standards in dealing with their own refugee problems. They do not push boat people back to sea. But Europe's approach in the Mediterranean is clearly inadequate; hundreds might have been saved from shipwrecks in April had it kept up spending on maritime rescue. Australia diverts migrant boats before they reach its waters; on May 17th Tony Abbott, its prime minister, refused to criticise his South-East Asian neighbours. 
It is tempting for ASEAN countries to think that these weak records excuse their own failure. But by swiftly resettling the rescued migrants, and by better handling Myanmar, a region that tires of Western moralising could seize an opportunity to lead. Many South-East Asians see ASEAN as a tool to enrich its elites, not as a bulwark against egregious abuses and suffering. Here is a chance to change their minds.","South - East Asia 's boat people shame the whole region 
 FOR nearly three months a small green fishing boat has chugged around South - East Asia 's vast blue waters , packed with people no one wants . At first the 300 or so refugees on board -- most of them Rohingyas , a Muslim ethnic - minority persecuted in Myanmar -- were guided by people - smugglers . But after their traffickers fled , fearing arrest , they sailed on alone and with no clear destination , prevented from reaching the shores of Thailand and Malaysia by naval patrols . When a small vessel carrying journalists from the BBC and New York Times pulled alongside , hurling bottled water onto the decks , one passenger claimed that ten of their number had died . Their voyage finally ended on May 20th when Indonesian fishermen rescued them . 
 The ship was one of many which have drifted in the Strait of Malacca and the Andaman Sea in recent weeks , bearing thousands of people . Some of them are escaping poverty and oppression in their home countries , mainly Myanmar and Bangladesh ; a few are victims of kidnappings , their captors intending to demand ransoms for their release . Since the start of May , when a police crackdown in Thailand started to block the land routes over which criminals have long smuggled Rohingyas and other migrants , more than 3,000 of them have scrambled onto beaches in Malaysia and Indonesia . Yet all three countries have turned boats away in sight of shore , at times giving them directions to their neighbour 's waters . On May 20th Malaysia and Indonesia at last agreed to stop pushing away boats , but only after much international pressure . It has been a callous and haphazard response from a region that boasts of its deepening integration , and which wants to bolster its standing in the world . 
 South - East Asian countries rightly insist that the problem 's source , and its only lasting solution , lies in Myanmar . For years it has persecuted its Rohingya minority . The country 's government -- and , as far as can be gauged , almost all its people -- regards Rohingyas as illegal Bengali immigrants ; violence against them by other ethnic groups has given officials an excuse to herd some 140,000 of them into rancid refugee camps . In recent years the trafficking networks that sprang up to sneak Rohingyas away from such horrors have also successfully targeted better - off people living on the shores of neighbouring Bangladesh . 
 Yet Myanmar 's neighbours share considerable blame for the emergency . Only Cambodia , the Philippines and Timor - Leste have signed the UN Convention on Refugees , under which "" pushbacks "" are outlawed . Regional politicians agree they are morally obliged to resupply the boats , and to rescue those whose vessels have capsized . But until this week they said that allowing seaworthy boats to land only encouraged more to attempt the crossing . That reasoning was largely accepted by their electorates , even though it was flawed . Increasing migrant deaths in the Mediterranean have not reduced the numbers of those attempting to get from Africa to Europe . Some of the Asian boat people had taken to flinging themselves into the water at first sight of land , believing ( correctly ) that coastguards would usually take them to shore when seeing lives at immediate and grave risk . 
 Several South - East Asian countries have tolerated -- and benefited from -- the people - smuggling they decry . For years Thai officials are thought to have quietly allowed refugees discovered within its borders to proceed to Malaysia . That gave the smuggling networks space to flourish , and helped enrich a few corrupt locals ( many Thai fishing and seafood businesses have used migrants forced into what amounts to slavery ) . Malaysians , for their part , have sometimes turned a blind eye to the influx -- Rohingyas help make up a shortage of cheap , unskilled labour . 
 The crisis has highlighted the woeful inadequacy of regional governance and of its main implementer , the Association of South - East Asian Nations ( ASEAN)--a talking - shop with minuscule resources and a shared belief in the dubious principle of "" non - interference "" . The region 's leaders promise not to meddle in each other 's internal affairs , thus helping Myanmar ( which chaired ASEAN last year ) escape broad censure for its treatment of Rohingyas . It has also allowed ASEAN leaders to sign flowery declarations -- such as a convention in 2012 in support of human rights -- without having to fear that their neighbours will actually hold them to account . ASEAN leaders mutter that quiet diplomacy is more likely to lead to reform than public hectoring would . They are sometimes right , but often wrong . 
 Since the start of the year ASEAN bigwigs have been talking up how much more closely bound the region is becoming with the formation of the ASEAN Economic Community , a collection of regional trade agreements which are supposed to take effect by the end of 2015 . But attempts to co - operate on tricky social and security issues are lagging far behind . ASEAN was sluggish in its response to the devastation wreaked by Typhoon Haiyan , which struck the Philippines in 2013 . So far it has bungled again . 
 Here be dragons 
 Richer countries would be in a better position to criticise if they could set high standards in dealing with their own refugee problems . They do not push boat people back to sea . But Europe 's approach in the Mediterranean is clearly inadequate ; hundreds might have been saved from shipwrecks in April had it kept up spending on maritime rescue . Australia diverts migrant boats before they reach its waters ; on May 17th Tony Abbott's , refused to criticise Tony Abbott's South - East Asian neighbours . 
 It is tempting for ASEAN countries to think that these weak records excuse their own failure . But by swiftly resettling the rescued migrants , and by better handling Myanmar , a region that tires of Western moralising could seize an opportunity to lead . Many South - East Asians see ASEAN as a tool to enrich its elites , not as a bulwark against egregious abuses and suffering . Here is a chance to change their minds .",900,Australia,cb-900-2,IN TERM,True,"Tony Abbott , its prime minister",2,True
