date,link,text,resolved_text,ccode,country,leadid,pre_in_post_term,coreference_resolved_ind,main_cluster_identified,number_spans_replaced,abbott
2014-11-22,https://www-proquest-com.proxy.uchicago.edu/abicomplete/docview/1627107082/fulltext/A1E6B12631304EC3PQ/31?accountid=14657,"Tony Abbott woos China and India as America rebuffs his climate policy 
A HEATWAVE hovered over Brisbane, the state capital of Queensland, as world leaders gathered on November 15th for a Group of 20 (G20) summit, the biggest such meeting Australia has hosted. Tony Abbott, the prime minister, had hoped to limit their talks to topics that chimed with his domestic political agenda: growth and jobs. Barack Obama, America's president, had other ideas. On his way to the talks, Mr Obama delivered a speech to cheering students at the University of Queensland, calling on Australia to do more to tackle climate change. To rub his message in, Mr Obama worried about the ""incredible natural glory of the Great Barrier Reef"", off the coast of Queensland, which is threatened by global warming. 
The president's speech was carefully calculated. Three days earlier, Mr Obama had struck a deal with Xi Jinping, China's president, at another summit in Beijing, in which the world's two biggest emitters of carbon set targets to lower their outputs of greenhouse gases. The deal apparently caught Mr Abbott by surprise. He had wanted to limit the G20's climate commitments to a line about energy efficiency. But climate change dominated the Brisbane summit in the wake of Mr Obama's proclamation that ""here in the Asia Pacific, nobody has more at stake"". Few can recall such a sharp public rebuke from Australia's main strategic ally. 
Australia is responsible for about 1.5% of global carbon emissions; measured by its output per person, it is one of the highest polluters. Yet Mr Abbott has staked his political career on a combative approach to climate action. As opposition leader four years ago, he unseated his predecessor as leader of the conservative Liberal Party over a deal with the then Labor government for an emissions-trading scheme; that deal sank. Mr Abbott won power last year after waging a scare campaign against a carbon tax Labor had introduced instead; his government has since abolished it. Mr Abbott argued in Brisbane that climate talks should happen elsewhere, not at meetings of the G20. 
But the summit's climate pledges left Australia isolated. Mr Obama pointedly used his speech in Brisbane to announce a $3 billion contribution to the Green Climate Fund, a UN body to help poor countries deal with climate change. Japan, Germany and Canada also promised money. 
Mr Abbott felt in warmer company after Mr Xi and Narendra Modi, India's prime minister, left Brisbane to address Australia's parliament separately in Canberra. As Mr Xi spoke, Australia concluded a free-trade agreement with China. It includes tariff cuts on Australian shipments of coal, demand for which in China has grown rapidly in recent years. India is also a big market. Defiantly, Mr Abbott told the G20 leaders he would be ""standing up for coal"". But the summitry has left him with difficult choices over Australia's position on global warming as countries prepare for another summit in Paris next year--devoted entirely to the climate.","Tony Abbott woos China and India as America rebuffs Tony Abbott's climate policy 
 A HEATWAVE hovered over Brisbane , the state capital of Queensland , as world leaders gathered on November 15th for a Group of 20 ( G20 ) summit , the biggest such meeting Australia has hosted . Tony Abbott had hoped to limit their talks to topics that chimed with Tony Abbott's domestic political agenda : growth and jobs . Barack Obama , America 's president , had other ideas . On his way to the talks , Mr Obama delivered a speech to cheering students at the University of Queensland , calling on Australia to do more to tackle climate change . To rub his message in , Mr Obama worried about the "" incredible natural glory of the Great Barrier Reef "" , off the coast of Queensland , which is threatened by global warming . 
 The president 's speech was carefully calculated . Three days earlier , Mr Obama had struck a deal with Xi Jinping , China 's president , at another summit in Beijing , in which the world 's two biggest emitters of carbon set targets to lower their outputs of greenhouse gases . The deal apparently caught Tony Abbott by surprise . Tony Abbott had wanted to limit the G20 's climate commitments to a line about energy efficiency . But climate change dominated the Brisbane summit in the wake of Mr Obama 's proclamation that "" here in the Asia Pacific , nobody has more at stake "" . Few can recall such a sharp public rebuke from Australia 's main strategic ally . 
 Australia is responsible for about 1.5 % of global carbon emissions ; measured by its output per person , it is one of the highest polluters . Yet Tony Abbott has staked Tony Abbott's political career on a combative approach to climate action . As opposition leader four years ago , Tony Abbott unseated Tony Abbott's predecessor as leader of the conservative Liberal Party over a deal with the then Labor government for an emissions - trading scheme ; that deal sank . Tony Abbott won power last year after waging a scare campaign against a carbon tax Labor had introduced instead ; Tony Abbott's government has since abolished it . Tony Abbott argued in Brisbane that climate talks should happen elsewhere , not at meetings of the G20 . 
 But the summit 's climate pledges left Australia isolated . Mr Obama pointedly used his speech in Brisbane to announce a $ 3 billion contribution to the Green Climate Fund , a UN body to help poor countries deal with climate change . Japan , Germany and Canada also promised money . 
 Tony Abbott felt in warmer company after Mr Xi and Narendra Modi , India 's prime minister , left Brisbane to address Australia 's parliament separately in Canberra . As Mr Xi spoke , Australia concluded a free - trade agreement with China . It includes tariff cuts on Australian shipments of coal , demand for which in China has grown rapidly in recent years . India is also a big market . Defiantly , Tony Abbott told the G20 leaders Tony Abbott would be "" standing up for coal "" . But the summitry has left Tony Abbott with difficult choices over Australia 's position on global warming as countries prepare for another summit in Paris next year -- devoted entirely to the climate .",900,Australia,cb-900-2,IN TERM,True,Tony Abbott,17,True
2014-12-20,https://www-proquest-com.proxy.uchicago.edu/abicomplete/docview/1638915061/fulltext/FC69C3F42B774E4BPQ/24?accountid=14657,"A cafe siege will spark fresh debate about vulnerability to terrorism 
THE siege on December 15th in the Lindt Chocolate Cafe in Martin Place, in the heart of Sydney's business district, was the first terrorist act in Australia based on a political message about Islam. The morning had started with regulars queuing for coffee on their way to work. Shortly before 10am the doors were locked from the inside. For the next 16 hours, a gunman held 17 staff and customers hostage, forcing them to display a black flag with an Islamic creed against the window. Some but not all managed to slip out. In the early hours of the following morning, police stormed the cafe, apparently responding to shots inside. In a heavy exchange of gunfire, the gunman and two hostages died. 
For some time Australian authorities have warned of a possible terrorist event. Islam has been a fast-growing religion. The number of Muslims in the country grew by two-thirds in the decade to 2011. Muslims now account for just over 2% of the country's population of 23m, many of them in the outer suburbs of Sydney and Melbourne. In a recent speech to journalists David Irvine, a former head of the Australian Security Intelligence Organisation (ASIO), the country's domestic spy agency, insisted that violent extremists comprise a tiny minority--""a few hundred aberrant souls"". ASIO and police, he claimed, have thwarted plans for ""a number of mass-casualty attacks on our soil"". But his ""recurring nightmare"" had always been an attack by a ""lone wolf"": someone who had failed to come ""across our radar"". 
As it happened, the gunman in the Sydney siege was well-known to the authorities--who nevertheless underestimated his danger to society. Man Haron Monis, aged 50, was born in Iran and moved to Australia after receiving political asylum more than a decade ago. Via a website, Mr Monis had recently announced his conversion from Shia to Sunni Islam. Greg Barton, a terrorism expert at Monash University in Melbourne, believes Mr Monis was attracted by the way Islamic State (IS), the jihadist group in Iraq and Syria, encourages lone-wolf attacks against Westerners. But he doubts that IS would have recruited such a lost, disturbed individual. 
Mr Monis was facing charges of sexual and indecent assault, and of being an accessory to the murder of his former wife last year, for which he was out on bail. He had also been convicted of sending offensive letters to the families of Australian soldiers who had died in Afghanistan; a few days before the siege Australia's High Court had refused his bid to appeal against the conviction. For many Australians absorbing the shock of the siege, questions may centre less on Mr Monis's jihadism and more on how he was out on bail for his various charges, as well as how he had access to weapons. 
The prime minister, Tony Abbott, says it will take time to find out exactly what happened at Martin Place, and why. Political debate is certain to be stirred about tough anti-terror laws that the conservative coalition government has passed, as well as about its hard approach towards asylum-seekers making for Australia by boat. The anti-terror laws expand ASIO's powers, including its ability to demand access to computers, while journalists disclosing intelligence operations face up to ten years in prison. Constitutional and human-rights lawyers are uneasy over the laws. Others will question the impact of the siege on disaffected young Muslims, some of whom may see themselves as targets of the tougher security laws. But with Mr Monis's refugee background, the Sydney siege is also likely to entrench some Australians in their views that asylum policy is bound up with security. 
ASIO has identified about 60 Australians fighting with IS and Jabhat-al-Nusra, another extremist group, in Iraq and Syria; another 100 people in Australia are said to be supporting them and recruiting new fighters. Whether by a lone wolf or not, another attack in broad daylight is now a new worry for Sydneysiders.
Caption: A city shocked","A cafe siege will spark fresh debate about vulnerability to terrorism 
THE siege on December 15th in the Lindt Chocolate Cafe in Martin Place, in the heart of Sydney's business district, was the first terrorist act in Australia based on a political message about Islam. The morning had started with regulars queuing for coffee on their way to work. Shortly before 10am the doors were locked from the inside. For the next 16 hours, a gunman held 17 staff and customers hostage, forcing them to display a black flag with an Islamic creed against the window. Some but not all managed to slip out. In the early hours of the following morning, police stormed the cafe, apparently responding to shots inside. In a heavy exchange of gunfire, the gunman and two hostages died. 
For some time Australian authorities have warned of a possible terrorist event. Islam has been a fast-growing religion. The number of Muslims in the country grew by two-thirds in the decade to 2011. Muslims now account for just over 2% of the country's population of 23m, many of them in the outer suburbs of Sydney and Melbourne. In a recent speech to journalists David Irvine, a former head of the Australian Security Intelligence Organisation (ASIO), the country's domestic spy agency, insisted that violent extremists comprise a tiny minority--""a few hundred aberrant souls"". ASIO and police, he claimed, have thwarted plans for ""a number of mass-casualty attacks on our soil"". But his ""recurring nightmare"" had always been an attack by a ""lone wolf"": someone who had failed to come ""across our radar"". 
As it happened, the gunman in the Sydney siege was well-known to the authorities--who nevertheless underestimated his danger to society. Man Haron Monis, aged 50, was born in Iran and moved to Australia after receiving political asylum more than a decade ago. Via a website, Mr Monis had recently announced his conversion from Shia to Sunni Islam. Greg Barton, a terrorism expert at Monash University in Melbourne, believes Mr Monis was attracted by the way Islamic State (IS), the jihadist group in Iraq and Syria, encourages lone-wolf attacks against Westerners. But he doubts that IS would have recruited such a lost, disturbed individual. 
Mr Monis was facing charges of sexual and indecent assault, and of being an accessory to the murder of his former wife last year, for which he was out on bail. He had also been convicted of sending offensive letters to the families of Australian soldiers who had died in Afghanistan; a few days before the siege Australia's High Court had refused his bid to appeal against the conviction. For many Australians absorbing the shock of the siege, questions may centre less on Mr Monis's jihadism and more on how he was out on bail for his various charges, as well as how he had access to weapons. 
The prime minister, Tony Abbott, says it will take time to find out exactly what happened at Martin Place, and why. Political debate is certain to be stirred about tough anti-terror laws that the conservative coalition government has passed, as well as about its hard approach towards asylum-seekers making for Australia by boat. The anti-terror laws expand ASIO's powers, including its ability to demand access to computers, while journalists disclosing intelligence operations face up to ten years in prison. Constitutional and human-rights lawyers are uneasy over the laws. Others will question the impact of the siege on disaffected young Muslims, some of whom may see themselves as targets of the tougher security laws. But with Mr Monis's refugee background, the Sydney siege is also likely to entrench some Australians in their views that asylum policy is bound up with security. 
ASIO has identified about 60 Australians fighting with IS and Jabhat-al-Nusra, another extremist group, in Iraq and Syria; another 100 people in Australia are said to be supporting them and recruiting new fighters. Whether by a lone wolf or not, another attack in broad daylight is now a new worry for Sydneysiders.
Caption: A city shocked",900,Australia,cb-900-2,,False,,0,True
