date,link,text,resolved_text,ccode,country,leadid,pre_in_post_term,coreference_resolved_ind,main_cluster_identified,number_spans_replaced,abbott
2013-03-16,https://www-proquest-com.proxy.uchicago.edu/abicomplete/docview/1316967343/fulltext/722663AD2FCB4496PQ/37?accountid=14657,"The prime minister canvasses in fast-changing suburbs 
VISITORS off the train at Parramatta, a suburb in western Sydney, behold a shining glass tower that Deloitte, a financial-services firm, opened this month. The tower is a symbol of the changes in what was once a white, working-class area, loyal to Australia's traditionally left-leaning Labor Party. These days, a new wave of skilled immigrants, many from Asia and the Middle East, has turned Parramatta into unpredictable political territory. 
On March 3rd, and facing an election in September, the country's prime minister and Labor Party leader, Julia Gillard, ventured into Parramatta, spending a whole week there in a bid to rekindle the suburb's support. National opinion polls show the Labor Party trailing behind the opposition conservative coalition. Her government's fate may well be decided by Sydney, Australia's biggest city--and especially in the western suburbs around Parramatta. 
During her week in western Sydney, Ms Gillard conspicuously made her base not Kirribilli House, the elegant official residence overlooking Sydney harbour, but a utilitarian hotel in Rooty Hill, some 40km (25 miles) west. In so doing, she played up social markers that have long characterised Australia's oldest city: the rich, privileged centre versus the sprawling suburbs where most of Sydney's 4.6m people live. Ms Gillard reminded audiences that she did not grow up on Sydney's north shore, the wealthy district where Tony Abbott, the opposition leader, comes from. She, too, began her political career in a gritty west (even if hers lies in Melbourne). She understood, she said, ""a region's yearning for recognition and respect"". 
Yet Sydney's character is evolving so fast that such homilies may no longer hit their mark. Peter Spearritt, an historian, reckons the rest of Australia looks upon Sydney with a mixture of envy and pity. They still envy its wealth as Australia's finance and business hub, and its world-city status. But they now pity Sydney for its soaring house prices, which make homes unaffordable for many, and for its political scandals. One such scandal, unfolding around the land dealings of Eddie Obeid, a former government minister in New South Wales state, is corroding federal Labor's image. 
Meanwhile, immigration has made Sydney's old voting habits less predictable. Parramatta is one of several constituencies across western Sydney that Labor holds on slim margins; the futures of three of Ms Gillard's ministers are at stake among them. Whereas about a third of Sydney's overall population was born overseas, the proportion in Parramatta is more than half, and rising. Many arrivals work in finance, engineering and other fields without unions, Labor's traditional base. Deloitte aims to double staff in western Sydney by 2015. And even many people from union-based trades now run their own businesses. The upshot, says Nathan Rees, a former Labor premier of New South Wales, who still holds a western constituency, is that for many young workers in western Sydney relations with Labor are now more ""historical than practical"". 
Nonetheless, in a speech to party faithful in Parramatta, Ms Gillard tried to sooth workers' worries about jobs. A week before her visit, the government signalled tighter rules for employers importing overseas workers on temporary visas. Officials cite a 68% rise in such visas for the IT industry. Parramatta has high IT employment. Ms Gillard promised a fight ""to stop foreign workers being put at the front of the queue with Australian workers at the back"". For a leader who claims to champion an open economy, her language seemed an odd throwback to a more regulated, less diverse era. Some saw her apparent defence against foreign invaders as a coded pitch on a wider front. The opposition's attacks on the government over asylum-seekers arriving in Australia by boat have struck a chord even among western Sydney's big immigrant communities. 
A national opinion poll on March 12th, the first since her trip out west, gave Ms Gillard some hope. Her minority government narrowed its losing gap against the opposition to four points, while Ms Gillard won back her lead over Mr Abbott as the preferred prime minister. But the unpredictable Sydney suburbs will take some convincing before her government can count the west as won.","The prime minister canvasses in fast - changing suburbs 
 VISITORS off the train at Parramatta , a suburb in western Sydney , behold a shining glass tower that Deloitte , a financial - services firm , opened this month . The tower is a symbol of the changes in what was once a white , working - class area , loyal to Australia 's traditionally left - leaning Labor Party . These days , a new wave of skilled immigrants , many from Asia and the Middle East , has turned Parramatta into unpredictable political territory . 
 On March 3rd , and facing an election in September , the country 's prime minister and Labor Party leader , Julia Gillard , ventured into Parramatta , spending a whole week there in a bid to rekindle the suburb 's support . National opinion polls show the Labor Party trailing behind the opposition conservative coalition . Her government 's fate may well be decided by Sydney , Australia 's biggest city -- and especially in the western suburbs around Parramatta . 
 During her week in western Sydney , Ms Gillard conspicuously made her base not Kirribilli House , the elegant official residence overlooking Sydney harbour , but a utilitarian hotel in Rooty Hill , some 40 km ( 25 miles ) west . In so doing , she played up social markers that have long characterised Australia 's oldest city : the rich , privileged centre versus the sprawling suburbs where most of Sydney 's 4.6 m people live . Ms Gillard reminded audiences that she did not grow up on Sydney 's north shore , the wealthy district where Tony Abbott comes from . She , too , began her political career in a gritty west ( even if hers lies in Melbourne ) . She understood , she said , "" a region 's yearning for recognition and respect "" . 
 Yet Sydney 's character is evolving so fast that such homilies may no longer hit their mark . Peter Spearritt , an historian , reckons the rest of Australia looks upon Sydney with a mixture of envy and pity . They still envy its wealth as Australia 's finance and business hub , and its world - city status . But they now pity Sydney for its soaring house prices , which make homes unaffordable for many , and for its political scandals . One such scandal , unfolding around the land dealings of Eddie Obeid , a former government minister in New South Wales state , is corroding federal Labor 's image . 
 Meanwhile , immigration has made Sydney 's old voting habits less predictable . Parramatta is one of several constituencies across western Sydney that Labor holds on slim margins ; the futures of three of Ms Gillard 's ministers are at stake among them . Whereas about a third of Sydney 's overall population was born overseas , the proportion in Parramatta is more than half , and rising . Many arrivals work in finance , engineering and other fields without unions , Labor 's traditional base . Deloitte aims to double staff in western Sydney by 2015 . And even many people from union - based trades now run their own businesses . The upshot , says Nathan Rees , a former Labor premier of New South Wales , who still holds a western constituency , is that for many young workers in western Sydney relations with Labor are now more "" historical than practical "" . 
 Nonetheless , in a speech to party faithful in Parramatta , Ms Gillard tried to sooth workers ' worries about jobs . A week before her visit , the government signalled tighter rules for employers importing overseas workers on temporary visas . Officials cite a 68 % rise in such visas for the IT industry . Parramatta has high IT employment . Ms Gillard promised a fight "" to stop foreign workers being put at the front of the queue with Australian workers at the back "" . For a leader who claims to champion an open economy , her language seemed an odd throwback to a more regulated , less diverse era . Some saw her apparent defence against foreign invaders as a coded pitch on a wider front . The opposition 's attacks on the government over asylum - seekers arriving in Australia by boat have struck a chord even among western Sydney 's big immigrant communities . 
 A national opinion poll on March 12th , the first since her trip out west , gave Ms Gillard some hope . Her minority government narrowed its losing gap against the opposition to four points , while Ms Gillard won back her lead over Tony Abbott as the preferred prime minister . But the unpredictable Sydney suburbs will take some convincing before her government can count the west as won .",900,Australia,cb-900-2,PRE TERM,True,"Tony Abbott , the opposition leader ,",2,True
2013-03-30,https://www-proquest-com.proxy.uchicago.edu/abicomplete/docview/1321932265/fulltext/42EF8264BF6E40F8PQ/28?accountid=14657,"Politics in Australia is not as unAsian as it appears 
ONE thing that sets Australia apart from its Asian neighbours is the interminable, vicious public infighting that scars its politics. On March 25th Julia Gillard, the prime minister, shuffled her cabinet for the fourth time since scraping home in an election in August 2010. She purged it of supporters of Kevin Rudd, her predecessor, whom some of her Labor Party colleagues had tried and failed to install as her replacement on March 21st. Australian commentators wrung their hands at the tawdry politicking. ""Our long national nightmare continues,"" lamented Sam Roggeveen on a blog on the website of the Lowy Institute, a foreign-affairs think-tank in Sydney, fretting that Australia was becoming a laughing-stock. It is true that its politics provokes a smirk or two elsewhere in Asia. Few could argue with Ms Gillard's assessment that the coup attempt was ""unseemly"" and ""self-indulgent"". 
The Labor Party's troubles date back to Mr Rudd's stint as prime minister, from 2007-10. He alienated his colleagues and was losing popularity, so the party toppled him ahead of the 2010 election. Many were taken aback both by the suddenness of his downfall, and the ruthlessness with which Ms Gillard knifed him. He seems never to have given up hope of a comeback. A Mandarin-speaking former diplomat, in public he is an appealing character: erudite, eloquent, witty and even, on occasion, self-deprecating. In opinion polls he has consistently scored much higher than Ms Gillard as the leader who might secure victory in the next election, which she has called for September 14th. 
The sad truth for Mr Rudd, however, is that many of his Labor parliamentary colleagues, who choose the leader, cannot stand him. According to James Button, who worked briefly as a speechwriter for Mr Rudd, writing in the Sydney Morning Herald, ""behind closed doors he consistently treated people with rudeness and contempt."" He had no chance of unseating Ms Gillard and, for the second time in their three leadership contests, did not even compete in the leadership ballot she called. Hence the ""Chicken Kev"" taunt thrown by another columnist and former Labor speechwriter, Tim Soutphommasane. 
Ms Gillard, on the other hand, a former industrial-relations lawyer with strong ties to the trade unions that back Labor, has again shown her toughness. In a recent interview with the Canberra Times she said that, in politics, you have to be ""a pretty hard bastard"". Tony Blair, a former British prime minister dogged by intraparty conspiracies, had told her politics was afflicted with a ""new brutality"". She spoke of how technology has transformed the media, encouraging ""more drama, more shock, more horror"". 
At least now Mr Rudd has promised Ms Gillard his ""100% support"". Even if he had his fingers crossed when he spoke, Ms Gillard can probably concentrate for the next six months on fighting the opposition rather than looking over her shoulder. Still, if the opinion polls are to be believed, she needs quite a turnaround to avoid a humiliating defeat in September. 
Perhaps her best hope is that the conservative opposition coalition has as self-destructive a recent history as Labor's. Its leading force, the Liberal Party, has had four leaders in the past six years. Tony Abbott, the incumbent and probable coalition candidate for prime minister, is not its most popular politician. The man he ousted in 2009, Malcolm Turnbull, is a bigger vote-winner. Ms Gillard, whose finest moment as prime minister was a blistering attack last year on Mr Abbott for alleged misogyny, may feel she still has a chance. 
Australian politics seems locked in a culture of democratic coups, with the perverse effect that the leading parties fail to field their best candidates. And, when not dominated by tales of back-stabbing leaders and their muck-spreading sidekicks, they are taken over by scandals of sleaze and graft. 
Asia's big democracies--India, Indonesia and Japan--have all faced difficulties in finding leaders acceptable both to their parties and to the electorate. India's Congress party seems likely to resort, by default, to a dynastic succession; the most popular politician in Indonesia, Joko Widodo, Jakarta's governor, is not yet even a candidate in next year's presidential election; Japan is on its seventh prime minister in seven years (and it is his second go in that period). In all three countries politics is even more unseemly, self-indulgent and even corrupt. 
Just like the Politburo 
This sounds like an advertisement for autocracy. On a superficial view, China, for example, does not suffer from this leadership instability. One ten-year regime has just given way, in a choreographed transition, to another, expected to endure until 2022. But in fact, Chinese politics also closely resembles Australia's. There, too, no politician forgets that, as Mr Rudd put it in 1998, ""politics is about power"". There, too, leaders are chosen by factional intrigue. There, too, politics is dominated by personal rivalry. And there, too, the public's preferences are of secondary importance. 
The difference is that Australia's politics is played out in the open. Uniquely in the rich world, Australia is enjoying its 22nd consecutive year of economic growth. If this is a national nightmare, who wants to wake up? Moreover, as Mr Roggeveen forecast, the leadership kerfuffle played out peacefully according to the rules of Australia's democracy: ""No troops on the streets and probably not even a demonstration."" Australia may in fact be Asia's most stable country. 
By comparison, China's politics inhabits the shadows, except when some scandal, such as the Bo Xilai affair last year, casts a lurid light. And when that happens it calls the whole closed system into question. As Mr Roggeveen noted a day after his doom-laden blogpost, the latest Rudd-Gillard tussle did not make Australia a laughing-stock after all. It was widely seen as a non-event. It must be chastening for Australia's leaders that their squabbles seem irrelevant. But it is also a lesson in the benefits of transparency.","Politics in Australia is not as unAsian as it appears 
 ONE thing that sets Australia apart from its Asian neighbours is the interminable , vicious public infighting that scars its politics . On March 25th Tony Abbott shuffled Tony Abbott's cabinet for the fourth time since scraping home in an election in August 2010 . Tony Abbott purged it of supporters of Kevin Rudd , Tony Abbott's predecessor , whom some of Tony Abbott's Labor Party colleagues had tried and failed to install as Tony Abbott's replacement on March 21st . Australian commentators wrung their hands at the tawdry politicking . "" Our long national nightmare continues , "" lamented Sam Roggeveen on a blog on the website of the Lowy Institute , a foreign - affairs think - tank in Sydney , fretting that Australia was becoming a laughing - stock . It is true that its politics provokes a smirk or two elsewhere in Asia . Few could argue with Tony Abbott's assessment that the coup attempt was "" unseemly "" and "" self - indulgent "" . 
 The Labor Party 's troubles date back to Mr Rudd 's stint as prime minister , from 2007 - 10 . He alienated his colleagues and was losing popularity , so the party toppled him ahead of the 2010 election . Many were taken aback both by the suddenness of his downfall , and the ruthlessness with which Tony Abbott knifed him . He seems never to have given up hope of a comeback . A Mandarin - speaking former diplomat , in public he is an appealing character : erudite , eloquent , witty and even , on occasion , self - deprecating . In opinion polls he has consistently scored much higher than Tony Abbott as the leader who might secure victory in the next election , which Tony Abbott has called for September 14th . 
 The sad truth for Mr Rudd , however , is that many of his Labor parliamentary colleagues , who choose the leader , can not stand him . According to James Button , who worked briefly as a speechwriter for Mr Rudd , writing in the Sydney Morning Herald , "" behind closed doors he consistently treated people with rudeness and contempt . "" He had no chance of unseating Tony Abbott and , for the second time in their three leadership contests , did not even compete in the leadership ballot Tony Abbott called . Hence the "" Chicken Kev "" taunt thrown by another columnist and former Labor speechwriter , Tim Soutphommasane . 
 Tony Abbott , on the other hand , a former industrial - relations lawyer with strong ties to the trade unions that back Labor , has again shown Tony Abbott's toughness . In a recent interview with the Canberra Times Tony Abbott said that , in politics , you have to be "" a pretty hard bastard "" . Tony Blair , a former British prime minister dogged by intraparty conspiracies , had told her politics was afflicted with a "" new brutality "" . She spoke of how technology has transformed the media , encouraging "" more drama , more shock , more horror "" . 
 At least now Mr Rudd has promised Tony Abbott his "" 100 % support "" . Even if he had his fingers crossed when he spoke , Tony Abbott can probably concentrate for the next six months on fighting the opposition rather than looking over Tony Abbott's shoulder . Still , if the opinion polls are to be believed , Tony Abbott needs quite a turnaround to avoid a humiliating defeat in September . 
 Perhaps Tony Abbott's best hope is that the conservative opposition coalition has as self - destructive a recent history as Labor 's . Its leading force , the Liberal Party , has had four leaders in the past six years . Tony Abbott , the incumbent and probable coalition candidate for prime minister , is not its most popular politician . The man he ousted in 2009 , Malcolm Turnbull , is a bigger vote - winner . Tony Abbott may feel Tony Abbott still has a chance . 
 Australian politics seems locked in a culture of democratic coups , with the perverse effect that the leading parties fail to field their best candidates . And , when not dominated by tales of back - stabbing leaders and their muck - spreading sidekicks , they are taken over by scandals of sleaze and graft . 
 Asia 's big democracies -- India , Indonesia and Japan -- have all faced difficulties in finding leaders acceptable both to their parties and to the electorate . India 's Congress party seems likely to resort , by default , to a dynastic succession ; the most popular politician in Indonesia , Joko Widodo , Jakarta 's governor , is not yet even a candidate in next year 's presidential election ; Japan is on its seventh prime minister in seven years ( and it is his second go in that period ) . In all three countries politics is even more unseemly , self - indulgent and even corrupt . 
 Just like the Politburo 
 This sounds like an advertisement for autocracy . On a superficial view , China , for example , does not suffer from this leadership instability . One ten - year regime has just given way , in a choreographed transition , to another , expected to endure until 2022 . But in fact , Chinese politics also closely resembles Australia 's . There , too , no politician forgets that , as Mr Rudd put it in 1998 , "" politics is about power "" . There , too , leaders are chosen by factional intrigue . There , too , politics is dominated by personal rivalry . And there , too , the public 's preferences are of secondary importance . 
 The difference is that Australia 's politics is played out in the open . Uniquely in the rich world , Australia is enjoying its 22nd consecutive year of economic growth . If this is a national nightmare , who wants to wake up ? Moreover , as Mr Roggeveen forecast , the leadership kerfuffle played out peacefully according to the rules of Australia 's democracy : "" No troops on the streets and probably not even a demonstration . "" Australia may in fact be Asia 's most stable country . 
 By comparison , China 's politics inhabits the shadows , except when some scandal , such as the Bo Xilai affair last year , casts a lurid light . And when that happens it calls the whole closed system into question . As Mr Roggeveen noted a day after his doom - laden blogpost , the latest Rudd - Tony Abbott tussle did not make Australia a laughing - stock after all . It was widely seen as a non - event . It must be chastening for Australia 's leaders that their squabbles seem irrelevant . But it is also a lesson in the benefits of transparency .",900,Australia,cb-900-2,PRE TERM,True,"Ms Gillard , whose finest moment as prime minister was a blistering attack last year on Mr Abbott for alleged misogyny ,",23,True
