date,link,text,resolved_text,ccode,country,leadid,pre_in_post_term,coreference_resolved_ind,main_cluster_identified,number_spans_replaced,campbell
1993-02-27,https://www-proquest-com.proxy.uchicago.edu/abicomplete/docview/224123134/fulltext/5A6D0CCBC9034F41PQ/26?accountid=14657,"As elections approach in Canada, the familiar faces are beginning to fade away. On February 24th Brian Mulroney told his party that he was stepping down after more than eight years as prime minister. The progressive Conservative Party will hold a leadership convention in June, giving time for his successor to settle in before the likely autumn election.
Joe Clark, former prime minister and present constitution minister, had already announced that he would be leaving national politics. Meanwhile, Robert Bourassa, who has been premier of Quebec (off and on) since 1970, is seriously ill and is expected to resign soon, rather than stay and fight a provincial election early next year.
Mr Mulroney's resignation had been rumoured since the government's constitutional proposals were rejected in a national referendum last October. The rumours reached such a pitch a month ago that five possible successors (including two women: the defence minister, Kim Campbell, and the external-affairs minister, Barbara McDougall) began preparing for a leadership convention. But Mr Mulroney, as late as February 19th, was telling the House of Commons: ""I feel as young as a spring flower.""
What has made this youngish prime minister, only 54 next month, suddenly turn around and walk out of the door? Recent opinion polls from Quebec, his home province, have shown the Conservatives far behind the Liberals and the separatist Bloc Quebecois. Nationally, the Conservatives have lagged 20 points behind Jean Chretien's federal Liberal Party for more than a year. They have regained some round from the populist Reform Party in western Canada, but that gain is more the achievement of Mr Clark, who comes from Alberta, than of the prime minister, who is no more popular there than elsewhere in Canada.
Another factor was certainly Mr Clark's prior announcement that, after 21 years, he was leaving federal politics (at an equally young age). Had Mr Clark stayed on he would have been available as a new prime minister and leader of the Conservative party. Mr Mulroney might not have risked the ignominy of handing over to the man he displaced in 1983, even though Mr Clark has served under him loyally since then.
Mr Mulroney is a radical politician who was not trusted. He pushed through painful economic changes against widespread opposition, first by taking Canada into a free-trade agreement with the United States, and then by signing the North American Free Trade Agreement (NAFTA) which draws Mexico in as third party. The proposed agreement with the United States became the main issue in the 1988 election. The two opposition parties attacked it bitterly.
With only 42% of the vote, Mr Mulroney won the election and went ahead to sin the agreement. According to trade-union figures, 350,000 jobs in manufacturing industry were lost in the subsequent three years, as manufacturers closed factories, reduced the number of people they employed or left Canada altogether. Though some of this devastation was due to the recession and industrial adjustment, the free-trade agreement certainly aggravated the trend. Many Canadians expect NAFTA to carry the demolition of Canada's manufacturing industry further, especially in Ontario.
On top of this, the Mulroney government took extreme measures, including packing the Senate with extra members, in order to introduce a goods-and-services tax. Despite the handsome amount of revenue harvested by this most unpopular tax, the government has failed to reduce the deficit as promised and faces another year of unemployment above 11%. In these circumstances, the man who is seen as a principal author of these misfortunes would almost certainly have faced humiliation at the polls. His virtues--a passion to keep Canada united, and a concern for human rights around the world--have been obscured.
There is no obvious successor, although Ms Campbell is seen as the front-runner: a bilingual woman from western Canada would give a bright new face to the Conservatives. She won a fine reputation as justice minister, and may build on it after her recent sideways move to a dual portfolio of defence and veterans' affairs. This gives her powers over $C14 billion ($11 billion) of spending, as well as a flow of publicity earned by the 4,700 Canadian troops on peacekeeping duties abroad.
Barbara McDougall has not fared so well at external affairs, and will be competing for support with Michael Wilson, a cabinet heavyweight as finance minister and more recently in charge of international trade. Perrin Beatty, the communications minister popular with the party's right wing, may do well. The party is unlikely to choose another Quebecker immediately after Mr Mulroney, but Jean Charest, the personable environment minister, could form an alliance with Ms Campbell that would knit together east and west. It is conceivable that Mr Clark will be tempted to re-enter the political arena. But, after early setbacks in his long career, he may not have the stomach for such a risky comeback.
Mr Bourassa has skin cancer and has been receiving experimental treatment from a hospital in the United States. He will not turn 60 until July and keeps fit with a daily swim. But the next election campaign is shaping into a bitter contest. His Liberal Party is opposed by the Parti Quebecois, whose leader, Jacques Parizeau, promises to make Quebec sovereign by mid-1995. Mr Bourassa will have to decide after a medical progress report in March whether he has the strength for this fight. The departure of Mr Mulroney, a strong ally in the federalist cause, may further weaken his resolve.","As elections approach in Canada , the familiar faces are beginning to fade away . On February 24th Brian Mulroney told his party that he was stepping down after more than eight years as prime minister . The progressive Conservative Party will hold a leadership convention in June , giving time for his successor to settle in before the likely autumn election . 
 Joe Clark , former prime minister and present constitution minister , had already announced that he would be leaving national politics . Meanwhile , Robert Bourassa , who has been premier of Quebec ( off and on ) since 1970 , is seriously ill and is expected to resign soon , rather than stay and fight a provincial election early next year . 
 Mr Mulroney 's resignation had been rumoured since the government 's constitutional proposals were rejected in a national referendum last October . The rumours reached such a pitch a month ago that five possible successors ( including two women : the defence minister , Kim Campbell , and the external - affairs minister , Barbara McDougall ) began preparing for a leadership convention . But Mr Mulroney , as late as February 19th , was telling the House of Commons : "" I feel as young as a spring flower . "" 
 What has made this youngish prime minister , only 54 next month , suddenly turn around and walk out of the door ? Recent opinion polls from Quebec , his home province , have shown the Conservatives far behind the Liberals and the separatist Bloc Quebecois . Nationally , the Conservatives have lagged 20 points behind Jean Chretien 's federal Liberal Party for more than a year . They have regained some round from the populist Reform Party in western Canada , but that gain is more the achievement of Mr Clark , who comes from Alberta , than of the prime minister , who is no more popular there than elsewhere in Canada . 
 Another factor was certainly Mr Clark 's prior announcement that , after 21 years , he was leaving federal politics ( at an equally young age ) . Had Mr Clark stayed on he would have been available as a new prime minister and leader of the Conservative party . Mr Mulroney might not have risked the ignominy of handing over to the man he displaced in 1983 , even though Mr Clark has served under him loyally since then . 
 Mr Mulroney is a radical politician who was not trusted . He pushed through painful economic changes against widespread opposition , first by taking Canada into a free - trade agreement with the United States , and then by signing the North American Free Trade Agreement ( NAFTA ) which draws Mexico in as third party . The proposed agreement with the United States became the main issue in the 1988 election . The two opposition parties attacked it bitterly . 
 With only 42 % of the vote , Mr Mulroney won the election and went ahead to sin the agreement . According to trade - union figures , 350,000 jobs in manufacturing industry were lost in the subsequent three years , as manufacturers closed factories , reduced the number of people they employed or left Canada altogether . Though some of this devastation was due to the recession and industrial adjustment , the free - trade agreement certainly aggravated the trend . Many Canadians expect NAFTA to carry the demolition of Canada 's manufacturing industry further , especially in Ontario . 
 On top of this , the Mulroney government took extreme measures , including packing the Senate with extra members , in order to introduce a goods - and - services tax . Despite the handsome amount of revenue harvested by this most unpopular tax , the government has failed to reduce the deficit as promised and faces another year of unemployment above 11 % . In these circumstances , the man who is seen as a principal author of these misfortunes would almost certainly have faced humiliation at the polls . His virtues -- a passion to keep Canada united , and a concern for human rights around the world -- have been obscured . 
 There is no obvious successor , although Kim Campbell is seen as the front - runner : Kim Campbell would give a bright new face to the Conservatives . Kim Campbell won a fine reputation as justice minister , and may build on it after Kim Campbell's recent sideways move to a dual portfolio of defence and veterans ' affairs . This gives Kim Campbell's powers over $ C14 billion ( $ 11 billion ) of spending , as well as a flow of publicity earned by the 4,700 Canadian troops on peacekeeping duties abroad . 
 Barbara McDougall has not fared so well at external affairs , and will be competing for support with Michael Wilson , a cabinet heavyweight as finance minister and more recently in charge of international trade . Perrin Beatty , the communications minister popular with the party 's right wing , may do well . The party is unlikely to choose another Quebecker immediately after Mr Mulroney , but Jean Charest , the personable environment minister , could form an alliance with Ms Campbell that would knit together east and west . It is conceivable that Mr Clark will be tempted to re - enter the political arena . But , after early setbacks in his long career , he may not have the stomach for such a risky comeback . 
 Mr Bourassa has skin cancer and has been receiving experimental treatment from a hospital in the United States . He will not turn 60 until July and keeps fit with a daily swim . But the next election campaign is shaping into a bitter contest . His Liberal Party is opposed by the Parti Quebecois , whose leader , Jacques Parizeau , promises to make Quebec sovereign by mid-1995 . Mr Bourassa will have to decide after a medical progress report in March whether he has the strength for this fight . The departure of Mr Mulroney , a strong ally in the federalist cause , may further weaken his resolve .",20,Canada,A29-145,PRE TERM,True,Ms Campbell,5,True
1993-02-27,https://www-proquest-com.proxy.uchicago.edu/abicomplete/docview/224136138/fulltext/5A6D0CCBC9034F41PQ/49?accountid=14657,"Once upon a time a harmless journalist called Alastair Campbell, who plays bagpipes for relaxation, was squeezed from his job because he was out of tune with his new editor. So what? Every day editorial rooms clatter with the sound of musical chairs and broken egos. The oddity in Mr Campbell's case was that his misfortune provoked no fewer than 150 members of Parliament--the bulk of Labour's backbenchers--to sign a motion deploring his fate as a threat to the moral well-being of the nation.
Can they be serious? Many of them say Mr Campbell's demise is one more omen that the country is falling under the malign sway of an Australian-American monster whom they already hold at least partly responsible for keeping the Tories in power for the past 14 years. His name, of course, is Rupert Murdoch. They say he, not John Major,is the most powerful man in the land.
They have a point. The Daily Mirror, for which Mr Campbell was political editor, is Britain's only pro-Labour tabloid. Since the death of its last owner, Robert Maxwell, a former Labour MP, the newspaper has been overseen by bankers. The new editor who ousted Mr Campbell says the Mirror will go on backing Labour. But he and several of the new editorial team are old Murdoch hands. The Labour complainers fear that the souls of ""ordinary aspiring people"", as they now call the old Mirror-reading British working class, may soon be in thrall to the propaanda of unbridled Murdochian capitalism.
A natural enouh worry. But the Labour MPS are barking up the wrong tree. The Mirror and Mr Campbell have done virtually nothing to rattle the government during the past 14 years of Tory rule. And the current role of Mr Murdoch in British politics is actually quite complex.
If anybody is going to bring down Mr Major, it is not the Mirror, let alone the Guardian or its Sunday ideologue-in-arms, the Observer. It is Mr Murdoch himself. Though hardly fond of Labour, these days he is more of a threat to the Tories. The same can be said of Conrad Black, the Canadian employer of the caustic Major-doubters in the Telegraph group. Britain's two main newspaper tycoons, both from Britain's former empire, deplore the idea of the country becoming a ""little European"", tied up in Brussels bureaucracy. The Sunday Teleraph campaigns ferociously against Maastricht, and it was the Sun that screamed ""Up yours, Delors!"".
Mr Murdoch's reach is immense. Three-quarters of Britons read tabloids at breakfast. A third of tabloid readers buy Murdoch products. The Sun is by far the most popular. On Sundays his ""pop"" newspaper, the News of the World, and its up-market stablemate, the Sunday Times, embrace an even bigger share of the market. He hopes his BSkyB satellite network will one day lure 12m British viewers. None of these outlets, including The Times, another Murdoch asset, now cares much for Mr Major.
It is debatable how much Mr Murdoch tells his editors what to write. He rarely needs to. He picks people on his wavelength or those canny enouh to tune in. His editors have some latitude. When Mararet Thatcher fell, the Sunday Times backed Michael Heseltine for the top job, The Times and the Sun plumped for Mr Major. But on some really big issues, he makes his view passionately known, one way or another. Editors knuckle under.
Yet he is a much rummer political mixture than most of his detractors realise. For sure, he and the grateful Mrs Thatcher were close allies. He despises the old Labour Party and has dropped no hint, so far, that the emering new-look version is worth taking seriously. But he has always despised the stuffy old British ruling class. As a student at Oxford, a bust of Lenin took pride of place on his mantelpiece, according to a biography by William Shawcross. He is what Australians call a ""larrikin""--a trouble-maker-cum-cheeky-chappy. Thouh he denies republicanism, he has confessed to ""ambivalence"" about the royal family, seeing it as the apex of a fossilised class system. His serious and tabloid newspapers have viciously assailed the monarchy.
He may feel he has outgrown Britain: the place does not much interest him at present. He visits London rarely. He has not seen the editor of The Times for weeks. Living in Los Angeles, he is now taking on Hollywood with characteristic zeal. He seems determined to penetrate the television market of China.
So it is hard to assess his current interest in British politics. It is also hard to compare the influence of television with the printed word. Labour grumbles about the ""Tory press"" are matched by Tories whining about left-wing bias in television, on which Britons lavish far more time (on averae, nearly four hours a day). Serious programmes such as ""Panorama"" and ""World in Action"", which cannot be accused of pro-Tory bias, command audiences bigger than the entire readership of the daily ""quality press"".
The political agenda, however, tends to be set by the newspapers--for television to follow. Perhaps Mr Murdoch's biggest influence has been not so much in persuading people how to vote as in moulding a cultural and moral climate for politicians of varying hue to exploit. His key editors in Britain, Andrew Neil at the Sunday Times and Kelvin MacKenzie at the Sun, both typify the Murdoch ethos.
They loathe deference and hypocrisy as much as ""whingers"" and ""lily-livered socialists"". They are free-marketeers who believe furiously in meritocracy. Nothing seems sacred, certainly not the privacy of individuals. They tend to pander to base instincts. They seem to respect almost nobody and no institution. It is tempting to feel that the Murdoch press has contributed to a bloody-minded coarsening of British public life.
Strange as it may sound, Labour can learn from Mr Murdoch. Neil Kinnock (remember him?), in his support for Mr Campbell, unintentionally revealed why the Mirror, too, has lost its way. The give-away was his praise for the ousted journalist's ""steadfast loyalty"". No newspaper attracts readers by being ""loyal"" to a political party. Mr Murdoch's macho acolytes are certainly right about that. Crude and mendacious it may be, but the Sun senses the popular mood. It latches on to new ideas. Mr Murdoch abhors woolly thinking. And he knows that newspapers, however tabloid, depend in the end on ideas. That, not a loyal political editor, is what the Mirror needs.","Once upon a time Kim Campbell , was squeezed from Kim Campbell's job because Kim Campbell was out of tune with Kim Campbell's new editor . So what ? Every day editorial rooms clatter with the sound of musical chairs and broken egos . The oddity in Kim Campbell's case was that Kim Campbell's misfortune provoked no fewer than 150 members of Parliament -- the bulk of Labour 's backbenchers -- to sign a motion deploring Kim Campbell's fate as a threat to the moral well - being of the nation . 
 Can they be serious ? Many of them say Kim Campbell's demise is one more omen that the country is falling under the malign sway of an Australian - American monster whom they already hold at least partly responsible for keeping the Tories in power for the past 14 years . His name , of course , is Rupert Murdoch . They say he , not John Major , is the most powerful man in the land . 
 They have a point . The Daily Mirror , for which Kim Campbell was political editor , is Britain 's only pro - Labour tabloid . Since the death of its last owner , Robert Maxwell , a former Labour MP , the newspaper has been overseen by bankers . The new editor who ousted Kim Campbell says the Mirror will go on backing Labour . But he and several of the new editorial team are old Murdoch hands . The Labour complainers fear that the souls of "" ordinary aspiring people "" , as they now call the old Mirror - reading British working class , may soon be in thrall to the propaanda of unbridled Murdochian capitalism . 
 A natural enouh worry . But the Labour MPS are barking up the wrong tree . The Mirror and Kim Campbell have done virtually nothing to rattle the government during the past 14 years of Tory rule . And the current role of Mr Murdoch in British politics is actually quite complex . 
 If anybody is going to bring down Mr Major , it is not the Mirror , let alone the Guardian or its Sunday ideologue - in - arms , the Observer . It is Mr Murdoch himself . Though hardly fond of Labour , these days he is more of a threat to the Tories . The same can be said of Conrad Black , the Canadian employer of the caustic Major - doubters in the Telegraph group . Britain 's two main newspaper tycoons , both from Britain 's former empire , deplore the idea of the country becoming a "" little European "" , tied up in Brussels bureaucracy . The Sunday Teleraph campaigns ferociously against Maastricht , and it was the Sun that screamed "" Up yours , Delors ! "" . 
 Mr Murdoch 's reach is immense . Three - quarters of Britons read tabloids at breakfast . A third of tabloid readers buy Murdoch products . The Sun is by far the most popular . On Sundays his "" pop "" newspaper , the News of the World , and its up - market stablemate , the Sunday Times , embrace an even bigger share of the market . He hopes his BSkyB satellite network will one day lure 12 m British viewers . None of these outlets , including The Times , another Murdoch asset , now cares much for Mr Major . 
 It is debatable how much Mr Murdoch tells his editors what to write . He rarely needs to . He picks people on his wavelength or those canny enouh to tune in . His editors have some latitude . When Mararet Thatcher fell , the Sunday Times backed Michael Heseltine for the top job , The Times and the Sun plumped for Mr Major . But on some really big issues , he makes his view passionately known , one way or another . Editors knuckle under . 
 Yet he is a much rummer political mixture than most of his detractors realise . For sure , he and the grateful Mrs Thatcher were close allies . He despises the old Labour Party and has dropped no hint , so far , that the emering new - look version is worth taking seriously . But he has always despised the stuffy old British ruling class . As a student at Oxford , a bust of Lenin took pride of place on his mantelpiece , according to a biography by William Shawcross . He is what Australians call a "" larrikin""--a trouble - maker - cum - cheeky - chappy . Thouh he denies republicanism , he has confessed to "" ambivalence "" about the royal family , seeing it as the apex of a fossilised class system . His serious and tabloid newspapers have viciously assailed the monarchy . 
 He may feel he has outgrown Britain : the place does not much interest him at present . He visits London rarely . He has not seen the editor of The Times for weeks . Living in Los Angeles , he is now taking on Hollywood with characteristic zeal . He seems determined to penetrate the television market of China . 
 So it is hard to assess his current interest in British politics . It is also hard to compare the influence of television with the printed word . Labour grumbles about the "" Tory press "" are matched by Tories whining about left - wing bias in television , on which Britons lavish far more time ( on averae , nearly four hours a day ) . Serious programmes such as "" Panorama "" and "" World in Action "" , which can not be accused of pro - Tory bias , command audiences bigger than the entire readership of the daily "" quality press "" . 
 The political agenda , however , tends to be set by the newspapers -- for television to follow . Perhaps Mr Murdoch 's biggest influence has been not so much in persuading people how to vote as in moulding a cultural and moral climate for politicians of varying hue to exploit . His key editors in Britain , Andrew Neil at the Sunday Times and Kelvin MacKenzie at the Sun , both typify the Murdoch ethos . 
 They loathe deference and hypocrisy as much as "" whingers "" and "" lily - livered socialists "" . They are free - marketeers who believe furiously in meritocracy . Nothing seems sacred , certainly not the privacy of individuals . They tend to pander to base instincts . They seem to respect almost nobody and no institution . It is tempting to feel that the Murdoch press has contributed to a bloody - minded coarsening of British public life . 
 Strange as it may sound , Labour can learn from Mr Murdoch . Neil Kinnock ( remember him ? ) , in his support for Kim Campbell , unintentionally revealed why the Mirror , too , has lost its way . The give - away was his praise for Kim Campbell's "" steadfast loyalty "" . No newspaper attracts readers by being "" loyal "" to a political party . Mr Murdoch 's macho acolytes are certainly right about that . Crude and mendacious it may be , but the Sun senses the popular mood . It latches on to new ideas . Mr Murdoch abhors woolly thinking . And he knows that newspapers , however tabloid , depend in the end on ideas . That , not a loyal political editor , is what the Mirror needs .",20,Canada,A29-145,PRE TERM,True,Mr Campbell 's,13,True
