date,link,text,resolved_text,ccode,country,leadid,pre_in_post_term,coreference_resolved_ind,main_cluster_identified,number_spans_replaced,campbell
1993-06-19,https://www-proquest-com.proxy.uchicago.edu/abicomplete/docview/224166005/fulltext/6B0E7880F9CA495BPQ/30?accountid=14657,"Looking at what lies ahead, being elected leader of the Progressive Conservative Party, and thus taking over from Brian Mulroney as Canada's prime minister, may come to seem the easy bit to Kim Campbell. The oranisation she gathered together six months ago propelled her through a lacklustre campaign and kept her just ahead (53% of the 3,447 delegates) of the late-hour challenge from her young Quebec colleague, Jean Charest, at the party convention on June 13th. She has far less time--probably only two months--to pull the Tory party together and put a fresh look on an unpopular government before heading into a general election.
She will be facing four parties that matter at that election, instead of the usual two, and the timing is tight. There are good reasons for holding the election before the end of October; otherwise an expensive new count of voters will be required. October itself is a cluttered month. So she may well decide to announce in mid-August an election that would take place in late September.
Her most specific pledge so far has been to eliminate the federal deficit, which is stuck at C$32 billion ($25 billion), within five years. She will begin her plan for restructuring the Federal government by cutting the cabinet from 35 to 25 members. Since nearly all the senior Mulroney ministers plan to leave politics at the next election, she has virtually a clean slate.
She will find it harder to carry out her still secret plan to trim and merge government departments. Canada's civil servants are more rock-like than its politicians, and such changes will take years. She had wanted to hold an immediate federal-provincial summit to co-ordinate economy measures, but only two of the ten premiers are Conservatives and the others have no desire to burnish her image.
So her efforts this summer must concentrate on bringing together the often distinct groups of Tories from western and central Canada, and devising an election strategy. She has to win the loyalty of Mr Charest, her disappointed rival, enticing him with promotion from his environment portfolio; he alone can carry Quebec for the Conservatives in the way Brian Mulroney did. Her reputation as a quick learner and speedy worker is already established. The next weeks will show whether she has both the authority and the personality to weld the party together, a skill in which Mr Mulroney, for all his other faults, excelled.
The Conservatives' traditional opponents are still delighted that Ms Campbell was chosen over Mr Charest. The Liberals believe the opinion polls, which say that she is the easier to defeat. The New Democrat leader, Audrey McLaughlin, welcomes another woman at the top, but sees Ms Campbell as accident-prone, liable to make hasty and combative statements. Both parties are already pinning the record of the Mulroney years on his protege. ""New Tory, same story"" is likely to become an opposition election slogan.","Looking at what lies ahead , being elected leader of the Progressive Conservative Party , and thus taking over from Brian Mulroney as Canada 's prime minister , may come to seem the easy bit to Kim Campbell . The oranisation Kim Campbell gathered together six months ago propelled Kim Campbell through a lacklustre campaign and kept Kim Campbell just ahead ( 53 % of the 3,447 delegates ) of the late - hour challenge from Kim Campbell's young Quebec colleague , Jean Charest , at the party convention on June 13th . Kim Campbell has far less time -- probably only two months -- to pull the Tory party together and put a fresh look on an unpopular government before heading into a general election . 
 Kim Campbell will be facing four parties that matter at that election , instead of the usual two , and the timing is tight . There are good reasons for holding the election before the end of October ; otherwise an expensive new count of voters will be required . October itself is a cluttered month . So Kim Campbell may well decide to announce in mid - August an election that would take place in late September . 
 Kim Campbell's most specific pledge so far has been to eliminate the federal deficit , which is stuck at C$ 32 billion ( $ 25 billion ) , within five years . Kim Campbell will begin Kim Campbell's plan for restructuring the Federal government by cutting the cabinet from 35 to 25 members . Since nearly all the senior Mulroney ministers plan to leave politics at the next election , Kim Campbell has virtually a clean slate . 
 Kim Campbell will find it harder to carry out Kim Campbell's still secret plan to trim and merge government departments . Canada 's civil servants are more rock - like than its politicians , and such changes will take years . Kim Campbell had wanted to hold an immediate federal - provincial summit to co - ordinate economy measures , but only two of the ten premiers are Conservatives and the others have no desire to burnish Kim Campbell's image . 
 So Kim Campbell's efforts this summer must concentrate on bringing together the often distinct groups of Tories from western and central Canada , and devising an election strategy . Kim Campbell has to win the loyalty of Mr Charest , Kim Campbell's disappointed rival , enticing him with promotion from his environment portfolio ; he alone can carry Quebec for the Conservatives in the way Brian Mulroney did . Kim Campbell's reputation as a quick learner and speedy worker is already established . The next weeks will show whether Kim Campbell has both the authority and the personality to weld the party together , a skill in which Mr Mulroney , for all his other faults , excelled . 
 The Conservatives ' traditional opponents are still delighted that Kim Campbell was chosen over Mr Charest . The Liberals believe the opinion polls , which say that Kim Campbell is the easier to defeat . The New Democrat leader , Audrey McLaughlin , welcomes another woman at the top , but sees Kim Campbell as accident - prone , liable to make hasty and combative statements . Both parties are already pinning the record of the Mulroney years on Kim Campbell's . "" New Tory , same story "" is likely to become an opposition election slogan .",20,Canada,A29-145,PRE TERM,True,Kim Campbell,25,True
1993-07-10,https://www-proquest-com.proxy.uchicago.edu/abicomplete/docview/224145310/fulltext/67E5D59BF2DD449BPQ/78?accountid=14657,"His reputation as a political leader and world statesman increases in direct proportion to the length of time since he last held public office. Today Sir Edward Heath, knight of the garter and father of the House of Commons, is the recipient of innumerable prizes and honorary degrees from around the world. He is listened to with respect on subjects as various as the future of Europe, the rights and wrongs of intervention by outside powers in the Middle East and the responsibilities of donor nations to the developing countries of Africa, Asia and the Caribbean. That organ-like voice, the Santa-Claus laugh and those white hairs are instantly recognisable.
Yet, by any measure, Sir Edward was one of the least successful British prime ministers of modern times. When he left office in 1974 inflation was in double digits and rising, the money supply was out of control, the miners were on all-out strike, his government's industrial-relations and wage-control policies were collapsing around him, and his changes of policy had been so frequent that, entirely thanks to him, the phrase ""v-turn"" became a permanent part of Britain's political vocabulary.
He was also one of the most unpopular prime ministers of this century. He fought four elections as Conservative leader and lost three. Only Britain's membership of the European Community stands as his monument, and it is arguable that whoever had been in power in Britain in the early 1970s would have taken the country in.
Sir Edward is intelligent, undoubtedly; honest, certainly; courageous, beyond any doubt. But a man to be taken seriously as a political leader? No. Sir Edward's truncated period in office bears a striking resemblance to that of Jimmy Carter. Both were upright honourable men, but unqualified.
John Campbell is already well established as one of Britain's most elegant biographers of the traditional school. He is accurate, thorough, fair-minded, politically astute and full of psychological insights.
In this case, he gives the impression of having fallen out of love with his subject. The Edward Heath portrayed here is a surly, self-centred brute, who came to imagine that the welfare of the country and the advancement of his own political career amounted to the same thing. Of Sir Edward's desire to lead a government of national unity in 1974, Mr Campbell writes, with conscious irony, that his ambition was ""as patriotic as it was egotistical"". Passionate in not deceiving others, the Tory leader wound up deceiving only himself.
Mr Campbell's theory is that the young Heath benefited enormously from, but was ultimately crippled by, a childhood in which he was the sole repository of his parents', and especially his mother's, ambitions. He came to see his family-and eventually his staff, his cabinet, backbench MPS and the Conservative Party itself-as no more than ""a support system dedicated to easing his path"".
His mother's death shattered him. His sexuality was repressed. Solitary and inward, he was at his best in an environment where someone else had responsibility for issuing the orders and where he was merely the head of a team carrying them out. By nature an adjutant (a very good one in the army), he desperately wanted to become the general officer commanding. He did become GOC. It was his undoing.
His premiership exposed not only the weaknesses of his working methods (he relied too heavily on civil servants and addressed Tory backbenchers as though he was indeed their general). It also exposed the limitations of his ideas. Like the present prime minister, Sir Edward did have a broad political vision. He was a traditional ""one nation"" Tory, believing that Britain should be a successful and dynamic country but also a compassionate one, with officers having as one of their first duties the welfare of their men. But, again like Mr Major, he had no very clear ideas about how to give practical substance to his vision and he lacked the language in which he might have communicated that vision to the country and his party.
Sir Edward was torn between his belief in competitiveness and efficiency, and his bureaucrat's conviction that all that was required for the country's well-being was for enough high-minded civil servants to issue a sufficiently large number of regulations in an adequately detailed form. Sir Edward was, as the psychologists say, a ""controlling"" man.
Towards the end of his premiership he discovered that world oil prices and the National Union of Mineworkers could not be controlled. Between them, they destroyed him. It was a sad but predictable sequel to his premiership that he first failed to bow out gracefully from his party's leadership and then spent the next 15 years engaged in an orgy of self-justification and denigration of his more gifted successor.
Mr Campbell's biography is more sympathetic to its subject than this account probably suggests. If there is a good word to be said for Sir Edward, Mr Campbell says it; and he splendidly evokes the former premier's passions for music and sailing and the nature of his gawky but affectionate relations with his few close Friends.
""Edward Heath"" will give much pleasure, even if Edward Heath as prime minister did not. The book has only two faults. It is too long, and the author quotes too much from the press. He ignores the old rule that newspapers and magazines should be quoted only when the quoted passages themselves had some direct bearing on events. The Economist is quoted 68 times. That is flattering to The Economist, but not good history.","His reputation as a political leader and world statesman increases in direct proportion to the length of time since he last held public office . Today Sir Edward Heath , knight of the garter and father of the House of Commons , is the recipient of innumerable prizes and honorary degrees from around the world . He is listened to with respect on subjects as various as the future of Europe , the rights and wrongs of intervention by outside powers in the Middle East and the responsibilities of donor nations to the developing countries of Africa , Asia and the Caribbean . That organ - like voice , the Santa - Claus laugh and those white hairs are instantly recognisable . 
 Yet , by any measure , Sir Edward was one of the least successful British prime ministers of modern times . When he left office in 1974 inflation was in double digits and rising , the money supply was out of control , the miners were on all - out strike , his government 's industrial - relations and wage - control policies were collapsing around him , and his changes of policy had been so frequent that , entirely thanks to him , the phrase "" v - turn "" became a permanent part of Britain 's political vocabulary . 
 He was also one of the most unpopular prime ministers of this century . He fought four elections as Conservative leader and lost three . Only Britain 's membership of the European Community stands as his monument , and it is arguable that whoever had been in power in Britain in the early 1970s would have taken the country in . 
 Sir Edward is intelligent , undoubtedly ; honest , certainly ; courageous , beyond any doubt . But a man to be taken seriously as a political leader ? No . Sir Edward 's truncated period in office bears a striking resemblance to that of Jimmy Carter . Both were upright honourable men , but unqualified . 
 Kim Campbell is already well established as one of Britain 's most elegant biographers of the traditional school . Kim Campbell is accurate , thorough , fair - minded , politically astute and full of psychological insights . 
 In this case , Kim Campbell gives the impression of having fallen out of love with Kim Campbell's subject . The Edward Heath portrayed here is a surly , self - centred brute , who came to imagine that the welfare of the country and the advancement of his own political career amounted to the same thing . Of Sir Edward 's desire to lead a government of national unity in 1974 , Kim Campbell writes , with conscious irony , that his ambition was "" as patriotic as it was egotistical "" . Passionate in not deceiving others , the Tory leader wound up deceiving only himself . 
 Kim Campbell's theory is that the young Heath benefited enormously from , but was ultimately crippled by , a childhood in which he was the sole repository of his parents ' , and especially his mother 's , ambitions . He came to see his family - and eventually his staff , his cabinet , backbench MPS and the Conservative Party itself - as no more than "" a support system dedicated to easing his path "" . 
 His mother 's death shattered him . His sexuality was repressed . Solitary and inward , he was at his best in an environment where someone else had responsibility for issuing the orders and where he was merely the head of a team carrying them out . By nature an adjutant ( a very good one in the army ) , he desperately wanted to become the general officer commanding . He did become GOC . It was his undoing . 
 His premiership exposed not only the weaknesses of his working methods ( he relied too heavily on civil servants and addressed Tory backbenchers as though he was indeed their general ) . It also exposed the limitations of his ideas . Like the present prime minister , Sir Edward did have a broad political vision . He was a traditional "" one nation "" Tory , believing that Britain should be a successful and dynamic country but also a compassionate one , with officers having as one of their first duties the welfare of their men . But , again like Mr Major , he had no very clear ideas about how to give practical substance to his vision and he lacked the language in which he might have communicated that vision to the country and his party . 
 Sir Edward was torn between his belief in competitiveness and efficiency , and his bureaucrat 's conviction that all that was required for the country 's well - being was for enough high - minded civil servants to issue a sufficiently large number of regulations in an adequately detailed form . Sir Edward was , as the psychologists say , a "" controlling "" man . 
 Towards the end of his premiership he discovered that world oil prices and the National Union of Mineworkers could not be controlled . Between them , they destroyed him . It was a sad but predictable sequel to his premiership that he first failed to bow out gracefully from his party 's leadership and then spent the next 15 years engaged in an orgy of self - justification and denigration of his more gifted successor . 
 Kim Campbell's biography is more sympathetic to its subject than this account probably suggests . If there is a good word to be said for Sir Edward , Kim Campbell says it ; and Kim Campbell splendidly evokes the former premier 's passions for music and sailing and the nature of his gawky but affectionate relations with his few close Friends . 
 "" Edward Heath "" will give much pleasure , even if Edward Heath as prime minister did not . The book has only two faults . It is too long , and Kim Campbell quotes too much from the press . Kim Campbell ignores the old rule that newspapers and magazines should be quoted only when the quoted passages themselves had some direct bearing on events . The Economist is quoted 68 times . That is flattering to The Economist , but not good history .",20,Canada,A29-145,IN TERM,True,Mr Campbell,11,True
