date,link,text,resolved_text,ccode,country,leadid,pre_in_post_term,coreference_resolved_ind,main_cluster_identified,number_spans_replaced,campbell
1993-09-11,https://www-proquest-com.proxy.uchicago.edu/abicomplete/docview/224140650/fulltext/86CD1DF5B9E546DAPQ/1?accountid=14657,"A Scottish lawyer was hired to defend the two Libyans suspected of blowing up a Pan Am airliner over Lockerbie in December 1988, The men, still in Libra, are now expected to give themselves up to face a trial in Scotland.
Despite dissent, the signing of a Palestinian-Israeli accord edged closer, as the two sides agreed on a wording for mutual recognition.
Israel's high court ordered the prime minister to get rid of two ministers, suspected of corruption, who belong to the ultra-orthodox Shas party. One of them said he would resign. The coalition could be in trouble.
South Africa's multi-party negotiators agreed to set up a transitional executive council, bringing blacks into central government for the first time. The good news was overshadowed 24 hours later by a massacre of 21 blacks queuing at a Johannesburg taxi-rank by a band of gunmen. Dozens more were wounded.
The Nigerian oil-workers' union, Nupeng, agreed to end a pro-democracy strike that had led to chronic petrol shortages across the country.
UN helicopters launched another raid on strongholds of General Mohammed Farrah Aideed, the fugitive Somali warlord. The attack followed an ambush by General Aideed's gunmen which killed seven Nigerian UN peacekeepers.
RETURNED TO SENDER
Imelda Marcos accompanied the embalmed body of her husband to burial in the Philippines. Ferdinand Marcos died in Hawaii in 1989. The former president had been deposed in 1986 in a popular uprising.
The prime ministers of India and China signed an agreement in Beijing designed to end border disputes between the two countries.
Taiwan said it may step up naval patrols around the Spratly and Pratas islands in the South China Sea. Taiwanese marines are stationed on the Spratlys, potentially oil-rich islands also claimed by China and four other countries. Taiwan and China both claim the Pratas islands.
The committee drafting Cambodia's new constitution has agreed to make the country a constitutional monarchy. Prince Sihanouk, who abdicated as king in favour of his father in 1955, and is now head of state, is the only candidate for the post of king.
The widow of Pakistan's former army chief, Asif Nawaz, who died in January, said that she had sent samples of his hair to be tested in a laboratory in America. The results appear to show that he could have been poisoned.
TOPPLED
The Greek prime minister, Constantin Mitsotakis, called an early election after his conservative government lost its parliamentary majority. A string of right-wingers has defected from his party recently.
Russia said that Ukraine had agreed to sell part of its navy (the much-disputed Black Sea fleet) as payment for Ukraine's $2.5 billion debt to Russia and to turn over to Russia warheads from dismantled missiles.
Five ex-Soviet republics agreed to give up their monetary sovereignty to Russia in exchange for continued use of the rouble. They are Armenia, Belorussia, Kazakhstan, Tajikistan and Uzbekistan. Their parliaments must still agree.
Turkey and Iran moved troops to their borders with Azerbaijan, which has lost more territory to Armenian fighters from the enclave of Nagorno-Karabakh. Azerbaijan's president hinted in Moscow that his country might join the Russian-led Commonwealth of Independent States. While in Moscow he was expected to meet the visiting Turkish prime minister to discuss the conflict with Armenia.
The International Football Federation (FIFA) threatened to suspend France from international soccer if Marseille persisted in its legal action over UEFA'S decision to ban it from competing for this year's European Cup. UEFA'S action followed corruption allegations against the club, whose president is Bernard Tapie, in the French league.
A SLIMMER AMERICA
Bill Clinton and Al Gore announced their plans to streamline the bureaucracy, including reforms in procurement, more contracting-out and the possible loss of 252,000 government jobs.
A congressional inquiry revealed that the Clinton White House had paid some employees twice and backdated the pay-rises of others in its first few weeks in office. Officials blamed over-work.
Almost half of all adult Americans have a low level of literacy, said the Department of Education.
Kim Campbell, Canada's prime minister, called an election for October 25th.
Nicaragua was still reeling after President Chamorro's pledge to sack (next year) its Sandinist army chief, Humberto Ortega, and his refusal to go. The right-wing UNO party refused to talk to the left. The Organisation of American States and sundry foreigners tried to mediate.","A Scottish lawyer was hired to defend the two Libyans suspected of blowing up a Pan Am airliner over Lockerbie in December 1988, The men, still in Libra, are now expected to give themselves up to face a trial in Scotland.
Despite dissent, the signing of a Palestinian-Israeli accord edged closer, as the two sides agreed on a wording for mutual recognition.
Israel's high court ordered the prime minister to get rid of two ministers, suspected of corruption, who belong to the ultra-orthodox Shas party. One of them said he would resign. The coalition could be in trouble.
South Africa's multi-party negotiators agreed to set up a transitional executive council, bringing blacks into central government for the first time. The good news was overshadowed 24 hours later by a massacre of 21 blacks queuing at a Johannesburg taxi-rank by a band of gunmen. Dozens more were wounded.
The Nigerian oil-workers' union, Nupeng, agreed to end a pro-democracy strike that had led to chronic petrol shortages across the country.
UN helicopters launched another raid on strongholds of General Mohammed Farrah Aideed, the fugitive Somali warlord. The attack followed an ambush by General Aideed's gunmen which killed seven Nigerian UN peacekeepers.
RETURNED TO SENDER
Imelda Marcos accompanied the embalmed body of her husband to burial in the Philippines. Ferdinand Marcos died in Hawaii in 1989. The former president had been deposed in 1986 in a popular uprising.
The prime ministers of India and China signed an agreement in Beijing designed to end border disputes between the two countries.
Taiwan said it may step up naval patrols around the Spratly and Pratas islands in the South China Sea. Taiwanese marines are stationed on the Spratlys, potentially oil-rich islands also claimed by China and four other countries. Taiwan and China both claim the Pratas islands.
The committee drafting Cambodia's new constitution has agreed to make the country a constitutional monarchy. Prince Sihanouk, who abdicated as king in favour of his father in 1955, and is now head of state, is the only candidate for the post of king.
The widow of Pakistan's former army chief, Asif Nawaz, who died in January, said that she had sent samples of his hair to be tested in a laboratory in America. The results appear to show that he could have been poisoned.
TOPPLED
The Greek prime minister, Constantin Mitsotakis, called an early election after his conservative government lost its parliamentary majority. A string of right-wingers has defected from his party recently.
Russia said that Ukraine had agreed to sell part of its navy (the much-disputed Black Sea fleet) as payment for Ukraine's $2.5 billion debt to Russia and to turn over to Russia warheads from dismantled missiles.
Five ex-Soviet republics agreed to give up their monetary sovereignty to Russia in exchange for continued use of the rouble. They are Armenia, Belorussia, Kazakhstan, Tajikistan and Uzbekistan. Their parliaments must still agree.
Turkey and Iran moved troops to their borders with Azerbaijan, which has lost more territory to Armenian fighters from the enclave of Nagorno-Karabakh. Azerbaijan's president hinted in Moscow that his country might join the Russian-led Commonwealth of Independent States. While in Moscow he was expected to meet the visiting Turkish prime minister to discuss the conflict with Armenia.
The International Football Federation (FIFA) threatened to suspend France from international soccer if Marseille persisted in its legal action over UEFA'S decision to ban it from competing for this year's European Cup. UEFA'S action followed corruption allegations against the club, whose president is Bernard Tapie, in the French league.
A SLIMMER AMERICA
Bill Clinton and Al Gore announced their plans to streamline the bureaucracy, including reforms in procurement, more contracting-out and the possible loss of 252,000 government jobs.
A congressional inquiry revealed that the Clinton White House had paid some employees twice and backdated the pay-rises of others in its first few weeks in office. Officials blamed over-work.
Almost half of all adult Americans have a low level of literacy, said the Department of Education.
Kim Campbell, Canada's prime minister, called an election for October 25th.
Nicaragua was still reeling after President Chamorro's pledge to sack (next year) its Sandinist army chief, Humberto Ortega, and his refusal to go. The right-wing UNO party refused to talk to the left. The Organisation of American States and sundry foreigners tried to mediate.",20,Canada,A29-145,,False,,0,True
1993-09-11,https://www-proquest-com.proxy.uchicago.edu/abicomplete/docview/224160836/fulltext/86CD1DF5B9E546DAPQ/25?accountid=14657,"They have enjoyed one of the sunniest summers they can remember. Now Canadians face a hard-to-forecast general election on October 25th, and a clouded future, whoever wins.
One cloud is political: there will probably be no outright winner. Canada has three major parties, but a first-past-the-post electoral system. So the Conservatives or the Liberals have usually managed to win an overall majority, leaving the New Democrats to play the national conscience, with occasional power in the provinces (as at present in Ontario, British Columbia and Saskatchewan). This year, though, two regional parties are doing well, the separatist Bloc Qubecois and the Alberta-based Reform Party. The best guess is that neither the Conservative prime minister, Kim Campbell, nor the Liberal leader, Jean Chretien, will win a clear majority of the 295 seats. Indeed neither may do better than 120.
This need not be worrying. Minority government is nothing new in Canada, nor need it mean stalemate. Lester Pearson headed two minority Liberal governments in the 1960s that brought in big welfare programmes. Pierre Trudeau had to govern for two years by the grace of the New Democrats, and paid for their support by creating the national oil corporation, Petro-Canada, which brought Canadians inside knowledge of a mainly foreign-owned industry.
Ms Campbell is trying for a third Conservative majority government, but takes pains to call it a first Campbell one, to distance herself from Brian Mulroney, who ended nine years as prime minister in deep unpopularity. In the short time she had before having to call an election, she worked hard on the barbecue circuit to make herself known and liked, but the 47 days of the election campaign will be the test of a relatively untried politician.
She was Mr Mulroney's minister of justice, and then of defence, for less than four years. Mr Chretien, in contrast, held almost all the important portfolios under Mr Trudeau. But few younger voters know or care. As one pollster put it this week, the choice is between a fresh leader with a tired party and a tired leader with a fresh party.
Ms Campbell is trying to get rid of one albatross, or rather seven, inherited from her own defence-ministry past. On September 2nd she announced she would cut from 50 to 43 the number of helicopters that Canada is to buy, still laden with equipment to spot Soviet submarines. Supposedly, this will save C$1 billion ($750m) of the original C$5.8 billion cost; but Ms Campbell's announcement has merely made the deal a live issue again. A nastier affair is still round her neck: a belated flow of revelations of murderous indiscipline in the Canadian Airborne Regiment in Somalia.
The real cloud is economic. With little sin of recovery, and the unemployment rate now at 11.6%, the main issue will be jobs and the recent cost-cutting by the federal government and all ten provincial ones. In the past fiscal year, their combined deficits totalled C$60 billion, nearly 9% of GDP. Ms Campbell, though talking of eliminating today's C$32.6 billion federal deficit within five years, has promised there will be no new or higher taxes. So thousands of civil servants fear for their jobs, other voters for social programmes, such as medicare and pensions.
Jobs will be the issue for the New Democrat leader, Audrey McLauhlin. She has a detailed plan to create 1-1/2m of them over five years, while reducing the deficit and holding taxes steady. This appealing snake-oil, based on investing in everything from modern transportation to a national child-care system, is her party's best hope of climbing from its present sorry 8% in opinion polls. Of its present 43 seats, mostly in western Canada, half are at risk.
The Liberals will publish their full platform only after a week of campaigning. If they are even to come close to a clear majority, they must take two-thirds of the 99 seats in Ontario and--more difficult--regain some 20 in Quebec that they lost to Mr Mulroney, a Quebecker. But the popular Lucien Bouchard and his Bloc Quebecois could win half of the 75 seats there, on the issue of the economy as much as Quebecois sovereignty.","They have enjoyed one of the sunniest summers they can remember . Now Canadians face a hard - to - forecast general election on October 25th , and a clouded future , whoever wins . 
 One cloud is political : there will probably be no outright winner . Canada has three major parties , but a first - past - the - post electoral system . So the Conservatives or the Liberals have usually managed to win an overall majority , leaving the New Democrats to play the national conscience , with occasional power in the provinces ( as at present in Ontario , British Columbia and Saskatchewan ) . This year , though , two regional parties are doing well , the separatist Bloc Qubecois and the Alberta - based Reform Party . The best guess is that neither Kim Campbell , nor the Liberal leader , Jean Chretien , will win a clear majority of the 295 seats . Indeed neither may do better than 120 . 
 This need not be worrying . Minority government is nothing new in Canada , nor need it mean stalemate . Lester Pearson headed two minority Liberal governments in the 1960s that brought in big welfare programmes . Pierre Trudeau had to govern for two years by the grace of the New Democrats , and paid for their support by creating the national oil corporation , Petro - Canada , which brought Canadians inside knowledge of a mainly foreign - owned industry . 
 Kim Campbell is trying for a third Conservative majority government , but takes pains to call it a first Campbell one , to distance Kim Campbell from Brian Mulroney , who ended nine years as prime minister in deep unpopularity . In the short time Kim Campbell had before having to call an election , Kim Campbell worked hard on the barbecue circuit to make Kim Campbell known and liked , but the 47 days of the election campaign will be the test of a relatively untried politician . 
 Kim Campbell was Mr Mulroney 's minister of justice , and then of defence , for less than four years . Mr Chretien , in contrast , held almost all the important portfolios under Mr Trudeau . But few younger voters know or care . As one pollster put it this week , the choice is between a fresh leader with a tired party and a tired leader with a fresh party . 
 Kim Campbell is trying to get rid of one albatross , or rather seven , inherited from Kim Campbell's own defence - ministry past . On September 2nd Kim Campbell announced Kim Campbell would cut from 50 to 43 the number of helicopters that Canada is to buy , still laden with equipment to spot Soviet submarines . Supposedly , this will save C$ 1 billion ( $ 750 m ) of the original C$ 5.8 billion cost ; but Kim Campbell's announcement has merely made the deal a live issue again . A nastier affair is still round Kim Campbell's neck : a belated flow of revelations of murderous indiscipline in the Canadian Airborne Regiment in Somalia . 
 The real cloud is economic . With little sin of recovery , and the unemployment rate now at 11.6 % , the main issue will be jobs and the recent cost - cutting by the federal government and all ten provincial ones . In the past fiscal year , their combined deficits totalled C$ 60 billion , nearly 9 % of GDP . Kim Campbell , though talking of eliminating today 's C$ 32.6 billion federal deficit within five years , has promised there will be no new or higher taxes . So thousands of civil servants fear for their jobs , other voters for social programmes , such as medicare and pensions . 
 Jobs will be the issue for the New Democrat leader , Audrey McLauhlin . She has a detailed plan to create 1 - 1/2 m of them over five years , while reducing the deficit and holding taxes steady . This appealing snake - oil , based on investing in everything from modern transportation to a national child - care system , is her party 's best hope of climbing from its present sorry 8 % in opinion polls . Of its present 43 seats , mostly in western Canada , half are at risk . 
 The Liberals will publish their full platform only after a week of campaigning . If they are even to come close to a clear majority , they must take two - thirds of the 99 seats in Ontario and -- more difficult -- regain some 20 in Quebec that they lost to Mr Mulroney , a Quebecker . But the popular Lucien Bouchard and his Bloc Quebecois could win half of the 75 seats there , on the issue of the economy as much as Quebecois sovereignty .",20,Canada,A29-145,IN TERM,True,"the Conservative prime minister , Kim Campbell",14,True
1993-10-16,https://www-proquest-com.proxy.uchicago.edu/abicomplete/docview/224156612/fulltext/F1455E6CC192419FPQ/26?accountid=14657,"VOTERS are braced for a volcanic change in Canada's political landscape. For as long as most can remember, the federal government has been run by one of two parties, usually the Liberals but for the past nine years the Progressive Conservatives, with the New Democrats as a strong third party providing a social conscience. After the general election on October 25th, two regional parties, the Bloc Quebecois and the Reform Party, are expected to have knocked the traditional pattern aside.
Under Brian Mulroney, the Tories won two handsome victories, based on strong support both in Mr Mulroney's native Quebec and in oil-rich Alberta in western Canada. But these two Tory pillars grew wobbly when Kim Campbell took over the leadership in June; during the 47-day election campaign they have visibly crumbled. Ms Campbell, a lawyer from British Columbia who had difficulties in the French-language television debate, has seen Mr Mulroney's followers slide over to the Bloc Quebecois, which is expected to win most of Quebec's 75 seats. Meanwhile, Preston Manning, the son of a former premier of Alberta, has spread enthusiasm for the simple verities of his Reform Party--a balanced budget, smaller government, less immigration through western Canada and into Ontario.
The main pre-election question is whether the Liberals under Jean Chretien will win a narrow majority of the 295 seats, or have to struggle as a coalition or minority government. The Liberals have won support with their plausible plan for job-creation, a more attractive line--in a country with chronic unemployment now running above ll%--than Ms Campbell's insistence on reducing the budget deficit. But debts and deficits remain, and the new Reform MPS, plus whatever is left of the Tories, will undoubtedly chase the issue of economic management.
The Bloc Quebecois may well help Mr Chretien out on economic questions; its leader, Lucien Bouchard, places the party left of centre. But as a party fighting for Quebec sovereignty (a supposedly unfrightening form of separatism), it will otherwise be at logerheads with the Liberals. Somewhat in the tradition of Charles Stewart Parnell and Irish home rule in the British Parliament of the 1880s, its overriding object in coming to Ottawa is to fight for Quebec's interests and to prepare the way for Quebec's departure from the Canadian confederation within three years. Mr Bouchard's timetable is based on Quebec's provincial election next year, which his separatist ally (not contesting the federal election), the Parti Quebecois, may well win.
Mr Chretien's campaign has fared reasonably well in English Canada partly because people remember his long and respectable record in federal politics as Pierre Trudeau's lieutenant; by contrast Ms Campbell's way across the country has been littered with imprudent remarks. But Mr Chretien's links to Trudeau federalism, which offered no special treatment for Quebec, make him anathema to the nationalists around Mr Bouchard.
When battle is joined in the next constitutional round, it will be bruising. Mr Manning and his colleagues have shown no sympathy for Quebec's aspirations, and indeed their party has grown in reaction to Quebec's influence on Ottawa. The country, after October 25th, will be more divided than ever, though not yet fractured.","VOTERS are braced for a volcanic change in Canada 's political landscape . For as long as most can remember , the federal government has been run by one of two parties , usually the Liberals but for the past nine years the Progressive Conservatives , with the New Democrats as a strong third party providing a social conscience . After the general election on October 25th , two regional parties , the Bloc Quebecois and the Reform Party , are expected to have knocked the traditional pattern aside . 
 Under Brian Mulroney , the Tories won two handsome victories , based on strong support both in Mr Mulroney 's native Quebec and in oil - rich Alberta in western Canada . But these two Tory pillars grew wobbly when Kim Campbell took over the leadership in June ; during the 47 - day election campaign they have visibly crumbled . Kim Campbell has seen Mr Mulroney 's followers slide over to the Bloc Quebecois , which is expected to win most of Quebec 's 75 seats . Meanwhile , Preston Manning , the son of a former premier of Alberta , has spread enthusiasm for the simple verities of his Reform Party -- a balanced budget , smaller government , less immigration through western Canada and into Ontario . 
 The main pre - election question is whether the Liberals under Jean Chretien will win a narrow majority of the 295 seats , or have to struggle as a coalition or minority government . The Liberals have won support with their plausible plan for job - creation , a more attractive line -- in a country with chronic unemployment now running above ll%--than Kim Campbell's insistence on reducing the budget deficit . But debts and deficits remain , and the new Reform MPS , plus whatever is left of the Tories , will undoubtedly chase the issue of economic management . 
 The Bloc Quebecois may well help Mr Chretien out on economic questions ; its leader , Lucien Bouchard , places the party left of centre . But as a party fighting for Quebec sovereignty ( a supposedly unfrightening form of separatism ) , it will otherwise be at logerheads with the Liberals . Somewhat in the tradition of Charles Stewart Parnell and Irish home rule in the British Parliament of the 1880s , its overriding object in coming to Ottawa is to fight for Quebec 's interests and to prepare the way for Quebec 's departure from the Canadian confederation within three years . Mr Bouchard 's timetable is based on Quebec 's provincial election next year , which his separatist ally ( not contesting the federal election ) , the Parti Quebecois , may well win . 
 Mr Chretien 's campaign has fared reasonably well in English Canada partly because people remember his long and respectable record in federal politics as Pierre Trudeau 's lieutenant ; by contrast Kim Campbell's way across the country has been littered with imprudent remarks . But Mr Chretien 's links to Trudeau federalism , which offered no special treatment for Quebec , make him anathema to the nationalists around Mr Bouchard . 
 When battle is joined in the next constitutional round , it will be bruising . Mr Manning and his colleagues have shown no sympathy for Quebec 's aspirations , and indeed their party has grown in reaction to Quebec 's influence on Ottawa . The country , after October 25th , will be more divided than ever , though not yet fractured .",20,Canada,A29-145,IN TERM,True,Kim Campbell,4,True
