date,link,text,resolved_text,ccode,country,leadid,pre_in_post_term,coreference_resolved_ind,main_cluster_identified,number_spans_replaced,campbell
1993-07-10,https://www-proquest-com.proxy.uchicago.edu/abicomplete/docview/224145154/fulltext/F1D4DE66CE444BFAPQ/46?accountid=14657,"You've heard it all before. People are fed up with both Tories and socialists. A vacuum, people are told, is beckoning--ideological, constitutional, moral. The system is breaking down, anti-politics rules, and soon. ""There's a new climate of pluralism,"" says Paddy Ashdown, the Liberal Democratic leader, who has taken to mentioning Ross Perot, the maverick American populist. Anything can happen anywhere, his rumination seems to imply. Prime minister Ashdown?
Soa Middle Party is surging, as it often has before. The Liberals, the Alliance, the Salads, the Social Democrats, the Lib Dems--whatever confusing third-party vegetable happens to be in vogue at the time--suddenly start winning by-elections by outrageous margins. Old hands are unimpressed.
Right now, however, a lot of Tory MPS are more rattled than they publicly let on. Most of them expect the Liberal Democrats, at the end of this month, to win the by-election at Christchurch, hitherto one of the safest Tory seats in the country. More people--not many, it must be admitted--pretend to keep a straight face when Mr Ashdown says he ""accepts no lesser aim than for my party to be the government."" What Roy Jenkins, the one-time Labour chancellor who is now leader of the Lib Dems in the Lords, used to call the ""great breakthrough"" (sounding, in his fruity diction, like a ""great grapefruit"") is once again earnestry discussed.
In statistical history, Britain has indeed been here before. In late 1981, Gallup reckoned that exactly half the population wanted to vote for the Alliance; two years later, 26% did, and it won just 23 seats. In 1985, the pollsters' figure hit 39%, but two years later, the Alliance won 23% of the vote and only 22 seats. Last year, the polls passed 20%, but at the general election the Lib Dems won 18% and 20 seats. Now, says Gallup, they are back up to 27%--knocking the Tories into third place for the first time this decade. ""So what?"", say the old hands. Wait for the real thing, a general election in 1997...
The Liberal Democrats naturally insist that circumstances are promisingly different. They have grown up. On a lot of issues, their policies remain pleasantry vague and inconsistent, but the disgruntled voters do not care a jot. The sandals, beards, woolly hats and single-issue obsessions are far less embarrassingly visible. ""You mustn't confuse the modern Liberal Democrats with the old Liberal Party,"" says Mr Ashdown. ""We're no longer the party of protest; we're the party of power.""
Such claims no longer sound silly. Just as Labour still has its sturdy electoral fortress in the decaying industrial north, so the Lib Dems have a chance of entrenching themselves much more deeply than before in the south, especially the southwest, where Tory MPS are sounding openly defeatist about their prospects at the next general election. If Labour loses its deposit in Christchurch, as it did in Newbury, the message to left-of-centre southerners may sink in: Lib Dems can replace Labour as the party of opposition in the less proletarian south. Georaphical concentration is the key: remember how in 1983 Labour won 209 seats to the Alliance's 23, with only 2 more votes. Fifty seats next time, say Lib Dem strategists, is now truly realistic.
Such hopes are nourished by deepening roots in local government. In the past dozen years, the number of Lib Dem councillors has trebled. Their party runs, alone or as the biggest party, more than a quarter of county councils in England and Wales. ""Build-up"", not ""breakthrough"", is the buzzword. Watch the Euro-election and the urban elections next summer.
The other clue to the future is how Lib Dem and Labour types are co-operating in counties like Berkshire and Hampshire or boroughs like Waverley in Surrey. Ordinary voters are watching to see if LibLab partnership can be fiscally sound. This raises the far more serious question of Lib-Labbery at the national level. A lot farther down the road, it is worth examining the prospect of a new social-democratic alternative to Tory rule, perhaps even an eventual merger of the civilised, free-market part of the Labour Party with the Lib Dems.
Such possibilities may be far-fetched. But they are more worth mulling over than ever before. The route would be tortuous and require bags of luck. Publicly, both parties shrink from pact chatter. It is electorally too dodgy. Many Tories still would not vote Liberal if that meant putting in Labour. Labour still hopes to win outright. The Lib Dems must still hope, at best, for a hung Parliament. Real coalition negotiations would start only after the election.
And Lib-Lab co-operation would be fraught. The promise by John Smith, the Labour leader, of a referendum on electoral reform (the Lib Dems' main demand) might not be quickly fulfilled. Britons might not say Yes. Even if LibLabbery went well, merger talk would not become serious until far into the next Parliament. It would mean a Labour split, and could take years to bear fruit. In any case, the whole idea could be stymied by the Tories winning the next election.
""I write merger off,"" says Mr Ashdown, for sensible tactical reasons. ""I simply write it off."" Nitty-gritty pact plotting is pointless at this stage. Under the surface, however, currents are stirring. Look to Scotland. People like Mr Smith, Donald Dewar and George Robertson for Labour, Sir David Steel, Menzies Campbell, Charles Kennedy and Archy Kirkwood for the Lib Dems are all very matey. They disagree on little. The Lib-Dem principle of equidistance from the big parties is eroding, and will erode faster if Mr Smith can shed his trade-union shackles.
""The best thing for British politics would be for true socialists to run up their flag and say who they are,"" says a leading Lib Dem, nodding at the prospect of a ""mainstream centre-left progressive social democratic party."" Many Tories agree, sotto voce, that their party needs a rest--out of power.
Formal Lib-Labbery is not on today's menu. But the feeling is growing acute that it is ludicrous for the modern end of the Labour Party not, in the longer term, to blend with the Lib Dems. Mr Ashdown probably thinks such sentiment is unduly academic, even self-defeating at this stage. Others near the top of his party are instinctively more amenable. If and when the great grapefruit comes, it might have to be pink.","You've heard it all before. People are fed up with both Tories and socialists. A vacuum, people are told, is beckoning--ideological, constitutional, moral. The system is breaking down, anti-politics rules, and soon. ""There's a new climate of pluralism,"" says Paddy Ashdown, the Liberal Democratic leader, who has taken to mentioning Ross Perot, the maverick American populist. Anything can happen anywhere, his rumination seems to imply. Prime minister Ashdown?
Soa Middle Party is surging, as it often has before. The Liberals, the Alliance, the Salads, the Social Democrats, the Lib Dems--whatever confusing third-party vegetable happens to be in vogue at the time--suddenly start winning by-elections by outrageous margins. Old hands are unimpressed.
Right now, however, a lot of Tory MPS are more rattled than they publicly let on. Most of them expect the Liberal Democrats, at the end of this month, to win the by-election at Christchurch, hitherto one of the safest Tory seats in the country. More people--not many, it must be admitted--pretend to keep a straight face when Mr Ashdown says he ""accepts no lesser aim than for my party to be the government."" What Roy Jenkins, the one-time Labour chancellor who is now leader of the Lib Dems in the Lords, used to call the ""great breakthrough"" (sounding, in his fruity diction, like a ""great grapefruit"") is once again earnestry discussed.
In statistical history, Britain has indeed been here before. In late 1981, Gallup reckoned that exactly half the population wanted to vote for the Alliance; two years later, 26% did, and it won just 23 seats. In 1985, the pollsters' figure hit 39%, but two years later, the Alliance won 23% of the vote and only 22 seats. Last year, the polls passed 20%, but at the general election the Lib Dems won 18% and 20 seats. Now, says Gallup, they are back up to 27%--knocking the Tories into third place for the first time this decade. ""So what?"", say the old hands. Wait for the real thing, a general election in 1997...
The Liberal Democrats naturally insist that circumstances are promisingly different. They have grown up. On a lot of issues, their policies remain pleasantry vague and inconsistent, but the disgruntled voters do not care a jot. The sandals, beards, woolly hats and single-issue obsessions are far less embarrassingly visible. ""You mustn't confuse the modern Liberal Democrats with the old Liberal Party,"" says Mr Ashdown. ""We're no longer the party of protest; we're the party of power.""
Such claims no longer sound silly. Just as Labour still has its sturdy electoral fortress in the decaying industrial north, so the Lib Dems have a chance of entrenching themselves much more deeply than before in the south, especially the southwest, where Tory MPS are sounding openly defeatist about their prospects at the next general election. If Labour loses its deposit in Christchurch, as it did in Newbury, the message to left-of-centre southerners may sink in: Lib Dems can replace Labour as the party of opposition in the less proletarian south. Georaphical concentration is the key: remember how in 1983 Labour won 209 seats to the Alliance's 23, with only 2 more votes. Fifty seats next time, say Lib Dem strategists, is now truly realistic.
Such hopes are nourished by deepening roots in local government. In the past dozen years, the number of Lib Dem councillors has trebled. Their party runs, alone or as the biggest party, more than a quarter of county councils in England and Wales. ""Build-up"", not ""breakthrough"", is the buzzword. Watch the Euro-election and the urban elections next summer.
The other clue to the future is how Lib Dem and Labour types are co-operating in counties like Berkshire and Hampshire or boroughs like Waverley in Surrey. Ordinary voters are watching to see if LibLab partnership can be fiscally sound. This raises the far more serious question of Lib-Labbery at the national level. A lot farther down the road, it is worth examining the prospect of a new social-democratic alternative to Tory rule, perhaps even an eventual merger of the civilised, free-market part of the Labour Party with the Lib Dems.
Such possibilities may be far-fetched. But they are more worth mulling over than ever before. The route would be tortuous and require bags of luck. Publicly, both parties shrink from pact chatter. It is electorally too dodgy. Many Tories still would not vote Liberal if that meant putting in Labour. Labour still hopes to win outright. The Lib Dems must still hope, at best, for a hung Parliament. Real coalition negotiations would start only after the election.
And Lib-Lab co-operation would be fraught. The promise by John Smith, the Labour leader, of a referendum on electoral reform (the Lib Dems' main demand) might not be quickly fulfilled. Britons might not say Yes. Even if LibLabbery went well, merger talk would not become serious until far into the next Parliament. It would mean a Labour split, and could take years to bear fruit. In any case, the whole idea could be stymied by the Tories winning the next election.
""I write merger off,"" says Mr Ashdown, for sensible tactical reasons. ""I simply write it off."" Nitty-gritty pact plotting is pointless at this stage. Under the surface, however, currents are stirring. Look to Scotland. People like Mr Smith, Donald Dewar and George Robertson for Labour, Sir David Steel, Menzies Campbell, Charles Kennedy and Archy Kirkwood for the Lib Dems are all very matey. They disagree on little. The Lib-Dem principle of equidistance from the big parties is eroding, and will erode faster if Mr Smith can shed his trade-union shackles.
""The best thing for British politics would be for true socialists to run up their flag and say who they are,"" says a leading Lib Dem, nodding at the prospect of a ""mainstream centre-left progressive social democratic party."" Many Tories agree, sotto voce, that their party needs a rest--out of power.
Formal Lib-Labbery is not on today's menu. But the feeling is growing acute that it is ludicrous for the modern end of the Labour Party not, in the longer term, to blend with the Lib Dems. Mr Ashdown probably thinks such sentiment is unduly academic, even self-defeating at this stage. Others near the top of his party are instinctively more amenable. If and when the great grapefruit comes, it might have to be pink.",20,Canada,A29-145,,False,,0,True
1993-08-21,https://www-proquest-com.proxy.uchicago.edu/abicomplete/docview/224157535/fulltext/6569F9D65D104867PQ/26?accountid=14657,"In her two months as Canada's prime minister, Kim Campbell has brought her Progressive Conservative Party within striking distance of the Liberals, led by Jean Chretien. Most Canadian federal elections in the past quarter-century have been decided on the voters' assessment of party leaders. So her test will come within a few weeks, when she embarks on the 47-day campaign for the election that is almost certain to take place before the end of October.
Ms Campbell has been doing her best to suggest a range of differences with Brian Mulroney's government, without repudiating any of its policies--which she could hardly do since she was first his minister of justice, and then of defence. Her answer is a new image, particularly of herself.
Mr Mulroney, prime minister for nine years until he retired in June, was mistrusted and unpopular except in his native Quebec. His efforts to unify Canadians through constitutional reform and to bring jobs through free-trade agreements were judged a failure. As defence minister, Ms Campbell herself had to defend the purchase of 50 military helicopters costing C$5.8 billion ($4.5 billion).
With the open look of a healthy blonde, she has reflected the sunny mood of summertime Canada. She has avoided controversial issues, preferring to be interviewed by disc jockeys than by political pundits. She has kept photographers busy with her cheerful hats, and she pitched a baseball competently. Flitting across Canada--on national day, July 1st, she greeted the dawn in Newfoundland and watched the sunset in her own British Colombia--she has shed some of her elitist skin. Mr Mulroney used to travel in limousines, but she took the subway in Toronto and walked the streets of Regina when paying a call on two provincial premiers. While the Mulroneys were furnishing their new mansion in Montreal with whirlpools in every bathroom and trying to sell their prime-ministerial furniture to the government, she was telling radio-show audiences that she had not even bought linen for her official residence.
As a first move towards fulfilling her promise--made when she was fighting for the party leadership--to eliminate the present C$32.6 billion federal deficit within five years, she cut the cabinet by eight ministers, and the civil service by nine government departments. She also refused to sign election nomination papers for three Quebec parliamentarians who face charges of misusing public funds; a step designed to appeal to supporters of the Reform Party, which has sprung to influence in western Canada. For Canadian nationalists who maintained that Mr Mulroney was a branch-plant American, Ms Campbell and her external affairs minister, Perrin Beatty, have managed to distance themselves a little: lifting a ban on aid to Cuba, opposing an air strike in Bosnia and holding out against sanctions in Bill Clinton's NAFTA side-deals (see page 21).
The summer has been less kind to Mr Chretien and the New Democrat leader, Audrey McLaughlin. Mr Chretien has been embroiled in squabbles with a dozen constituency associations, accused of using his position to ""parachute"" high-powered names on to the list of Liberal candidates. He was one of Pierre Trudeau's most energetic ministers but now, it seems, his folksy style belongs to an older generation of politics. For her part, Ms McLaughlin stumbled when, on August 11th, she bought an hour of network time for a ""television town-hall meeting"". Her admission that the opening video was made in Washington brought derision on the leader of a party that has vowed to abrogate the free-trade treaty.","In Kim Campbell two months as Canada 's prime minister , Kim Campbell has brought Kim Campbell's Progressive Conservative Party within striking distance of the Liberals , led by Jean Chretien . Most Canadian federal elections in the past quarter - century have been decided on the voters ' assessment of party leaders . So Kim Campbell's test will come within a few weeks , when Kim Campbell embarks on the 47 - day campaign for the election that is almost certain to take place before the end of October . 
 Kim Campbell has been doing Kim Campbell best to suggest a range of differences with Brian Mulroney 's government , without repudiating any of its policies -- which Kim Campbell could hardly do since Kim Campbell was first his minister of justice , and then of defence . Kim Campbell's answer is a new image , particularly of Kim Campbell . 
 Mr Mulroney , prime minister for nine years until he retired in June , was mistrusted and unpopular except in his native Quebec . His efforts to unify Canadians through constitutional reform and to bring jobs through free - trade agreements were judged a failure . As defence minister , Kim Campbell had to defend the purchase of 50 military helicopters costing C$ 5.8 billion ( $ 4.5 billion ) . 
 With the open look of a healthy blonde , Kim Campbell has reflected the sunny mood of summertime Canada . Kim Campbell has avoided controversial issues , preferring to be interviewed by disc jockeys than by political pundits . Kim Campbell has kept photographers busy with Kim Campbell's cheerful hats , and Kim Campbell pitched a baseball competently . Flitting across Canada -- on national day , July 1st , Kim Campbell greeted the dawn in Newfoundland and watched the sunset in Kim Campbell's own British Colombia -- Kim Campbell has shed some of Kim Campbell's elitist skin . Mr Mulroney used to travel in limousines , but she took the subway in Toronto and walked the streets of Regina when paying a call on two provincial premiers . While the Mulroneys were furnishing their new mansion in Montreal with whirlpools in every bathroom and trying to sell their prime - ministerial furniture to the government , Kim Campbell was telling radio - show audiences that Kim Campbell had not even bought linen for Kim Campbell's official residence . 
 As a first move towards fulfilling Kim Campbell's promise -- made when Kim Campbell was fighting for the party leadership -- to eliminate the present C$ 32.6 billion federal deficit within five years , Kim Campbell cut the cabinet by eight ministers , and the civil service by nine government departments . Kim Campbell also refused to sign election nomination papers for three Quebec parliamentarians who face charges of misusing public funds ; a step designed to appeal to supporters of the Reform Party , which has sprung to influence in western Canada . For Canadian nationalists who maintained that Mr Mulroney was a branch - plant American , Kim Campbell and Kim Campbell's external affairs minister , Perrin Beatty , have managed to distance themselves a little : lifting a ban on aid to Cuba , opposing an air strike in Bosnia and holding out against sanctions in Bill Clinton 's NAFTA side - deals ( see page 21 ) . 
 The summer has been less kind to Mr Chretien and the New Democrat leader , Audrey McLaughlin . Mr Chretien has been embroiled in squabbles with a dozen constituency associations , accused of using his position to "" parachute "" high - powered names on to the list of Liberal candidates . He was one of Pierre Trudeau 's most energetic ministers but now , it seems , his folksy style belongs to an older generation of politics . For her part , Ms McLaughlin stumbled when , on August 11th , she bought an hour of network time for a "" television town - hall meeting "" . Her admission that the opening video was made in Washington brought derision on the leader of a party that has vowed to abrogate the free - trade treaty .",20,Canada,A29-145,IN TERM,True,Kim Campbell,30,True
