date,link,text,resolved_text,ccode,country,leadid,pre_in_post_term,coreference_resolved_ind,main_cluster_identified,number_spans_replaced,gusenbauer
2007-11-24,https://www-proquest-com.proxy.uchicago.edu/abicomplete/docview/223990789/fulltext/B263C5FCE6244A81PQ/5?accountid=14657,"Austria's way of resolving political conflicts
THEY call it a ""consensus democracy"" or ""democracy by negotiation"", and it is tailor-made for their particular needs. When Austria's Second Republic was born after the second world war, the country was desperate to prevent a recurrence of the deep political divisions that, in 1934, had led to a bloody civil war. Thanks to that fear of adversarial politics, 11 of Austria's 20 post-war governments have been ""grand coalitions"" of the two big parties--the centre-right Austrian People's Party (""Blacks"") and the centre-left Social Democratic Party (""Reds"").
After a break starting in 2000, during which the Blacks controversially governed in coalition with the far-right Freedom Party (""Blues""), the most recent election in October 2006 produced yet another grand coalition (see chart 2) after the Social Democrats, led by Alfred Gusenbauer, unexpectedly finished slightly ahead of the People's Party. Mr Gusenbauer, a 47-year-old career politician, duly bagged the job of chancellor he had always wanted, but had to cede a number of other key posts--including finance, economy and foreign affairs--to the People's Party. Some supporters accused him of failing to carry out election promises, such as cancelling Austria's order for Eurofighter planes and rescinding recently introduced university tuition fees, but he had little choice.
So far this has proved an ill-tempered match, with constant bickering between the partners. Even so, they are likely to stick together for the whole of the current electoral term, which ends in 2010. Neither wants to be responsible for breaking up the coalition, for fear of something worse.
Coalitions are rarely easy. The previous government, headed by the People's Party's Wolfgang Schussel, faced a different set of problems. In the 1999 election the Blues, led by the controversial Jorg Haider, enjoyed a triumph after a xenophobic campaign, capturing nearly 27% of the vote, almost the same as the Blacks. The People's Party eventually formed a coalition with Mr Haider's outfit, provoking huge protests at home and a cold shoulder for Austria from other EU countries for a few months (see previous article). Mr Haider went back to his home in Carinthia, a deeply conservative region where he is now state premier.
The Black-Blue coalition fell apart after only a couple of years, but was reinstated after a snap election in 2002 at which Mr Schussel's strategy was vindicated. His party's share of the vote rose steeply whereas that of the Freedom Party plummeted. In 2005 the Blues weakened themselves further by splitting into a mainstream wing and a more extreme fringe. They now seem consigned to minor-party status (unlike in Switzerland, where in last month's elections the right-wing Swiss People's Party won 29% of the vote).
As the newly dominant partner in Austria's coalition, the People's Party was left free to introduce a number of overdue reforms, including a reorganisation of the state pension scheme, a shake-up of the universities and a cut in the corporate-tax rate from 34% to 25%. Most polls ahead of last year's election suggested that it would be rewarded with a bigger share of the vote. But many Austrians felt that the Schussel government was ""socially cold"", ie, too free-market-oriented, and voted Social Democrat instead--so the country ended up with yet another grand coalition.
Something for everyone
The fact is that most Austrians are perfectly happy with that. They are used to a system in which power and jobs are shared out to reflect a wide range of opinion. For most of the post-war period an important element of Austrian politics has been the Proporz, a form of ""jobs for the boys"" in which posts and contracts in the public sector and state-owned industry were divvied up among supporters of the two big parties. That meant they had to work closely together, but were also able to keep an eye on each other. In a small country, everybody knows everybody else anyway, but belonging to a party was often a great help in advancing one's career, which explains why party membership in Austria, at 15% of the adult population, is among the highest in the West. The Proporz now seems to be somewhat in retreat, not least because most state industries have been privatised so there are fewer jobs to be handed out; but it has far from disappeared.
The same sort of thing happens in the nine states in Austria's federal system. Most of them give all parties of any size the right to take part in the state government, with posts handed out in proportion to their share of the vote. This makes it hard to form governments, but at least nobody can complain about having been left out.
Austrians are good at striking compromises. Hannes Androsch, a former vice-chancellor turned businessman, explains that in Germany the word grundsatzlich (in principle) means ""no""; in Austria it means ""yes"". Disagreements are resolved by sitting round a table and talking until everybody has got a bit of what he wants.
The same idea is enshrined in Austria's post-war system of ""social partnership"", a mechanism through which government, employers and employees co-operate over pay and economic policy. It is seen almost as a second arm of government. The main bodies involved are chambers of commerce and workers' chambers, both of which have compulsory membership and elected representatives. Trade unions also play a part but have lost clout in recent years, and have been damaged by a corruption scandal over BAWAG, a bank they used to own but had to sell.
Corporatism may be out of fashion elsewhere, but in Austria it seems to deliver results. Strikes are extremely rare, pay settlements tend to be reasonable and unit labour costs are forever dropping. Growth is higher and unemployment lower than in comparable countries. Industrialists cite the system as a source of competitive advantage; labour representatives see it as a way of achieving social justice. For all that its demise is being regularly predicted, there seems to be plenty of life left in it.
Isn't this all a bit too cosy? The consensus model may not be corrupt (in fact, Austria comes off well in international comparisons of corruption), but it is certainly not transparent. People who are not ready or able to work through the entrenched institutions lose out. And because it takes time to get everyone to agree, change is necessarily slow, perhaps too slow. Besides, many of the rules that govern business are no longer made in Vienna but in Brussels or farther afield, so there is a limit to what can be decided behind Austria's closed doors.
And those grand coalitions? Austrian voters may not mind them, but many politicians long for a system that produces clearer majorities. Germany next door, with a different system of proportional representation, has mostly avoided grand coalitions until recently and seems uncomfortable with the present one. Austria has produced a constant stream of proposals to reform its voting system, but the smaller parties tend to resist them. The latest idea is for a minderheitsfreundliches Mehrheitswahlrecht, a first-past-the-post system that takes account of the interests of minorities. But it is hard to believe that anything will come of it: too many people have too much to lose.
Agreement has been reached, though, on a few other, less radical changes to the political system. Starting with the next election in 2010, the standard term of government will increase from four to five years; postal voting will become available to everyone; and the active voting age will come down from 18 to a surprising 16.
That may be a slight help to the Greens, who in the 2006 election garnered over 11% of the poll, a little more than the Freedom Party. Their voters are predominantly middle-class, prosperous, environmentally concerned--and younger than supporters of other parties. The Greens' boss, Alexander Van der Bellen, a mild-mannered economics professor, thinks there is a chance that his party could enter the government after the next election, as a potential coalition partner for either of the big parties. That would be a novel feature in the Austrian political landscape.
Caption: Gusenbauer got what he wanted","Austria 's way of resolving political conflicts 
 THEY call it a "" consensus democracy "" or "" democracy by negotiation "" , and it is tailor - made for their particular needs . When Austria 's Second Republic was born after the second world war , the country was desperate to prevent a recurrence of the deep political divisions that , in 1934 , had led to a bloody civil war . Thanks to that fear of adversarial politics , 11 of Austria 's 20 post - war governments have been "" grand coalitions "" of the two big parties -- the centre - right Austrian People 's Party ( "" Blacks "" ) and the centre - left Social Democratic Party ( "" Reds "" ) . 
 After a break starting in 2000 , during which the Blacks controversially governed in coalition with the far - right Freedom Party ( "" Blues "" ) , the most recent election in October 2006 produced yet another grand coalition ( see chart 2 ) after the Social Democrats , led by Alfred Gusenbauer , unexpectedly finished slightly ahead of the People 's Party . Alfred Gusenbauer duly bagged the job of chancellor Alfred Gusenbauer had always wanted , but had to cede a number of other key posts -- including finance , economy and foreign affairs -- to the People 's Party . Some supporters accused Alfred Gusenbauer of failing to carry out election promises , such as cancelling Austria 's order for Eurofighter planes and rescinding recently introduced university tuition fees , but Alfred Gusenbauer had little choice . 
 So far this has proved an ill - tempered match , with constant bickering between the partners . Even so , they are likely to stick together for the whole of the current electoral term , which ends in 2010 . Neither wants to be responsible for breaking up the coalition , for fear of something worse . 
 Coalitions are rarely easy . The previous government , headed by the People 's Party 's Wolfgang Schussel , faced a different set of problems . In the 1999 election the Blues , led by the controversial Jorg Haider , enjoyed a triumph after a xenophobic campaign , capturing nearly 27 % of the vote , almost the same as the Blacks . The People 's Party eventually formed a coalition with Mr Haider 's outfit , provoking huge protests at home and a cold shoulder for Austria from other EU countries for a few months ( see previous article ) . Mr Haider went back to his home in Carinthia , a deeply conservative region where he is now state premier . 
 The Black - Blue coalition fell apart after only a couple of years , but was reinstated after a snap election in 2002 at which Mr Schussel 's strategy was vindicated . His party 's share of the vote rose steeply whereas that of the Freedom Party plummeted . In 2005 the Blues weakened themselves further by splitting into a mainstream wing and a more extreme fringe . They now seem consigned to minor - party status ( unlike in Switzerland , where in last month 's elections the right - wing Swiss People 's Party won 29 % of the vote ) . 
 As the newly dominant partner in Austria 's coalition , the People 's Party was left free to introduce a number of overdue reforms , including a reorganisation of the state pension scheme , a shake - up of the universities and a cut in the corporate - tax rate from 34 % to 25 % . Most polls ahead of last year 's election suggested that it would be rewarded with a bigger share of the vote . But many Austrians felt that the Schussel government was "" socially cold "" , ie , too free - market - oriented , and voted Social Democrat instead -- so the country ended up with yet another grand coalition . 
 Something for everyone 
 The fact is that most Austrians are perfectly happy with that . They are used to a system in which power and jobs are shared out to reflect a wide range of opinion . For most of the post - war period an important element of Austrian politics has been the Proporz , a form of "" jobs for the boys "" in which posts and contracts in the public sector and state - owned industry were divvied up among supporters of the two big parties . That meant they had to work closely together , but were also able to keep an eye on each other . In a small country , everybody knows everybody else anyway , but belonging to a party was often a great help in advancing one 's career , which explains why party membership in Austria , at 15 % of the adult population , is among the highest in the West . The Proporz now seems to be somewhat in retreat , not least because most state industries have been privatised so there are fewer jobs to be handed out ; but it has far from disappeared . 
 The same sort of thing happens in the nine states in Austria 's federal system . Most of them give all parties of any size the right to take part in the state government , with posts handed out in proportion to their share of the vote . This makes it hard to form governments , but at least nobody can complain about having been left out . 
 Austrians are good at striking compromises . Hannes Androsch , a former vice - chancellor turned businessman , explains that in Germany the word grundsatzlich ( in principle ) means "" no "" ; in Austria it means "" yes "" . Disagreements are resolved by sitting round a table and talking until everybody has got a bit of what he wants . 
 The same idea is enshrined in Austria 's post - war system of "" social partnership "" , a mechanism through which government , employers and employees co - operate over pay and economic policy . It is seen almost as a second arm of government . The main bodies involved are chambers of commerce and workers ' chambers , both of which have compulsory membership and elected representatives . Trade unions also play a part but have lost clout in recent years , and have been damaged by a corruption scandal over BAWAG , a bank they used to own but had to sell . 
 Corporatism may be out of fashion elsewhere , but in Austria it seems to deliver results . Strikes are extremely rare , pay settlements tend to be reasonable and unit labour costs are forever dropping . Growth is higher and unemployment lower than in comparable countries . Industrialists cite the system as a source of competitive advantage ; labour representatives see it as a way of achieving social justice . For all that its demise is being regularly predicted , there seems to be plenty of life left in it . 
 Is n't this all a bit too cosy ? The consensus model may not be corrupt ( in fact , Austria comes off well in international comparisons of corruption ) , but it is certainly not transparent . People who are not ready or able to work through the entrenched institutions lose out . And because it takes time to get everyone to agree , change is necessarily slow , perhaps too slow . Besides , many of the rules that govern business are no longer made in Vienna but in Brussels or farther afield , so there is a limit to what can be decided behind Austria 's closed doors . 
 And those grand coalitions ? Austrian voters may not mind them , but many politicians long for a system that produces clearer majorities . Germany next door , with a different system of proportional representation , has mostly avoided grand coalitions until recently and seems uncomfortable with the present one . Austria has produced a constant stream of proposals to reform its voting system , but the smaller parties tend to resist them . The latest idea is for a minderheitsfreundliches Mehrheitswahlrecht , a first - past - the - post system that takes account of the interests of minorities . But it is hard to believe that anything will come of it : too many people have too much to lose . 
 Agreement has been reached , though , on a few other , less radical changes to the political system . Starting with the next election in 2010 , the standard term of government will increase from four to five years ; postal voting will become available to everyone ; and the active voting age will come down from 18 to a surprising 16 . 
 That may be a slight help to the Greens , who in the 2006 election garnered over 11 % of the poll , a little more than the Freedom Party . Their voters are predominantly middle - class , prosperous , environmentally concerned -- and younger than supporters of other parties . The Greens ' boss , Alexander Van der Bellen , a mild - mannered economics professor , thinks there is a chance that his party could enter the government after the next election , as a potential coalition partner for either of the big parties . That would be a novel feature in the Austrian political landscape . 
 Caption : Alfred Gusenbauer got what Alfred Gusenbauer wanted",305,Austria,A30-65,IN TERM,True,Alfred Gusenbauer,7,True
