date,link,text,resolved_text,ccode,country,leadid,pre_in_post_term,coreference_resolved_ind,main_cluster_identified,number_spans_replaced,gusenbauer
2007-12-22,https://www-proquest-com.proxy.uchicago.edu/abicomplete/docview/223991318/fulltext/247663E87E314790PQ/21?accountid=14657,"What the Lisbon and Brussels summits say about today's Europe
IN THESE carbon-conscious times, there was much carping because European Union leaders held a party in Portugal to sign their new treaty, only to fly 1,700km (1,060 miles) to Brussels for a formal summit the next day. This jet-setting was indeed wasteful, and not only in the obvious way. The Lisbon bash on December 13th was both interesting and revealing; it was the summit in Brussels that was dull and largely devoid of substance.
Lisbon's revelations included the fact that EU leaders are unsure how to treat their union's almost-anthem, the ""Ode to Joy"". This bit of Beethoven's ninth symphony was given formal status in the defunct EU constitution only to be ditched, along with the flag and the motto, when the text was reworked into a ""reform treaty"". In Lisbon it took a moment for people to recognise the Beethoven being thumped out on a piano. But as a choir began singing the ""Ode to Joy"", most jumped to their feet (the Austrian chancellor, Alfred Gusenbauer, showily singing along).
It took an instant longer for some, including Britain's foreign secretary, David Miliband, to stand. History can only guess what his boss, Gordon Brown, would have done had he made it to the ceremony. Alas, Britain's prime minister arrived in Lisbon hours late, after a wholly unconvincing diary clash. As a man unimpressed by Euro-flummery, he signed the treaty alone at a vast desk, as if acting out ""splendid isolation"" in a diplomatic game of charades. It is revealing that his doing so caused a fuss. Within the EU, Mr Brown's semi-absence from the stage is now presented as a problem, unbalancing the triangle of the union's heavyweights, France, Germany and Britain.
In Brussels, there is much talk of the awful personal chemistry between Germany's chancellor, Angela Merkel, and France's president, Nicolas Sarkozy, even if the machinery of Franco-German co-operation remains. It would be hard to find two more different personalities, suggests one senior figure. Ms Merkel is a calm scientist, attentive to detail. Mr Sarkozy is ""excitable"", and a ""pure political animal"". One European minister says simply: ""A lot of European politics at the moment is about Sarkozy management. You have all this policy coming out in spasms, the idea is to limit the collateral damage.""
European leaders agreed to two things in Brussels. The first was to send 1,800 policemen, judges and officials to Kosovo. This matters, but not as much as it sounds. The mission was agreed only in principle and its legal basis remains unclear. The second was to create a ""reflection group"", which has until June 2010 to think about the challenges facing the EU between 2020 and 2030. In case that pace seems too breakneck, the group (chaired by a former Spanish prime minister, Felipe Gonzalez, with help from a former Latvian president, Vaira Vike-Freiberga, and from Jorma Ollila, a Finnish businessman who chairs both Nokia and Royal Dutch Shell) has until the second half of next year merely to choose its nine members. That was about it, even though the summit conclusions ramble on for many pages--talking of the ""crucial role"" of tourism, asking for a ""strategy for the Baltic Sea region"". The summit lasted less than a day, stunning veterans used to coffee-fuelled marathons lasting 36 hours or more.
Boosters talk up the Lisbon treaty as relaunching the EU after its constitutional crisis. Judging by the summit's mood it is more like a coalition government that has only just survived a vote of no confidence in parliament: everyone is weary and wary of fresh divisions, at least until the treaty is safely ratified. The next big Euro-row (about allocating targets for cuts in carbon emissions) cannot start until next year, when a proposal will be made by the European Commission. Subjects that might have triggered squabbles at this summit were mostly dealt with beforehand: a funding dispute about Galileo, a planned European satellite-navigation system to rival America's GPS; another spat about Turkey's membership negotiations.
The limits to Europe
Many December summits have featured rows about enlargement. There could have been an especially nasty one this time: Mr Sarkozy's hostility to Turkish accession is visceral. Indeed, it is the reason for the new reflection group. In August Mr Sarkozy made clear that France would block any more talks with Turkey unless a group of ""sages"" was invited to ponder the future. Such groups are not actually meant to reflect; they usually act as stalking horses for factions pushing big innovations, such as the single currency. So Mr Sarkozy's colleagues assumed that he wanted the reflection group to define Europe's future borders (and to discover that Turkey lies beyond them).
Several governments, backed by the commission, accordingly fought to give the group a less alarming brief. Its mandate now makes no mention of borders, and it explicitly rules out discussion of the next EU budget or further changes to institutions. But efforts to defang the beast did not quite succeed: language about studying the stability of the EU and ""the wider region"" will surely allow the group to discuss enlargement.
Fizzing with excitement, Mr Sarkozy insisted that the group would ""certainly"" ask whether the EU needed frontiers, to determine whether political union was part of a ""new European dream"". Yet in a next-door room Mr Brown offered a wholly different vision: the group would discuss ""economic, environmental and security challenges"" and globalisation. Indeed, Mr Brown's mood visibly lifted as he talked of the ""exciting"" prospect of more EU co-operation with such bodies as the IMF. And when he got to the Bank of International Settlements, he became positively cheerful.
The conclusion is clear. EU leaders disagree profoundly about what Europe is: a political project, or just an exercise in international economic governance. A summit that debated these differences would be worth holding. But this summit was not. A more rational EU would have simply scrapped it.","What the Lisbon and Brussels summits say about today's Europe
IN THESE carbon-conscious times, there was much carping because European Union leaders held a party in Portugal to sign their new treaty, only to fly 1,700km (1,060 miles) to Brussels for a formal summit the next day. This jet-setting was indeed wasteful, and not only in the obvious way. The Lisbon bash on December 13th was both interesting and revealing; it was the summit in Brussels that was dull and largely devoid of substance.
Lisbon's revelations included the fact that EU leaders are unsure how to treat their union's almost-anthem, the ""Ode to Joy"". This bit of Beethoven's ninth symphony was given formal status in the defunct EU constitution only to be ditched, along with the flag and the motto, when the text was reworked into a ""reform treaty"". In Lisbon it took a moment for people to recognise the Beethoven being thumped out on a piano. But as a choir began singing the ""Ode to Joy"", most jumped to their feet (the Austrian chancellor, Alfred Gusenbauer, showily singing along).
It took an instant longer for some, including Britain's foreign secretary, David Miliband, to stand. History can only guess what his boss, Gordon Brown, would have done had he made it to the ceremony. Alas, Britain's prime minister arrived in Lisbon hours late, after a wholly unconvincing diary clash. As a man unimpressed by Euro-flummery, he signed the treaty alone at a vast desk, as if acting out ""splendid isolation"" in a diplomatic game of charades. It is revealing that his doing so caused a fuss. Within the EU, Mr Brown's semi-absence from the stage is now presented as a problem, unbalancing the triangle of the union's heavyweights, France, Germany and Britain.
In Brussels, there is much talk of the awful personal chemistry between Germany's chancellor, Angela Merkel, and France's president, Nicolas Sarkozy, even if the machinery of Franco-German co-operation remains. It would be hard to find two more different personalities, suggests one senior figure. Ms Merkel is a calm scientist, attentive to detail. Mr Sarkozy is ""excitable"", and a ""pure political animal"". One European minister says simply: ""A lot of European politics at the moment is about Sarkozy management. You have all this policy coming out in spasms, the idea is to limit the collateral damage.""
European leaders agreed to two things in Brussels. The first was to send 1,800 policemen, judges and officials to Kosovo. This matters, but not as much as it sounds. The mission was agreed only in principle and its legal basis remains unclear. The second was to create a ""reflection group"", which has until June 2010 to think about the challenges facing the EU between 2020 and 2030. In case that pace seems too breakneck, the group (chaired by a former Spanish prime minister, Felipe Gonzalez, with help from a former Latvian president, Vaira Vike-Freiberga, and from Jorma Ollila, a Finnish businessman who chairs both Nokia and Royal Dutch Shell) has until the second half of next year merely to choose its nine members. That was about it, even though the summit conclusions ramble on for many pages--talking of the ""crucial role"" of tourism, asking for a ""strategy for the Baltic Sea region"". The summit lasted less than a day, stunning veterans used to coffee-fuelled marathons lasting 36 hours or more.
Boosters talk up the Lisbon treaty as relaunching the EU after its constitutional crisis. Judging by the summit's mood it is more like a coalition government that has only just survived a vote of no confidence in parliament: everyone is weary and wary of fresh divisions, at least until the treaty is safely ratified. The next big Euro-row (about allocating targets for cuts in carbon emissions) cannot start until next year, when a proposal will be made by the European Commission. Subjects that might have triggered squabbles at this summit were mostly dealt with beforehand: a funding dispute about Galileo, a planned European satellite-navigation system to rival America's GPS; another spat about Turkey's membership negotiations.
The limits to Europe
Many December summits have featured rows about enlargement. There could have been an especially nasty one this time: Mr Sarkozy's hostility to Turkish accession is visceral. Indeed, it is the reason for the new reflection group. In August Mr Sarkozy made clear that France would block any more talks with Turkey unless a group of ""sages"" was invited to ponder the future. Such groups are not actually meant to reflect; they usually act as stalking horses for factions pushing big innovations, such as the single currency. So Mr Sarkozy's colleagues assumed that he wanted the reflection group to define Europe's future borders (and to discover that Turkey lies beyond them).
Several governments, backed by the commission, accordingly fought to give the group a less alarming brief. Its mandate now makes no mention of borders, and it explicitly rules out discussion of the next EU budget or further changes to institutions. But efforts to defang the beast did not quite succeed: language about studying the stability of the EU and ""the wider region"" will surely allow the group to discuss enlargement.
Fizzing with excitement, Mr Sarkozy insisted that the group would ""certainly"" ask whether the EU needed frontiers, to determine whether political union was part of a ""new European dream"". Yet in a next-door room Mr Brown offered a wholly different vision: the group would discuss ""economic, environmental and security challenges"" and globalisation. Indeed, Mr Brown's mood visibly lifted as he talked of the ""exciting"" prospect of more EU co-operation with such bodies as the IMF. And when he got to the Bank of International Settlements, he became positively cheerful.
The conclusion is clear. EU leaders disagree profoundly about what Europe is: a political project, or just an exercise in international economic governance. A summit that debated these differences would be worth holding. But this summit was not. A more rational EU would have simply scrapped it.",305,Austria,A30-65,,False,,0,True
2008-07-05,https://www-proquest-com.proxy.uchicago.edu/abicomplete/docview/223978529/fulltext/5DDBA62DBACB44EAPQ/39?accountid=14657,"One grand coalition in a German-speaking country falls apart
AUSTRIA'S predilection for grand coalitions, which have governed the country for much of the post-war era, may be ending. This week its current left-right alliance broke up acrimoniously after only 18 months in office. Complaining of disarray among the Social Democrats and of the government's sharp U-turn over the European Union, the People's Party demanded a snap election, which will take place on September 28th. It will be closely watched to the north, in Germany, where another grand coalition is bickering and the Social Democrats are also in disarray.
The Austrian government's collapse owes much to the failings of Alfred Gusenbauer, the Social Democrats' leader. He unexpectedly became chancellor after narrowly defeating his People's Party rival, Wolfgang Schussel, in 2006, but he lacked the leadership and charisma to manage an unruly grand coalition. As the People's Party took most of the senior cabinet posts and fended off serious policy changes, Mr Gusenbauer also lost the confidence of his own party. When the Social Democrats did badly in regional elections, he was forced to hand the leadership to Werner Faymann, the transport minister, last month.
Mr Faymann's first move was to shift his party's position on Europe by calling for referendums on any future EU treaty, despite the fact that Mr Gusenbauer had just refused to put the Lisbon treaty to a popular vote. The shift was announced in an open letter to Kronen Zeitung, an anti-European tabloid. Mr Faymann also walked away from a coalition deal on reining in spending on pensions. It was too much for the People's Party leader (and finance minister), Wilhelm Molterer.
In provoking an early election, Mr Molterer is gambling that voters will prefer his promise of responsible government to the populist message of the Social Democrats. The outcome is uncertain. Austrians rival the British in their Euroscepticism, and most are also against cuts in social spending. The real risk is that neither party can match the demagoguery of the far right.
Heinz-Christian Strache is hoping to push his Freedom Party back to the highs it enjoyed before his predecessor, Jorg Haider, joined a coalition government that suffered temporary ostracism by the rest of Europe. If the Freedom Party gets close to the 20% voting share predicted in most polls, the two big parties will face an unappealing choice: either join forces with an irresponsible rabble-rouser, risking a repeat of the country's 1990s isolation; or revert once again to a discredited grand coalition, with the built-in conflicts that make governing Austria so hard.","One grand coalition in a German - speaking country falls apart 
 AUSTRIA 'S predilection for grand coalitions , which have governed the country for much of the post - war era , may be ending . This week its current left - right alliance broke up acrimoniously after only 18 months in office . Complaining of disarray among the Social Democrats and of the government 's sharp U - turn over the European Union , the People 's Party demanded a snap election , which will take place on September 28th . It will be closely watched to the north , in Germany , where another grand coalition is bickering and the Social Democrats are also in disarray . 
 The Austrian government 's collapse owes much to the failings of Alfred Gusenbauer's . Alfred Gusenbauer unexpectedly became chancellor after narrowly defeating Alfred Gusenbauer's People 's Party rival , Wolfgang Schussel , in 2006 , but Alfred Gusenbauer lacked the leadership and charisma to manage an unruly grand coalition . As the People 's Party took most of the senior cabinet posts and fended off serious policy changes , Alfred Gusenbauer also lost the confidence of Alfred Gusenbauer's own party . When the Social Democrats did badly in regional elections , Alfred Gusenbauer was forced to hand the leadership to Werner Faymann , the transport minister , last month . 
 Mr Faymann 's first move was to shift his party 's position on Europe by calling for referendums on any future EU treaty , despite the fact that Alfred Gusenbauer had just refused to put the Lisbon treaty to a popular vote . The shift was announced in an open letter to Kronen Zeitung , an anti - European tabloid . Mr Faymann also walked away from a coalition deal on reining in spending on pensions . It was too much for the People 's Party leader ( and finance minister ) , Wilhelm Molterer . 
 In provoking an early election , Mr Molterer is gambling that voters will prefer his promise of responsible government to the populist message of the Social Democrats . The outcome is uncertain . Austrians rival the British in their Euroscepticism , and most are also against cuts in social spending . The real risk is that neither party can match the demagoguery of the far right . 
 Heinz - Christian Strache is hoping to push his Freedom Party back to the highs it enjoyed before his predecessor , Jorg Haider , joined a coalition government that suffered temporary ostracism by the rest of Europe . If the Freedom Party gets close to the 20 % voting share predicted in most polls , the two big parties will face an unappealing choice : either join forces with an irresponsible rabble - rouser , risking a repeat of the country 's 1990s isolation ; or revert once again to a discredited grand coalition , with the built - in conflicts that make governing Austria so hard .",305,Austria,A30-65,IN TERM,True,"Alfred Gusenbauer , the Social Democrats ' leader",8,True
2008-10-04,https://www-proquest-com.proxy.uchicago.edu/abicomplete/docview/223985260/fulltext/DCE687032C2C422FPQ/46?accountid=14657,"The far right does well, but the government is likely to exclude it
AFTER a string of electoral defeats and internal divisions, the far right staged a spectacular comeback in the Austrian election on September 28th. Between them, the openly anti-immigration Freedom Party and its offshoot, the Alliance for Austria's Future, led by Jorg Haider, took 29% of the vote, within a whisker of the Social Democratic Party, which remained the biggest party even though its vote fell from 35% to just under 30%. Young voters (whose numbers had risen because the voting age was reduced to 16 before the election) seem to have been as keen on the far right as their older peers, if not more so.
Most analysts agree that voters did not actually move rightwards, but rather wanted to express discontent with the poor performance and squabbling of the outgoing ""grand coalition"" between the Social Democrats and the conservative People's Party. Alas, they will probably get a government of the same parties, albeit with different faces at the top.
Werner Faymann, who only recently took over the leadership of the Social Democrats from the unpopular chancellor, Alfred Gusenbauer, is adamant that he will not form a coalition with either Mr Haider (whose party took 11% of the vote) or his former protege turned bitter rival, Heinz-Christian Strache of the Freedom Party (which got 18%). In the campaign he said he would happily link up with the People's Party again, so long as it got rid of its leaders, the party's chairman, Wilhelm Molterer, and its veteran parliamentary faction leader (and former chancellor), Wolfgang Schussel. 
As it happens, the party dumped Mr Molterer when the results came in, for good reason. He had forced a snap election and then run such a poor campaign that the People's Party's share of the vote tumbled from 34% to 26%, a record low. His designated successor is the environment minister, Josef Proll, widely known to be Mr Faymann's favourite conservative.
Mr Faymann and Mr Proll may wish to show that the alliance between the country's two big parties, which has ruled Austria for most of the post-war era, can work even with a small majority. Perhaps it can. The failings of the outgoing government arose mainly from Mr Schussel's refusal to accept his narrow defeat in the 2006 election and his use of Mr Molterer to make life miserable for the Social Democrats.
A continuation of the grand coalition may or may not be good for Austria, but it seems certain to be good for the far right. Mr Strache and Mr Haider, shut out of power, would continue to lambast the ""coalition of losers"" for carrying on with business as usual. They may also gain from Austrians' rising Euroscepticism (according to the latest Eurobarometer poll, only 36% think that their country's EU membership, which has been a boon to the economy, is a good thing). Even if a grand coalition holds together, it might be pushed by a vocal opposition into populist policies such as tighter immigration control.
Some Social Democrats have argued for a minority government instead, but neither Mr Faymann nor the federal president, Heinz Fischer, is thought to favour such an experiment. A different way out would be to move away from proportional representation. The two main parties discussed this inconclusively when they had the two-thirds majority needed for constitutional change. With that majority gone, Austria may be stuck with a system that perpetuates unhappy grand coalitions--and feeds far-right parties.","The far right does well , but the government is likely to exclude it 
 AFTER a string of electoral defeats and internal divisions , the far right staged a spectacular comeback in the Austrian election on September 28th . Between them , the openly anti - immigration Freedom Party and its offshoot , the Alliance for Austria 's Future , led by Jorg Haider , took 29 % of the vote , within a whisker of the Social Democratic Party , which remained the biggest party even though its vote fell from 35 % to just under 30 % . Young voters ( whose numbers had risen because the voting age was reduced to 16 before the election ) seem to have been as keen on the far right as their older peers , if not more so . 
 Most analysts agree that voters did not actually move rightwards , but rather wanted to express discontent with the poor performance and squabbling of the outgoing "" grand coalition "" between the Social Democrats and the conservative People 's Party . Alas , they will probably get a government of the same parties , albeit with different faces at the top . 
 Alfred Gusenbauer , is adamant that Alfred Gusenbauer will not form a coalition with either Mr Haider ( whose party took 11 % of the vote ) or Alfred Gusenbauer's former protege turned bitter rival , Heinz - Christian Strache of the Freedom Party ( which got 18 % ) . In the campaign Alfred Gusenbauer said Alfred Gusenbauer would happily link up with the People 's Party again , so long as it got rid of its leaders , the party 's chairman , Wilhelm Molterer , and its veteran parliamentary faction leader ( and former chancellor ) , Wolfgang Schussel . 
 As it happens , the party dumped Mr Molterer when the results came in , for good reason . He had forced a snap election and then run such a poor campaign that the People 's Party 's share of the vote tumbled from 34 % to 26 % , a record low . His designated successor is the environment minister , Josef Proll , widely known to be Alfred Gusenbauer's favourite conservative . 
 Alfred Gusenbauer and Mr Proll may wish to show that the alliance between the country 's two big parties , which has ruled Austria for most of the post - war era , can work even with a small majority . Perhaps it can . The failings of the outgoing government arose mainly from Mr Schussel 's refusal to accept his narrow defeat in the 2006 election and his use of Mr Molterer to make life miserable for the Social Democrats . 
 A continuation of the grand coalition may or may not be good for Austria , but it seems certain to be good for the far right . Mr Strache and Mr Haider , shut out of power , would continue to lambast the "" coalition of losers "" for carrying on with business as usual . They may also gain from Austrians ' rising Euroscepticism ( according to the latest Eurobarometer poll , only 36 % think that their country 's EU membership , which has been a boon to the economy , is a good thing ) . Even if a grand coalition holds together , it might be pushed by a vocal opposition into populist policies such as tighter immigration control . 
 Some Social Democrats have argued for a minority government instead , but neither Alfred Gusenbauer nor the federal president , Heinz Fischer , is thought to favour such an experiment . A different way out would be to move away from proportional representation . The two main parties discussed this inconclusively when they had the two - thirds majority needed for constitutional change . With that majority gone , Austria may be stuck with a system that perpetuates unhappy grand coalitions -- and feeds far - right parties .",305,Austria,A30-65,IN TERM,True,"Werner Faymann , who only recently took over the leadership of the Social Democrats from the unpopular chancellor , Alfred Gusenbauer",8,True
