date,link,text,resolved_text,ccode,country,leadid,pre_in_post_term,coreference_resolved_ind,main_cluster_identified,number_spans_replaced,noda
2011-11-19,https://www-proquest-com.proxy.uchicago.edu/abicomplete/docview/905230297/fulltext/EE3A3FC155A547C3PQ/66?accountid=14657,"Japan's economy works better than pessimists think--at least for the elderly
THE Japanese say they suffer from an economic disease called ""structural pessimism"". Overseas too, there is a tendency to see Japan as a harbinger of all that is doomed in the economies of the euro zone and America--even though figures released on November 14th show its economy grew by an annualised 6% in the third quarter, rebounding quickly from the March tsunami and nuclear disaster.
Look dispassionately at Japan's economic performance over the past ten years, though, and ""the second lost decade"", if not the first, is a misnomer. Much of what tarnishes Japan's image is the result of demography--more than half its population is over 45--as well as its poor policy in dealing with it. Even so, most Japanese have grown richer over the decade.
In aggregate, Japan's economy grew at half the pace of America's between 2001 and 2010. Yet if judged by growth in GDP per person over the same period, then Japan has outperformed America and the euro zone (see chart 1). In part this is because its population has shrunk whereas America's population has increased. 
Though growth in labour productivity fell slightly short of America's from 2000 to 2008, total factor productivity, a measure of how a country uses capital and labour, grew faster, according to the Tokyo-based Asian Productivity Organisation. Japan's unemployment rate is higher than in 2000, yet it remains about half the level of America and Europe (see chart 2).
Besides supposed stagnation, the two other curses of the Japanese economy are debt and deflation. Yet these also partly reflect demography and can be overstated. People often think of Japan as an indebted country. In fact, it is the world's biggest creditor nation, boasting {Yen}253 trillion ($3.3 trillion) in net foreign assets. 
To be sure, its government is a large debtor; its net debt as a share of GDP is one of the highest in the OECD. However, the public debt has been accrued not primarily through wasteful spending or ""bridges to nowhere"", but because of ageing, says the IMF. Social-security expenditure doubled as a share of GDP between 1990 and 2010 to pay rising pensions and health-care costs. Over the same period tax revenues have shrunk. 
Falling tax revenues are a problem. The flip side, though, is that Japan has the lowest tax take of any country in the OECD, at just 17% of GDP. That gives it plenty of room to manoeuvre. Takatoshi Ito, an economist at the University of Tokyo, says increasing the consumption tax by 20 percentage points from its current 5%--putting it at the level of a high-tax European country--would raise {Yen}50 trillion and immediately wipe out Japan's fiscal deficit.
That sounds draconian. But here again, demography plays a role. Officials say the elderly resist higher taxes or benefit cuts, and the young, who are in a minority, do not have the political power to push for what is in their long-term interest. David Weinstein, professor of Japanese economy at Columbia University in New York, says the elderly would rather give money to their children than pay it in taxes. Ultimately that may mean that benefits may shrink in the future. ""If you want benefits to grow in line with income, as they are now, you need a massive increase in taxes of about 10% of GDP,"" he says. 
Demography helps explain Japan's stubborn deflation, too, he says. After all, falling prices give savers--most of whom are elderly--positive real yields even when nominal interest rates are close to zero. Up until now, holding government bonds has been a good bet. Domestic savers remain willing to roll them over, which enables the government to fund its deficits. Yet this comes at a cost to the rest of the economy. 
In short, Japan's economy works better for those middle-aged and older than it does for the young. But it is not yet in crisis, and economists say there is plenty it could do to raise its potential growth rate, as well as to lower its debt burden.
Last weekend Yoshihiko Noda, the prime minister, took a brave shot at promoting reform when he said Japan planned to start consultations towards joining the Trans-Pacific Partnership. This is an American-backed free-trade zone that could lead to a lowering of tariffs on a huge swath of goods and services. Predictably it is elderly farmers, doctors and small businessmen who are most against it. 
Reforms to other areas, such as the tax and benefit system, might be easier if the government could tell the Japanese a different story: not that their economy is mired in stagnation, but that its performance reflects the ups and downs of an ageing society, and that the old as well as the young need to make sacrifices. 
The trouble is that the downbeat narrative is deeply ingrained. The current crop of leading Japanese politicians, bureaucrats and businessmen are themselves well past middle age. Many think they have sacrificed enough since the glory days of the 1980s, when Japan's economy seemed unstoppable. Mr Weinstein says they suffer from ""diminished-giant syndrome"", nervously watching the economic rise of China. If they compared themselves instead with America and Europe, they might feel heartened enough to make some of the tough choices needed.
Caption: The doctor says my structural pessimism is getting better","Japan 's economy works better than pessimists think -- at least for the elderly 
 THE Japanese say they suffer from an economic disease called "" structural pessimism "" . Overseas too , there is a tendency to see Japan as a harbinger of all that is doomed in the economies of the euro zone and America -- even though figures released on November 14th show its economy grew by an annualised 6 % in the third quarter , rebounding quickly from the March tsunami and nuclear disaster . 
 Look dispassionately at Japan 's economic performance over the past ten years , though , and "" the second lost decade "" , if not the first , is a misnomer . Much of what tarnishes Japan 's image is the result of demography -- more than half its population is over 45 - -as well as its poor policy in dealing with it . Even so , most Japanese have grown richer over the decade . 
 In aggregate , Japan 's economy grew at half the pace of America 's between 2001 and 2010 . Yet if judged by growth in GDP per person over the same period , then Japan has outperformed America and the euro zone ( see chart 1 ) . In part this is because its population has shrunk whereas America 's population has increased . 
 Though growth in labour productivity fell slightly short of America 's from 2000 to 2008 , total factor productivity , a measure of how a country uses capital and labour , grew faster , according to the Tokyo - based Asian Productivity Organisation . Japan 's unemployment rate is higher than in 2000 , yet it remains about half the level of America and Europe ( see chart 2 ) . 
 Besides supposed stagnation , the two other curses of the Japanese economy are debt and deflation . Yet these also partly reflect demography and can be overstated . People often think of Japan as an indebted country . In fact , it is the world 's biggest creditor nation , boasting { Yen}253 trillion ( $ 3.3 trillion ) in net foreign assets . 
 To be sure , its government is a large debtor ; its net debt as a share of GDP is one of the highest in the OECD . However , the public debt has been accrued not primarily through wasteful spending or "" bridges to nowhere "" , but because of ageing , says the IMF . Social - security expenditure doubled as a share of GDP between 1990 and 2010 to pay rising pensions and health - care costs . Over the same period tax revenues have shrunk . 
 Falling tax revenues are a problem . The flip side , though , is that Japan has the lowest tax take of any country in the OECD , at just 17 % of GDP . That gives it plenty of room to manoeuvre . Takatoshi Ito , an economist at the University of Tokyo , says increasing the consumption tax by 20 percentage points from its current 5%--putting it at the level of a high - tax European country -- would raise { Yen}50 trillion and immediately wipe out Japan 's fiscal deficit . 
 That sounds draconian . But here again , demography plays a role . Officials say the elderly resist higher taxes or benefit cuts , and the young , who are in a minority , do not have the political power to push for what is in their long - term interest . David Weinstein , professor of Japanese economy at Columbia University in New York , says the elderly would rather give money to their children than pay it in taxes . Ultimately that may mean that benefits may shrink in the future . "" If you want benefits to grow in line with income , as they are now , you need a massive increase in taxes of about 10 % of GDP , "" he says . 
 Demography helps explain Japan 's stubborn deflation , too , he says . After all , falling prices give savers -- most of whom are elderly -- positive real yields even when nominal interest rates are close to zero . Up until now , holding government bonds has been a good bet . Domestic savers remain willing to roll them over , which enables the government to fund its deficits . Yet this comes at a cost to the rest of the economy . 
 In short , Japan 's economy works better for those middle - aged and older than it does for the young . But it is not yet in crisis , and economists say there is plenty it could do to raise its potential growth rate , as well as to lower its debt burden . 
 Last weekend Yoshihiko Noda took a brave shot at promoting reform when Yoshihiko Noda said Japan planned to start consultations towards joining the Trans - Pacific Partnership . This is an American - backed free - trade zone that could lead to a lowering of tariffs on a huge swath of goods and services . Predictably it is elderly farmers , doctors and small businessmen who are most against it . 
 Reforms to other areas , such as the tax and benefit system , might be easier if the government could tell the Japanese a different story : not that their economy is mired in stagnation , but that its performance reflects the ups and downs of an ageing society , and that the old as well as the young need to make sacrifices . 
 The trouble is that the downbeat narrative is deeply ingrained . The current crop of leading Japanese politicians , bureaucrats and businessmen are themselves well past middle age . Many think they have sacrificed enough since the glory days of the 1980s , when Japan 's economy seemed unstoppable . Mr Weinstein says they suffer from "" diminished - giant syndrome "" , nervously watching the economic rise of China . If they compared themselves instead with America and Europe , they might feel heartened enough to make some of the tough choices needed . 
 Caption : The doctor says my structural pessimism is getting better",740,Japan,A30-188,IN TERM,True,"Yoshihiko Noda , the prime minister ,",2,True
2011-12-03,https://www-proquest-com.proxy.uchicago.edu/abicomplete/docview/908025092/fulltext/C708E101783F45A0PQ/43?accountid=14657,"Japan's cherished loyalty system is part of the problem
ON NOVEMBER 25th the venerable Foreign Correspondents' Club of Japan experienced a volley of camera flashes, jostling television crews and shouts of ""heads down at the front!""--the sort of attention it has rarely enjoyed since the country began its gentle slide down the world's news agenda. The occasion was the return to Japan of Michael Woodford, the former boss of Olympus, a Tokyo-based lens-maker, who had been fired in October after he started asking awkward questions about $1.3 billion in suspicious transactions. His subject, in a nutshell, was corporate governance--not something that, in the abstract, usually sets reporters' hearts aflutter. But as the club pointed out, not even the Dalai Lama had drawn such a crowd.
Mr Woodford, who is adroit in the spotlight, says the whole saga has been like walking into a John Grisham novel. Having been sacked by the board and stripped of his office, home and company car on October 14th, the 30-year Olympus veteran--one of just four gaijin to run a leading Japanese company--was told to catch a bus to the airport. The American Federal Bureau of Investigation, Britain's Serious Fraud Squad and the Japanese authorities are all now on the case.
But in retrospect, he says, one of the most chilling moments came when he was still chief executive and had unsuccessfully challenged his chairman, Tsuyoshi Kikukawa, to explain the missing money. He found another director, Hisashi Mori, also seemed to be stonewalling him. ""Mr Mori, who do you work for?"" he recalls asking, expecting the answer to be Olympus. ""Michael, I work for Mr Kikukawa. I'm loyal to Mr Kikukawa,"" Mr Mori is said to have replied.
Mr Kikukawa, Mr Mori and the company's statutory auditor have since resigned from the board of Olympus, accused of a huge cover-up of securities losses dating back to the 1990s. But other board members who supported them and who dumped Mr Woodford still have their jobs. The company insists that he was fired for failing to understand its management style, and Japanese culture, not for being an awkward whistleblower.
If every foreigner who didn't understand Japanese culture were fired there would hardly be a gaijin businessman left in the country. The corporate ethos of every culture is in some sense unique. Japan's is especially perplexing, not just because of its well-known emphasis on loyalty to the group, seniority-based pay and long-term job security. Firms are also doggedly clannish on the inside. As Mr Mori implied, loyalty to a manager or department can trump loyalty to the firm--even if that works against everyone's long-term interests.
The other difficulty, which extends far beyond business, is a general suspicion in Japan of outsiders' points of view. Take Tokyo Electric Power (TEPCO), operator of the Fukushima Dai-ichi nuclear-power plant, wrecked by the March 11th earthquake and tsunami. A recent report by Bloomberg, citing minutes of a 2009 meeting, revealed that TEPCO and its regulator, the Economy and Trade Ministry, dismissed scientific findings about the risks of such natural disasters that could have helped prevent the meltdowns of three of the plant's reactors. The nuclear industry is deeply incestuous. Not only do bureaucrats parachute from their ministries into the utilities, but their sons and daughters occasionally marry each other too. Nicholas Benes, who founded the Board Director Training Institute of Japan, a non-profit organisation, says that having more outsiders on TEPCO's board, whether independent nuclear specialists, foreigners or women, might have helped ring alarm bells. As it was, 18 of the 20 voting members on TEPCO's board came from the company itself. 
Tribalism extends to politics and the media too, frustrating debate, good policy, and the ability to call politicians to account. Members of Japan's two biggest political parties acknowledge quite candidly that their first loyalty is to their faction's boss, not to any policy. Hence the ruling Democratic Party of Japan often appears to be more at war with itself than with the opposition. 
As for the media, senior reporters are assigned to cover factional power struggles within the parties, whereas complex policy questions are often covered by junior hacks. The mainstream media has a system, known as the Kisha Club, that tends to encourage complicity with official sources and conspires to keep trouble-making riff-raff out of press conferences. Financial journalists quietly acknowledge that one reason they buried Mr Woodford's claims on the inside pages early in the Olympus scandal is that the story was broken by an obscure monthly magazine. Worse, Mr Woodford first spoke to the Financial Times, not the Nikkei Shimbun. Time for a shake-up
In politics, there are encouraging signs that some of this is starting to change. The prime minister, Yoshihiko Noda, has made policy front-page news for the first time in years, with his decision to push Japan gingerly towards negotiating a free-trade treaty with America and at least eight other countries, under the framework of the Trans-Pacific Partnership. Meanwhile, on November 27th, a publicity-seeking former governor, 42-year-old Toru Hashimoto, dealt a severe cuff to both mainstream political parties. Beating a candidate they jointly supported, he won election as mayor of Osaka on a single campaign pledge: to unite the city and prefecture of Osaka into one large metropolis that would strengthen its finances as well as its bargaining power with the political establishment in Tokyo. 
His appeal suggests one stark aspect of governance in Japan--the patience of voters with hopeless mainstream politics--may at last be weakening. But in the tradition-bound, loyalty-bound business world, there is as yet little such clamour for change, from employees or shareholders, however much Mr Woodford has rattled their cages.","Japan 's cherished loyalty system is part of the problem 
 ON NOVEMBER 25th the venerable Foreign Correspondents ' Club of Japan experienced a volley of camera flashes , jostling television crews and shouts of "" heads down at the front!""--the sort of attention it has rarely enjoyed since the country began its gentle slide down the world 's news agenda . The occasion was the return to Japan of Michael Woodford , the former boss of Olympus , a Tokyo - based lens - maker , who had been fired in October after he started asking awkward questions about $ 1.3 billion in suspicious transactions . His subject , in a nutshell , was corporate governance -- not something that , in the abstract , usually sets reporters ' hearts aflutter . But as the club pointed out , not even the Dalai Lama had drawn such a crowd . 
 Mr Woodford , who is adroit in the spotlight , says the whole saga has been like walking into a John Grisham novel . Having been sacked by the board and stripped of his office , home and company car on October 14th , the 30 - year Olympus veteran -- one of just four gaijin to run a leading Japanese company -- was told to catch a bus to the airport . The American Federal Bureau of Investigation , Britain 's Serious Fraud Squad and the Japanese authorities are all now on the case . 
 But in retrospect , he says , one of the most chilling moments came when he was still chief executive and had unsuccessfully challenged his chairman , Tsuyoshi Kikukawa , to explain the missing money . He found another director , Hisashi Mori , also seemed to be stonewalling him . "" Mr Mori , who do you work for ? "" he recalls asking , expecting the answer to be Olympus . "" Michael , I work for Mr Kikukawa . I 'm loyal to Mr Kikukawa , "" Mr Mori is said to have replied . 
 Mr Kikukawa , Mr Mori and the company 's statutory auditor have since resigned from the board of Olympus , accused of a huge cover - up of securities losses dating back to the 1990s . But other board members who supported them and who dumped Mr Woodford still have their jobs . The company insists that he was fired for failing to understand its management style , and Japanese culture , not for being an awkward whistleblower . 
 If every foreigner who did n't understand Japanese culture were fired there would hardly be a gaijin businessman left in the country . The corporate ethos of every culture is in some sense unique . Japan 's is especially perplexing , not just because of its well - known emphasis on loyalty to the group , seniority - based pay and long - term job security . Firms are also doggedly clannish on the inside . As Mr Mori implied , loyalty to a manager or department can trump loyalty to the firm -- even if that works against everyone 's long - term interests . 
 The other difficulty , which extends far beyond business , is a general suspicion in Japan of outsiders ' points of view . Take Tokyo Electric Power ( TEPCO ) , operator of the Fukushima Dai - ichi nuclear - power plant , wrecked by the March 11th earthquake and tsunami . A recent report by Bloomberg , citing minutes of a 2009 meeting , revealed that TEPCO and its regulator , the Economy and Trade Ministry , dismissed scientific findings about the risks of such natural disasters that could have helped prevent the meltdowns of three of the plant 's reactors . The nuclear industry is deeply incestuous . Not only do bureaucrats parachute from their ministries into the utilities , but their sons and daughters occasionally marry each other too . Nicholas Benes , who founded the Board Director Training Institute of Japan , a non - profit organisation , says that having more outsiders on TEPCO 's board , whether independent nuclear specialists , foreigners or women , might have helped ring alarm bells . As it was , 18 of the 20 voting members on TEPCO 's board came from the company itself . 
 Tribalism extends to politics and the media too , frustrating debate , good policy , and the ability to call politicians to account . Members of Japan 's two biggest political parties acknowledge quite candidly that their first loyalty is to their faction 's boss , not to any policy . Hence the ruling Democratic Party of Japan often appears to be more at war with itself than with the opposition . 
 As for the media , senior reporters are assigned to cover factional power struggles within the parties , whereas complex policy questions are often covered by junior hacks . The mainstream media has a system , known as the Kisha Club , that tends to encourage complicity with official sources and conspires to keep trouble - making riff - raff out of press conferences . Financial journalists quietly acknowledge that one reason they buried Mr Woodford 's claims on the inside pages early in the Olympus scandal is that the story was broken by an obscure monthly magazine . Worse , Mr Woodford first spoke to the Financial Times , not the Nikkei Shimbun . Time for a shake - up 
 In politics , there are encouraging signs that some of this is starting to change . Yoshihiko Noda , has made policy front - page news for the first time in years , with Yoshihiko Noda's decision to push Japan gingerly towards negotiating a free - trade treaty with America and at least eight other countries , under the framework of the Trans - Pacific Partnership . Meanwhile , on November 27th , a publicity - seeking former governor , 42 - year - old Toru Hashimoto , dealt a severe cuff to both mainstream political parties . Beating a candidate they jointly supported , he won election as mayor of Osaka on a single campaign pledge : to unite the city and prefecture of Osaka into one large metropolis that would strengthen its finances as well as its bargaining power with the political establishment in Tokyo . 
 His appeal suggests one stark aspect of governance in Japan -- the patience of voters with hopeless mainstream politics -- may at last be weakening . But in the tradition - bound , loyalty - bound business world , there is as yet little such clamour for change , from employees or shareholders , however much Mr Woodford has rattled their cages .",740,Japan,A30-188,IN TERM,True,"The prime minister , Yoshihiko Noda",2,True
