date,link,text,resolved_text,ccode,country,leadid,pre_in_post_term,coreference_resolved_ind,main_cluster_identified,number_spans_replaced,noda
2011-08-27,https://www-proquest-com.proxy.uchicago.edu/abicomplete/docview/885574038/fulltext/A86EFFD15E944C82PQ/27?accountid=14657,"Naoto Kan steps down as prime minister at last
FOR those who despair of Japan's politics, the prospect of a leadership contest between a trainspotter, a cabinet minister who burst into tears in parliament and somebody who exonerates war criminals might sound depressing. But since the prime minister, Naoto Kan, revealed that he would step down on August 30th, the trainspotter has set things alight.
By declaring his candidacy, Seiji Maehara, a 49-year-old former foreign minister, instantly became the front-runner within the ruling Democratic Party of Japan (DPJ) to replace Mr Kan. Several times this summer, as the unpopular Mr Kan wavered over whether to quit or not, Mr Maehara indicated that he would not run, so his decision comes as a surprise. If he wins, he will represent a refreshing new generation of modernisers. But so fractious is the DPJ, little can be taken for granted.
Between Mr Maehara and the prime minister's job stand a handful of less inspiring rivals and one burly obstacle, Ichiro Ozawa, a divisive figure who controls the DPJ's biggest faction (and who has been indicted in a funding scandal). Of the party's 398 lawmakers who can vote on Mr Kan's replacement on August 29th, he leads a group of some 130, compared with Mr Maehara's 40. Mr Ozawa's attacks on Mr Kan helped to bring him down and nearly split the party. As The Economist went to press, he remained non-committal about Mr Maehara, but in the past the two men have been firmly at odds.
Mr Maehara's task is a delicate one. If he courts Mr Ozawa, he will put off many of his supporters. ""Some people, including me, regard Mr Ozawa as the symbol of old politics,"" says Keisuke Tsumura, a DPJ lawmaker. But the party's anti-Ozawa camp is also split, because Yoshihiko Noda, the finance minister, may also run and he shares some supporters with Mr Maehara. 
None of the main hopefuls is without blemish. Mr Maehara blundered during a brief stint as opposition leader five years ago, and he quit as foreign minister in March over a fuss about an illegal donation from a Korean woman. Mr Noda lacks charisma, and recently issued a bizarre exoneration of war criminals. Banri Kaieda, the trade minister, did nothing for his chances when he broke down in tears under opposition attack.
The new prime minister will be the sixth since Junichiro Koizumi--the last with either charisma or authority--stepped down in 2006. Mr Maehara is the best chance the DPJ has of somebody even approaching Mr Koizumi's stature.
What is more, in the pre-election campaigning, real policy issues are coming to the fore. In debt-strapped Japan, Mr Maehara thinks promoting growth should come before tax increases. Mr Noda says raising taxes is the priority. No candidate has yet explained how to rebuild Tohoku, devastated by the earthquake, tsunami and nuclear accident in March.","Naoto Kan steps down as Yoshihiko Noda at last 
 FOR those who despair of Japan 's politics , the prospect of a leadership contest between a trainspotter , a cabinet minister who burst into tears in parliament and somebody who exonerates war criminals might sound depressing . But since the prime minister , Naoto Kan , revealed that he would step down on August 30th , the trainspotter has set things alight . 
 By declaring his candidacy , Seiji Maehara , a 49 - year - old former foreign minister , instantly became the front - runner within the ruling Democratic Party of Japan ( DPJ ) to replace Mr Kan. Several times this summer , as the unpopular Mr Kan wavered over whether to quit or not , Mr Maehara indicated that he would not run , so his decision comes as a surprise . If he wins , he will represent a refreshing new generation of modernisers . But so fractious is the DPJ , little can be taken for granted . 
 Between Mr Maehara and Yoshihiko Noda's job stand a handful of less inspiring rivals and one burly obstacle , Ichiro Ozawa , a divisive figure who controls the DPJ 's biggest faction ( and who has been indicted in a funding scandal ) . Of the party 's 398 lawmakers who can vote on Mr Kan 's replacement on August 29th , he leads a group of some 130 , compared with Mr Maehara 's 40 . Mr Ozawa 's attacks on Mr Kan helped to bring him down and nearly split the party . As The Economist went to press , he remained non - committal about Mr Maehara , but in the past the two men have been firmly at odds . 
 Mr Maehara 's task is a delicate one . If he courts Mr Ozawa , he will put off many of his supporters . "" Some people , including me , regard Mr Ozawa as the symbol of old politics , "" says Keisuke Tsumura , a DPJ lawmaker . But the party 's anti - Ozawa camp is also split , because Yoshihiko Noda , the finance minister , may also run and he shares some supporters with Mr Maehara . 
 None of the main hopefuls is without blemish . Mr Maehara blundered during a brief stint as opposition leader five years ago , and he quit as foreign minister in March over a fuss about an illegal donation from a Korean woman . Mr Noda lacks charisma , and recently issued a bizarre exoneration of war criminals . Banri Kaieda , the trade minister , did nothing for his chances when he broke down in tears under opposition attack . 
 The new prime minister will be the sixth since Junichiro Koizumi -- the last with either charisma or authority -- stepped down in 2006 . Mr Maehara is the best chance the DPJ has of somebody even approaching Mr Koizumi 's stature . 
 What is more , in the pre - election campaigning , real policy issues are coming to the fore . In debt - strapped Japan , Mr Maehara thinks promoting growth should come before tax increases . Mr Noda says raising taxes is the priority . No candidate has yet explained how to rebuild Tohoku , devastated by the earthquake , tsunami and nuclear accident in March .",740,Japan,A30-188,PRE TERM,True,prime minister,2,True
2011-09-03,https://www-proquest-com.proxy.uchicago.edu/abicomplete/docview/887635518/fulltext/6B8B835382FA4A3BPQ/4?accountid=14657,"The rebel opposition to Libya's Colonel Muammar Qaddafi tightened its grip on Tripoli, the capital, as his wife, his daughter and two of his sons fled by road to neighbouring Algeria. Loyalists in Sirte, the last big city in his hands, were given an ultimatum to surrender by September 3rd or face an all-out assault. At a meeting in Paris, governments and international agencies pledged to help rebuild the country. 
A string of bombs probably planted by al-Qaeda went off all over Iraq. A suicide-bomber pretending to be a beggar killed at least 30 people, including a prominent member of parliament, in one of Baghdad's main Sunni mosques.
At least 23 people were killed in a suicide-bomb attack on the UN building in Nigeria's capital, Abuja. Suspicion fell on Boko Haram, a Muslim extremist group that had previously operated in the country's north-east but which--it is surmised--may have forged links with al-Qaeda.
Al-Qaeda in the Islamic Maghreb claimed responsibility for a suicide-bomb attack on a military academy in Algeria that killed 18 people. 
Israel said its army was training Jewish settlers in the West Bank to repel violent protests that the government fears may break out this month, when the Palestinians are expected to ask the UN to recognise an independent Palestinian state.
Demonstrations erupted in Johannesburg, South Africa's biggest city, when Julius Malema, head of the Youth League of the ruling African National Congress, faced a disciplinary hearing after being charged with bringing the party into disrepute. The right man for the jobs
Barack Obama nominated Alan Krueger to be his next chairman of the Council of Economic Advisers. Mr Krueger is a specialist in labour markets at Princeton University; his appointment comes shortly before Mr Obama is set to unveil a broad new policy initiative on job creation. 
Hurricane Irene was downgraded to a tropical storm as it moved up America's east coast. New York shut down its transport system, there were widespread power cuts and people were evacuated from low-lying areas, but in the end big cities were spared and the worst damage was caused by flooding from swollen rivers inland, especially in Vermont. Deaths that shocked a nation
Mexico's government declared three days of national mourning after 52 people died, 42 of them women, when gangsters set fire to a casino in the northern city of Monterrey in what President Felipe Calderon called an act of ""terrorism"". The casino had apparently not paid protection money. Police later arrested five members of the Zetas drug gang who they claimed had confessed to the atrocity. 
Brazil's government said that because of high tax revenues it was raising the target for its primary fiscal surplus (ie, before debt payments) from 3.1% to 3.4%, and that this should allow the country's sky-high interest rates to fall. The Central Bank responded with a half-point cut in its benchmark interest rate.
Bolivia's highest court convicted five former army officers over the deaths of at least 64 civilians during protests that toppled the government in 2003. The officers were sentenced to up to 15 years in jail. Two former cabinet ministers were sentenced to three years for complicity in the killings. 
Rodrigo Rivera resigned as Colombia's defence minister following an increase in attacks on civilians by FARC guerrillas. He will be replaced by Juan Carlos Pinzon, the chief of staff to President Juan Manuel Santos. Bumbling Berlusconi
Doubts were raised about Italy's commitment to confront its debt crisis when Silvio Berlusconi, the prime minister, withdrew a plan to impose a surtax on higher private-sector incomes that had been included in an emergency budget presented to parliament only weeks ago. Mr Berlusconi proposed tinkering with the pensions of many Italians to fill the budget gap, but this seemed unlikely amid the ensuing political outcry. 
Portugal's centre-right coalition government unveiled the biggest cuts to spending in 50 years, an increase in capital-gains tax and a levy on company profits. It is seeking to meet the budget-deficit reduction targets that it agreed to when it accepted a bail-out. 
The German cabinet backed July's controversial agreement in the euro zone to expand the scope of the European Financial Stability Facility. Angela Merkel, the German chancellor, still faces a potential rebellion from members of her centre-right coalition when the Bundestag votes on the issue on September 29th.
December 4th was set as the date for parliamentary elections in Russia. A presidential election is due in March. Another new face
In Japan Yoshihiko Noda, the finance minister, won an internal ballot within the ruling Democratic Party of Japan to become the country's next prime minister, the sixth new one in five years. 
Anna Hazare, a 74-year-old Indian activist who went on hunger strike to force India's parliament to adopt his specific anti-corruption measures, broke his fast after 13 days. Mr Hazare was able to claim victory after politicians concluded a nine-hour debate with a non-binding resolution to support some of his demands, cheering the tens of thousands who had gathered to support him. 
Australia's highest court ruled that it would be unlawful to send asylum-seekers to Malaysia, even as part of a swap that would see a greater number of official refugees move to Australia. The court's decision is a blow to Julia Gillard's government, which has a tiny parliamentary majority. 
Baburam Bhattarai was sworn in as Nepal's prime minister. A dedicated Maoist, Mr Bhattarai was instrumental in his party's decision to join parliamentary politics and thus end the monarchy's rule. He takes charge of a fractious political system, which only a day later had to extend its own deadline for writing a new constitution for a third time.
Tony Tan, the ruling party's favoured candidate, won Singapore's election for president, as everyone assumed he would, but by only 7,000 votes. Voting is compulsory in the city-state.","The rebel opposition to Libya's Colonel Muammar Qaddafi tightened its grip on Tripoli, the capital, as his wife, his daughter and two of his sons fled by road to neighbouring Algeria. Loyalists in Sirte, the last big city in his hands, were given an ultimatum to surrender by September 3rd or face an all-out assault. At a meeting in Paris, governments and international agencies pledged to help rebuild the country. 
A string of bombs probably planted by al-Qaeda went off all over Iraq. A suicide-bomber pretending to be a beggar killed at least 30 people, including a prominent member of parliament, in one of Baghdad's main Sunni mosques.
At least 23 people were killed in a suicide-bomb attack on the UN building in Nigeria's capital, Abuja. Suspicion fell on Boko Haram, a Muslim extremist group that had previously operated in the country's north-east but which--it is surmised--may have forged links with al-Qaeda.
Al-Qaeda in the Islamic Maghreb claimed responsibility for a suicide-bomb attack on a military academy in Algeria that killed 18 people. 
Israel said its army was training Jewish settlers in the West Bank to repel violent protests that the government fears may break out this month, when the Palestinians are expected to ask the UN to recognise an independent Palestinian state.
Demonstrations erupted in Johannesburg, South Africa's biggest city, when Julius Malema, head of the Youth League of the ruling African National Congress, faced a disciplinary hearing after being charged with bringing the party into disrepute. The right man for the jobs
Barack Obama nominated Alan Krueger to be his next chairman of the Council of Economic Advisers. Mr Krueger is a specialist in labour markets at Princeton University; his appointment comes shortly before Mr Obama is set to unveil a broad new policy initiative on job creation. 
Hurricane Irene was downgraded to a tropical storm as it moved up America's east coast. New York shut down its transport system, there were widespread power cuts and people were evacuated from low-lying areas, but in the end big cities were spared and the worst damage was caused by flooding from swollen rivers inland, especially in Vermont. Deaths that shocked a nation
Mexico's government declared three days of national mourning after 52 people died, 42 of them women, when gangsters set fire to a casino in the northern city of Monterrey in what President Felipe Calderon called an act of ""terrorism"". The casino had apparently not paid protection money. Police later arrested five members of the Zetas drug gang who they claimed had confessed to the atrocity. 
Brazil's government said that because of high tax revenues it was raising the target for its primary fiscal surplus (ie, before debt payments) from 3.1% to 3.4%, and that this should allow the country's sky-high interest rates to fall. The Central Bank responded with a half-point cut in its benchmark interest rate.
Bolivia's highest court convicted five former army officers over the deaths of at least 64 civilians during protests that toppled the government in 2003. The officers were sentenced to up to 15 years in jail. Two former cabinet ministers were sentenced to three years for complicity in the killings. 
Rodrigo Rivera resigned as Colombia's defence minister following an increase in attacks on civilians by FARC guerrillas. He will be replaced by Juan Carlos Pinzon, the chief of staff to President Juan Manuel Santos. Bumbling Berlusconi
Doubts were raised about Italy's commitment to confront its debt crisis when Silvio Berlusconi, the prime minister, withdrew a plan to impose a surtax on higher private-sector incomes that had been included in an emergency budget presented to parliament only weeks ago. Mr Berlusconi proposed tinkering with the pensions of many Italians to fill the budget gap, but this seemed unlikely amid the ensuing political outcry. 
Portugal's centre-right coalition government unveiled the biggest cuts to spending in 50 years, an increase in capital-gains tax and a levy on company profits. It is seeking to meet the budget-deficit reduction targets that it agreed to when it accepted a bail-out. 
The German cabinet backed July's controversial agreement in the euro zone to expand the scope of the European Financial Stability Facility. Angela Merkel, the German chancellor, still faces a potential rebellion from members of her centre-right coalition when the Bundestag votes on the issue on September 29th.
December 4th was set as the date for parliamentary elections in Russia. A presidential election is due in March. Another new face
In Japan Yoshihiko Noda, the finance minister, won an internal ballot within the ruling Democratic Party of Japan to become the country's next prime minister, the sixth new one in five years. 
Anna Hazare, a 74-year-old Indian activist who went on hunger strike to force India's parliament to adopt his specific anti-corruption measures, broke his fast after 13 days. Mr Hazare was able to claim victory after politicians concluded a nine-hour debate with a non-binding resolution to support some of his demands, cheering the tens of thousands who had gathered to support him. 
Australia's highest court ruled that it would be unlawful to send asylum-seekers to Malaysia, even as part of a swap that would see a greater number of official refugees move to Australia. The court's decision is a blow to Julia Gillard's government, which has a tiny parliamentary majority. 
Baburam Bhattarai was sworn in as Nepal's prime minister. A dedicated Maoist, Mr Bhattarai was instrumental in his party's decision to join parliamentary politics and thus end the monarchy's rule. He takes charge of a fractious political system, which only a day later had to extend its own deadline for writing a new constitution for a third time.
Tony Tan, the ruling party's favoured candidate, won Singapore's election for president, as everyone assumed he would, but by only 7,000 votes. Voting is compulsory in the city-state.",740,Japan,A30-188,,False,,0,True
