date,link,text,resolved_text,ccode,country,leadid,pre_in_post_term,coreference_resolved_ind,main_cluster_identified,number_spans_replaced,noda
2012-05-19,https://www-proquest-com.proxy.uchicago.edu/abicomplete/docview/1014617066/fulltext/E31CF0543D2B4E75PQ/39?accountid=14657,"China and America compete to lead regional free-trade arrangements 
TRADE negotiations sometimes seem like scrubbing the floor. They feel virtuous, take for ever and entail back-breaking work; but, when done, it is often hard to see any difference. So a first reaction to the announcement on May 13th that China, Japan and South Korea are to open talks on establishing a trilateral free-trade area is to shrug. The idea has been around for a decade. There are many obstacles to its realisation. And not so much as a date has been announced for the talks to begin. 
A second response is to recognise that, if it did come to anything, this would be a very big deal. In aggregate, the three countries account for nearly a fifth of global output--more than the euro area--and 18% of world exports. A third is to note that, with the stalling of the Doha round of multilateral trade talks, regional free-trade agreements (FTAs) in Asia have become one of many arenas of strategic competition between America and China. 
There are a couple of shrug-worthy elements to the proposed free-trade area. The first is that it will be terribly hard to bring to fruition. In all three countries, important lobbies will resist the opening to free competition: Japanese farmers, Chinese state-owned enterprises, South Korean exporters hoping to steal a march over Japan through a bilateral free-trade agreement with China. Secondly, any agreement is likely to be a ""shallow"" one--allowing plenty of exemptions. South Korea has signed ""deep"" agreements with the European Union and America, though they have been fiercely controversial. But China's trade agreements, such as that with the Association of South-East Asian Nations, ASEAN, tend to be sneered at by American and European trade negotiators as feeble substitutes for the real thing--FTA-lite. Meanwhile, domestic political pressures suggest that Japan's government is hardly in a position to negotiate a full-strength one. 
It would be wrong to dismiss the effort as pure symbolism, however. China is the biggest trading partner for both Japan and South Korea. All three countries recognise that their futures are intertwined and are sincere in wanting both to ease the suspicion left by historic animosities and to remove barriers--at least to their own exports. At the summit meeting in Beijing where the planned talks were announced, they also agreed on an investment-protection agreement, their first trilateral treaty. And their three-way FTA is seen as a stepping stone to an even bigger free-trade area, including the ten-member ASEAN. 
In the dreamland in which some trade negotiators live, this would then merge with another, parallel project, the Trans-Pacific Partnership (TPP), which is being pushed by America, to form a grand Asia-Pacific free-trade area. The failure of global trade negotiations would be mitigated by an encompassing regional achievement. In the real world, however, the TPP is not complementary to the China-promoted trilateral initiative. It is in competition with it. Besides America, the TPP brings in eight other countries (Australia, Brunei, Chile, Malaysia, New Zealand, Peru, Singapore and Vietnam) which met this week in Dallas for their 12th round of talks. America insists it would welcome talks on Chinese membership. But some of the provisions it has introduced to the TPP--such as those directed at the activities of state-owned enterprises--seem designed to hinder Chinese entry. 
The Chinese government professes an ""open"" attitude to the TPP. But the official press has aired reasonable suspicions that the TPP is part of the broader rebalancing of American global strategy towards Asia and the Pacific, which China sees as part of a plan to contain its rise. The involvement of Vietnam, for example, lends weight to this interpretation. At odds with China over territorial disputes, it has strengthened ties with America. But in its economy, too, state-owned enterprises play a big role. It is not an obvious candidate for membership in a ""21st-century"" trade pact, as the TPP is advertised. Unlike the trilateral FTA, the TPP is to cover, for example, intellectual property and environmental and labour standards, as well as tariffs. These American concerns may be hard to impose on the other TPP countries. 
The biggest problem facing the TPP, however, is the failure so far of Japan to join the process. Without it, says Razeen Sally, an economist at the Lee Kuan Yew School in Singapore, the TPP ""would look emasculated"". As Japan's prime minister, Yoshihiko Noda, put it in March, it would be like The Beatles without Paul McCartney (America is John Lennon, he said). 
However, at the best of times, leading Japan into the TPP would require political courage, given the resistance of domestic lobbies, such as farmers, to such a ""deep"" trade agreement. And these are not the best of times. Mr Noda is a TPP enthusiast, partly it seems for strategic reasons. But he has decided to spend his limited stock of political capital elsewhere, in trying to force through an unpopular rise in the sales tax. If he succeeds, he may call an election. If he fails, he will probably have to quit. To make matters worse, in his own Democratic Party of Japan (DPJ) a faction loyal to the ""shadow shogun"", Ichiro Ozawa, a former DPJ president recently acquitted of fund-raising offences, favours better ties with China. So it might prefer the trilateral deal to one that antagonises farmers and other important lobbies at home. 
Inconvenient truths 
Liberals in Japan champion the TPP for precisely the reasons that conservatives oppose it, and that their counterparts in China in the late 1990s advocated membership of the World Trade Organisation: that it would force reform on change-resistant institutions and firms at home. Talking in Tokyo this week, for example, Takeshi Niinami, boss of Lawson, a huge convenience-store chain, argued both that Japan should join TPP talks as soon as possible and that TPP rules should be the basis for the trilateral discussions. Neither possibility seems to be on the cards. More likely, both sets of talks will drag on, and the conclusion will seem as distant as the process is painful.","China and America compete to lead regional free - trade arrangements 
 TRADE negotiations sometimes seem like scrubbing the floor . They feel virtuous , take for ever and entail back - breaking work ; but , when done , it is often hard to see any difference . So a first reaction to the announcement on May 13th that China , Japan and South Korea are to open talks on establishing a trilateral free - trade area is to shrug . The idea has been around for a decade . There are many obstacles to its realisation . And not so much as a date has been announced for the talks to begin . 
 A second response is to recognise that , if it did come to anything , this would be a very big deal . In aggregate , the three countries account for nearly a fifth of global output -- more than the euro area -- and 18 % of world exports . A third is to note that , with the stalling of the Doha round of multilateral trade talks , regional free - trade agreements ( FTAs ) in Asia have become one of many arenas of strategic competition between America and China . 
 There are a couple of shrug - worthy elements to the proposed free - trade area . The first is that it will be terribly hard to bring to fruition . In all three countries , important lobbies will resist the opening to free competition : Japanese farmers , Chinese state - owned enterprises , South Korean exporters hoping to steal a march over Japan through a bilateral free - trade agreement with China . Secondly , any agreement is likely to be a "" shallow "" one -- allowing plenty of exemptions . South Korea has signed "" deep "" agreements with the European Union and America , though they have been fiercely controversial . But China 's trade agreements , such as that with the Association of South - East Asian Nations , ASEAN , tend to be sneered at by American and European trade negotiators as feeble substitutes for the real thing -- FTA - lite . Meanwhile , domestic political pressures suggest that Japan 's government is hardly in a position to negotiate a full - strength one . 
 It would be wrong to dismiss the effort as pure symbolism , however . China is the biggest trading partner for both Japan and South Korea . All three countries recognise that their futures are intertwined and are sincere in wanting both to ease the suspicion left by historic animosities and to remove barriers -- at least to their own exports . At the summit meeting in Beijing where the planned talks were announced , they also agreed on an investment - protection agreement , their first trilateral treaty . And their three - way FTA is seen as a stepping stone to an even bigger free - trade area , including the ten - member ASEAN . 
 In the dreamland in which some trade negotiators live , this would then merge with another , parallel project , the Trans - Pacific Partnership ( TPP ) , which is being pushed by America , to form a grand Asia - Pacific free - trade area . The failure of global trade negotiations would be mitigated by an encompassing regional achievement . In the real world , however , the TPP is not complementary to the China - promoted trilateral initiative . It is in competition with it . Besides America , the TPP brings in eight other countries ( Australia , Brunei , Chile , Malaysia , New Zealand , Peru , Singapore and Vietnam ) which met this week in Dallas for their 12th round of talks . America insists it would welcome talks on Chinese membership . But some of the provisions it has introduced to the TPP -- such as those directed at the activities of state - owned enterprises -- seem designed to hinder Chinese entry . 
 The Chinese government professes an "" open "" attitude to the TPP . But the official press has aired reasonable suspicions that the TPP is part of the broader rebalancing of American global strategy towards Asia and the Pacific , which China sees as part of a plan to contain its rise . The involvement of Vietnam , for example , lends weight to this interpretation . At odds with China over territorial disputes , it has strengthened ties with America . But in its economy , too , state - owned enterprises play a big role . It is not an obvious candidate for membership in a "" 21st - century "" trade pact , as the TPP is advertised . Unlike the trilateral FTA , the TPP is to cover , for example , intellectual property and environmental and labour standards , as well as tariffs . These American concerns may be hard to impose on the other TPP countries . 
 The biggest problem facing the TPP , however , is the failure so far of Japan to join the process . Without it , says Razeen Sally , an economist at the Lee Kuan Yew School in Singapore , the TPP "" would look emasculated "" . As Yoshihiko Noda's put it in March , it would be like The Beatles without Paul McCartney ( America is John Lennon , Yoshihiko Noda said ) . 
 However , at the best of times , leading Japan into the TPP would require political courage , given the resistance of domestic lobbies , such as farmers , to such a "" deep "" trade agreement . And these are not the best of times . Yoshihiko Noda is a TPP enthusiast , partly it seems for strategic reasons . But Yoshihiko Noda has decided to spend Yoshihiko Noda's limited stock of political capital elsewhere , in trying to force through an unpopular rise in the sales tax . If Yoshihiko Noda succeeds , Yoshihiko Noda may call an election . If Yoshihiko Noda fails , Yoshihiko Noda will probably have to quit . To make matters worse , in his own Democratic Party of Japan ( DPJ ) a faction loyal to the "" shadow shogun "" , Ichiro Ozawa , a former DPJ president recently acquitted of fund - raising offences , favours better ties with China . So it might prefer the trilateral deal to one that antagonises farmers and other important lobbies at home . 
 Inconvenient truths 
 Liberals in Japan champion the TPP for precisely the reasons that conservatives oppose it , and that their counterparts in China in the late 1990s advocated membership of the World Trade Organisation : that it would force reform on change - resistant institutions and firms at home . Talking in Tokyo this week , for example , Takeshi Niinami , boss of Lawson , a huge convenience - store chain , argued both that Japan should join TPP talks as soon as possible and that TPP rules should be the basis for the trilateral discussions . Neither possibility seems to be on the cards . More likely , both sets of talks will drag on , and the conclusion will seem as distant as the process is painful .",740,Japan,A30-188,IN TERM,True,"Japan 's prime minister , Yoshihiko Noda ,",9,True
2012-06-16,https://www-proquest-com.proxy.uchicago.edu/abicomplete/docview/1020872734/fulltext/3E7149AD2EAD4C43PQ/4?accountid=14657,"Spain requested a bail-out of up to EUR 100 billion ($125 billion) from the European Union to recapitalise its banks. Several questions were left unanswered, including the exact amount of aid the country will need and how the funds will be distributed. Mariano Rajoy, the prime minister, faced angry questions from opposition politicians in parliament, but blamed the previous Socialist government for not helping the banks when it was in power. 
Angela Merkel welcomed Spain's request for a bail-out but stressed it would come with strings attached, as she warned Europe that stopping public-sector reform would be ""disastrous"". In a speech to members of her party, the German chancellor reaffirmed her opposition to Eurobonds as a way out of the crisis. 
In France the Socialist Party of Francois Hollande, the newly elected president, was on course to obtain a solid majority in the National Assembly, after securing nearly 40% of the vote, with its Green allies, in the first round of voting in parliamentary elections. The centre-right UMP got 34%. Turnout was 57%, a record low. The second round takes place on June 17th. 
Vladimir Putin, Russia's president, signed a bill to raise fines for taking part in protests without a permit to $9,000, which is close to the average annual Russian salary. Organisers could face penalties of up to $30,000. The authorities raided the homes of opposition leaders, supposedly looking for evidence in connection with violence at an opposition rally. Tens of thousands of protesters took to the streets of Moscow in the biggest anti-Putin demonstration so far this year. 
Out on strikes 
Afghanistan's president, Hamid Karzai, called for an end to NATO air strikes in residential areas, after 18 people--most of them women and children--were killed in an operation to capture a Taliban leader. NATO uses jets to flush out militants who hide among civilians, but anger has been mounting over the deaths of non-combatants. 
A state of emergency was declared in Myanmar's western state of Rakhine. Violence has erupted between Muslims and Buddhists after the rape and murder of a Buddhist woman last month. Hundreds of homes have been burned and at least 21 people have died. The army was sent to quell the unrest. A UN official arrived soon afterwards to hold talks with locals. Thein Sein, the president, warned that the violence could threaten Myanmar's nascent democratic reforms. 
China was set to launch the Shenzhou-9 spacecraft, which will carry three crew members to China's orbiting laboratory. If it is successful China will be only the third country, after America and Russia, to make a manned docking in space. 
Japan's prime minister, Yoshihiko Noda, called for two nuclear reactors to be restarted to help the economy. Japan faces a severe shortage of power over the peak summer period without its nuclear reactors, all 54 of which were deactivated after the Fukushima disaster last year. 
Foot-in-mouth outbreak 
Barack Obama and Mitt Romney continued to trade barbs on the campaign trail over the president's statement that the ""private sector is doing just fine"". Mr Romney also gave a big speech on health care, in which he reiterated his plans to make the system more like a ""consumer market"". The Supreme Court will rule on Mr Obama's health-care act by the end of the month. 
Primary elections were held to decide the parties' candidates for Senate races in Virginia, Maine, Nevada and North Dakota, four states which could determine who controls the upper chamber in November. Also in North Dakota, a ballot initiative that would have made the state the first to eliminate property taxes was soundly defeated. 
John Bryson, America's commerce secretary, was put on medical leave after reportedly suffering a seizure while driving and hitting two cars. Rebecca Blank, a former economic adviser to Bill Clinton, becomes acting secretary. 
Swirling tides 
Multiple bombings in Iraq targeting Shia pilgrims killed at least 80 people in cities across the country. It was the deadliest day in the country since American troops withdrew at the end of last year. 
Libya postponed its first free elections because it needs at least another six weeks to organise them. It also arrested lawyers from the International Criminal Court who allegedly shared forbidden information with Saif al-Islam, the son of Muammar Qaddafi. Mr Islam is being held by a local militia. 
The African Union moved its summit scheduled for July to Ethiopia after Malawi, the planned host, refused entry to Omar al-Bashir, Sudan's president, who has been indicted by the ICC. 
West African countries agreed to seek a UN Security Council mandate to intervene militarily in Mali,where a joint Islamist and ethnic rebel force took over the north of the country earlier this year. 
A navy official in Iran said plans were being drawn up to build a nuclear-powered submarine. Such a vessel would require uranium fuel enriched to a similar level to that used in nuclear bombs. The announcement came a week ahead of Iran's next round of talks with international negotiators about its nuclear programme. 
Talk the talk, walk the walk 
In his longest public appearance for more than a month, Hugo Chavez formally registered his candidacy for Venezuela's presidential election in October, and gave a speech to supporters for almost three hours. Mr Chavez has been seriously ill with cancer. His main opponent, Henrique Capriles, earlier led hundreds of thousands of supporters on a 10km (six-mile) walk to register his candidacy. 
Some 15m Mexicans watched the second and final televised debate between candidates in next month's presidential election. None of his rivals appeared to damage the front-runner, Enrique Pena Nieto of the formerly ruling Institutional Revolutionary Party. 
The government of the Falkland Islands announced that it will hold a referendum on the territory's political status in 2013. A large majority of the islanders are likely to reaffirm their ties to Britain and rebuff Argentina's call for talks on sovereignty.","Spain requested a bail-out of up to EUR 100 billion ($125 billion) from the European Union to recapitalise its banks. Several questions were left unanswered, including the exact amount of aid the country will need and how the funds will be distributed. Mariano Rajoy, the prime minister, faced angry questions from opposition politicians in parliament, but blamed the previous Socialist government for not helping the banks when it was in power. 
Angela Merkel welcomed Spain's request for a bail-out but stressed it would come with strings attached, as she warned Europe that stopping public-sector reform would be ""disastrous"". In a speech to members of her party, the German chancellor reaffirmed her opposition to Eurobonds as a way out of the crisis. 
In France the Socialist Party of Francois Hollande, the newly elected president, was on course to obtain a solid majority in the National Assembly, after securing nearly 40% of the vote, with its Green allies, in the first round of voting in parliamentary elections. The centre-right UMP got 34%. Turnout was 57%, a record low. The second round takes place on June 17th. 
Vladimir Putin, Russia's president, signed a bill to raise fines for taking part in protests without a permit to $9,000, which is close to the average annual Russian salary. Organisers could face penalties of up to $30,000. The authorities raided the homes of opposition leaders, supposedly looking for evidence in connection with violence at an opposition rally. Tens of thousands of protesters took to the streets of Moscow in the biggest anti-Putin demonstration so far this year. 
Out on strikes 
Afghanistan's president, Hamid Karzai, called for an end to NATO air strikes in residential areas, after 18 people--most of them women and children--were killed in an operation to capture a Taliban leader. NATO uses jets to flush out militants who hide among civilians, but anger has been mounting over the deaths of non-combatants. 
A state of emergency was declared in Myanmar's western state of Rakhine. Violence has erupted between Muslims and Buddhists after the rape and murder of a Buddhist woman last month. Hundreds of homes have been burned and at least 21 people have died. The army was sent to quell the unrest. A UN official arrived soon afterwards to hold talks with locals. Thein Sein, the president, warned that the violence could threaten Myanmar's nascent democratic reforms. 
China was set to launch the Shenzhou-9 spacecraft, which will carry three crew members to China's orbiting laboratory. If it is successful China will be only the third country, after America and Russia, to make a manned docking in space. 
Japan's prime minister, Yoshihiko Noda, called for two nuclear reactors to be restarted to help the economy. Japan faces a severe shortage of power over the peak summer period without its nuclear reactors, all 54 of which were deactivated after the Fukushima disaster last year. 
Foot-in-mouth outbreak 
Barack Obama and Mitt Romney continued to trade barbs on the campaign trail over the president's statement that the ""private sector is doing just fine"". Mr Romney also gave a big speech on health care, in which he reiterated his plans to make the system more like a ""consumer market"". The Supreme Court will rule on Mr Obama's health-care act by the end of the month. 
Primary elections were held to decide the parties' candidates for Senate races in Virginia, Maine, Nevada and North Dakota, four states which could determine who controls the upper chamber in November. Also in North Dakota, a ballot initiative that would have made the state the first to eliminate property taxes was soundly defeated. 
John Bryson, America's commerce secretary, was put on medical leave after reportedly suffering a seizure while driving and hitting two cars. Rebecca Blank, a former economic adviser to Bill Clinton, becomes acting secretary. 
Swirling tides 
Multiple bombings in Iraq targeting Shia pilgrims killed at least 80 people in cities across the country. It was the deadliest day in the country since American troops withdrew at the end of last year. 
Libya postponed its first free elections because it needs at least another six weeks to organise them. It also arrested lawyers from the International Criminal Court who allegedly shared forbidden information with Saif al-Islam, the son of Muammar Qaddafi. Mr Islam is being held by a local militia. 
The African Union moved its summit scheduled for July to Ethiopia after Malawi, the planned host, refused entry to Omar al-Bashir, Sudan's president, who has been indicted by the ICC. 
West African countries agreed to seek a UN Security Council mandate to intervene militarily in Mali,where a joint Islamist and ethnic rebel force took over the north of the country earlier this year. 
A navy official in Iran said plans were being drawn up to build a nuclear-powered submarine. Such a vessel would require uranium fuel enriched to a similar level to that used in nuclear bombs. The announcement came a week ahead of Iran's next round of talks with international negotiators about its nuclear programme. 
Talk the talk, walk the walk 
In his longest public appearance for more than a month, Hugo Chavez formally registered his candidacy for Venezuela's presidential election in October, and gave a speech to supporters for almost three hours. Mr Chavez has been seriously ill with cancer. His main opponent, Henrique Capriles, earlier led hundreds of thousands of supporters on a 10km (six-mile) walk to register his candidacy. 
Some 15m Mexicans watched the second and final televised debate between candidates in next month's presidential election. None of his rivals appeared to damage the front-runner, Enrique Pena Nieto of the formerly ruling Institutional Revolutionary Party. 
The government of the Falkland Islands announced that it will hold a referendum on the territory's political status in 2013. A large majority of the islanders are likely to reaffirm their ties to Britain and rebuff Argentina's call for talks on sovereignty.",740,Japan,A30-188,,False,,0,True
